Sheet: Table1
A1: log_date | B1: ActionType | C1: Candy | D1: using | E1: month | F1: sum | G1: flag
A2: 2015-03-01 오전 12:00:00 | B2: GARDEN_REWARD | C2: -98786 | D2: =ABS(RC[-1]) -> 98786 | E2: 2015-03 | F2: 98786 | G2: 1
A3: 2015-03-02 오전 12:00:00 | B3: GARDEN_REWARD | C3: -63494 | D3: =ABS(RC[-1]) -> 63494 | E3: 2015-03 | F3: 162280 | G3: 1
A4: 2015-03-03 오전 12:00:00 | B4: GARDEN_REWARD | C4: -56652 | D4: =ABS(RC[-1]) -> 56652 | E4: 2015-03 | F4: 218932 | G4: 1
A5: 2015-03-04 오전 12:00:00 | B5: GARDEN_REWARD | C5: -50550 | D5: =ABS(RC[-1]) -> 50550 | E5: 2015-03 | F5: 269482 | G5: 1
A6: 2015-03-05 오전 12:00:00 | B6: GARDEN_REWARD | C6: -52650 | D6: =ABS(RC[-1]) -> 52650 | E6: 2015-03 | F6: 322132 | G6: 1
A7: 2015-03-06 오전 12:00:00 | B7: GARDEN_REWARD | C7: -53172 | D7: =ABS(RC[-1]) -> 53172 | E7: 2015-03 | F7: 375304 | G7: 1
A8: 2015-03-07 오전 12:00:00 | B8: GARDEN_REWARD | C8: -49638 | D8: =ABS(RC[-1]) -> 49638 | E8: 2015-03 | F8: 424942 | G8: 1
A9: 2015-03-08 오전 12:00:00 | B9: GARDEN_REWARD | C9: -52634 | D9: =ABS(RC[-1]) -> 52634 | E9: 2015-03 | F9: 477576 | G9: 1
A10: 2015-03-09 오전 12:00:00 | B10: GARDEN_REWARD | C10: -52734 | D10: =ABS(RC[-1]) -> 52734 | E10: 2015-03 | F10: 530310 | G10: 1
A11: 2015-03-10 오전 12:00:00 | B11: GARDEN_REWARD | C11: -47684 | D11: =ABS(RC[-1]) -> 47684 | E11: 2015-03 | F11: 577994 | G11: 1
A12: 2015-03-11 오전 12:00:00 | B12: GARDEN_REWARD | C12: -47392 | D12: =ABS(RC[-1]) -> 47392 | E12: 2015-03 | F12: 625386 | G12: 1
A13: 2015-03-12 오전 12:00:00 | B13: GARDEN_REWARD | C13: -50162 | D13: =ABS(RC[-1]) -> 50162 | E13: 2015-03 | F13: 675548 | G13: 1
A14: 2015-03-13 오전 12:00:00 | B14: GARDEN_REWARD | C14: -50022 | D14: =ABS(RC[-1]) -> 50022 | E14: 2015-03 | F14: 725570 | G14: 1
A15: 2015-03-14 오전 12:00:00 | B15: GARDEN_REWARD | C15: -50600 | D15: =ABS(RC[-1]) -> 50600 | E15: 2015-03 | F15: 776170 | G15: 1
A16: 2015-03-15 오전 12:00:00 | B16: GARDEN_REWARD | C16: -44616 | D16: =ABS(RC[-1]) -> 44616 | E16: 2015-03 | F16: 820786 | G16: 1
A17: 2015-03-16 오전 12:00:00 | B17: GARDEN_REWARD | C17: -46636 | D17: =ABS(RC[-1]) -> 46636 | E17: 2015-03 | F17: 867422 | G17: 1
A18: 2015-03-17 오전 12:00:00 | B18: GARDEN_REWARD | C18: -45572 | D18: =ABS(RC[-1]) -> 45572 | E18: 2015-03 | F18: 912994 | G18: 1
A19: 2015-03-18 오전 12:00:00 | B19: GARDEN_REWARD | C19: -44279 | D19: =ABS(RC[-1]) -> 44279 | E19: 2015-03 | F19: 957273 | G19: 1
A20: 2015-03-19 오전 12:00:00 | B20: GARDEN_REWARD | C20: -43944 | D20: =ABS(RC[-1]) -> 43944 | E20: 2015-03 | F20: 1001217 | G20: 1
A21: 2015-03-20 오전 12:00:00 | B21: GARDEN_REWARD | C21: -47900 | D21: =ABS(RC[-1]) -> 47900 | E21: 2015-03 | F21: 1049117 | G21: 1
A22: 2015-03-21 오전 12:00:00 | B22: GARDEN_REWARD | C22: -42446 | D22: =ABS(RC[-1]) -> 42446 | E22: 2015-03 | F22: 1091563 | G22: 1
A23: 2015-03-22 오전 12:00:00 | B23: GARDEN_REWARD | C23: -40880 | D23: =ABS(RC[-1]) -> 40880 | E23: 2015-03 | F23: 1132443 | G23: 1
A24: 2015-03-23 오전 12:00:00 | B24: GARDEN_REWARD | C24: -44882 | D24: =ABS(RC[-1]) -> 44882 | E24: 2015-03 | F24: 1177325 | G24: 1
A25: 2015-03-24 오전 12:00:00 | B25: GARDEN_REWARD | C25: -38672 | D25: =ABS(RC[-1]) -> 38672 | E25: 2015-03 | F25: 1215997 | G25: 1
A26: 2015-03-25 오전 12:00:00 | B26: GARDEN_REWARD | C26: -41646 | D26: =ABS(RC[-1]) -> 41646 | E26: 2015-03 | F26: 1257643 | G26: 1
A27: 2015-03-26 오전 12:00:00 | B27: GARDEN_REWARD | C27: -41402 | D27: =ABS(RC[-1]) -> 41402 | E27: 2015-03 | F27: 1299045 | G27: 1
A28: 2015-03-27 오전 12:00:00 | B28: GARDEN_REWARD | C28: -38990 | D28: =ABS(RC[-1]) -> 38990 | E28: 2015-03 | F28: 1338035 | G28: 1
A29: 2015-03-28 오전 12:00:00 | B29: GARDEN_REWARD | C29: -38096 | D29: =ABS(RC[-1]) -> 38096 | E29: 2015-03 | F29: 1376131 | G29: 1
A30: 2015-03-29 오전 12:00:00 | B30: GARDEN_REWARD | C30: -36010 | D30: =ABS(RC[-1]) -> 36010 | E30: 2015-03 | F30: 1412141 | G30: 1
A31: 2015-03-30 오전 12:00:00 | B31: GARDEN_REWARD | C31: -36774 | D31: =ABS(RC[-1]) -> 36774 | E31: 2015-03 | F31: 1448915 | G31: 1
A32: 2015-03-31 오전 12:00:00 | B32: GARDEN_REWARD | C32: -39364 | D32: =ABS(RC[-1]) -> 39364 | E32: 2015-03 | F32: 1488279 | G32: 0
A33: 2015-04-01 오전 12:00:00 | B33: GARDEN_REWARD | C33: -82114 | D33: =ABS(RC[-1]) -> 82114 | E33: 2015-04 | F33: 82114 | G33: 1
A34: 2015-04-02 오전 12:00:00 | B34: GARDEN_REWARD | C34: -59023 | D34: =ABS(RC[-1]) -> 59023 | E34: 2015-04 | F34: 141137 | G34: 1
A35: 2015-04-03 오전 12:00:00 | B35: GARDEN_REWARD | C35: -65814 | D35: =ABS(RC[-1]) -> 65814 | E35: 2015-04 | F35: 206951 | G35: 1
A36: 2015-04-04 오전 12:00:00 | B36: GARDEN_REWARD | C36: -62941 | D36: =ABS(RC[-1]) -> 62941 | E36: 2015-04 | F36: 269892 | G36: 1
A37: 2015-04-05 오전 12:00:00 | B37: GARDEN_REWARD | C37: -61452 | D37: =ABS(RC[-1]) -> 61452 | E37: 2015-04 | F37: 331344 | G37: 1
A38: 2015-04-06 오전 12:00:00 | B38: GARDEN_REWARD | C38: -63155 | D38: =ABS(RC[-1]) -> 63155 | E38: 2015-04 | F38: 394499 | G38: 1
A39: 2015-04-07 오전 12:00:00 | B39: GARDEN_REWARD | C39: -63165 | D39: =ABS(RC[-1]) -> 63165 | E39: 2015-04 | F39: 457664 | G39: 1
A40: 2015-04-08 오전 12:00:00 | B40: GARDEN_REWARD | C40: -63510 | D40: =ABS(RC[-1]) -> 63510 | E40: 2015-04 | F40: 521174 | G40: 1
A41: 2015-04-09 오전 12:00:00 | B41: GARDEN_REWARD | C41: -54119 | D41: =ABS(RC[-1]) -> 54119 | E41: 2015-04 | F41: 575293 | G41: 1
A42: 2015-04-10 오전 12:00:00 | B42: GARDEN_REWARD | C42: -51358 | D42: =ABS(RC[-1]) -> 51358 | E42: 2015-04 | F42: 626651 | G42: 1
A43: 2015-04-11 오전 12:00:00 | B43: GARDEN_REWARD | C43: -47418 | D43: =ABS(RC[-1]) -> 47418 | E43: 2015-04 | F43: 674069 | G43: 1
A44: 2015-04-12 오전 12:00:00 | B44: GARDEN_REWARD | C44: -50212 | D44: =ABS(RC[-1]) -> 50212 | E44: 2015-04 | F44: 724281 | G44: 1
A45: 2015-04-13 오전 12:00:00 | B45: GARDEN_REWARD | C45: -48890 | D45: =ABS(RC[-1]) -> 48890 | E45: 2015-04 | F45: 773171 | G45: 1
A46: 2015-04-14 오전 12:00:00 | B46: GARDEN_REWARD | C46: -50154 | D46: =ABS(RC[-1]) -> 50154 | E46: 2015-04 | F46: 823325 | G46: 1
A47: 2015-04-15 오전 12:00:00 | B47: GARDEN_REWARD | C47: -47718 | D47: =ABS(RC[-1]) -> 47718 | E47: 2015-04 | F47: 871043 | G47: 1
A48: 2015-04-16 오전 12:00:00 | B48: GARDEN_REWARD | C48: -50246 | D48: =ABS(RC[-1]) -> 50246 | E48: 2015-04 | F48: 921289 | G48: 1
A49: 2015-04-17 오전 12:00:00 | B49: GARDEN_REWARD | C49: -44942 | D49: =ABS(RC[-1]) -> 44942 | E49: 2015-04 | F49: 966231 | G49: 1
A50: 2015-04-18 오전 12:00:00 | B50: GARDEN_REWARD | C50: -42746 | D50: =ABS(RC[-1]) -> 42746 | E50: 2015-04 | F50: 1008977 | G50: 1
A51: 2015-04-19 오전 12:00:00 | B51: GARDEN_REWARD | C51: -45738 | D51: =ABS(RC[-1]) -> 45738 | E51: 2015-04 | F51: 1054715 | G51: 1
A52: 2015-04-20 오전 12:00:00 | B52: GARDEN_REWARD | C52: -49240 | D52: =ABS(RC[-1]) -> 49240 | E52: 2015-04 | F52: 1103955 | G52: 1
A53: 2015-04-21 오전 12:00:00 | B53: GARDEN_REWARD | C53: -42824 | D53: =ABS(RC[-1]) -> 42824 | E53: 2015-04 | F53: 1146779 | G53: 1
A54: 2015-04-22 오전 12:00:00 | B54: GARDEN_REWARD | C54: -40456 | D54: =ABS(RC[-1]) -> 40456 | E54: 2015-04 | F54: 1187235 | G54: 1
A55: 2015-04-23 오전 12:00:00 | B55: GARDEN_REWARD | C55: -43998 | D55: =ABS(RC[-1]) -> 43998 | E55: 2015-04 | F55: 1231233 | G55: 1
A56: 2015-04-24 오전 12:00:00 | B56: GARDEN_REWARD | C56: -41398 | D56: =ABS(RC[-1]) -> 41398 | E56: 2015-04 | F56: 1272631 | G56: 1
A57: 2015-04-25 오전 12:00:00 | B57: GARDEN_REWARD | C57: -36562 | D57: =ABS(RC[-1]) -> 36562 | E57: 2015-04 | F57: 1309193 | G57: 1
A58: 2015-04-26 오전 12:00:00 | B58: GARDEN_REWARD | C58: -40746 | D58: =ABS(RC[-1]) -> 40746 | E58: 2015-04 | F58: 1349939 | G58: 1
A59: 2015-04-27 오전 12:00:00 | B59: GARDEN_REWARD | C59: -39976 | D59: =ABS(RC[-1]) -> 39976 | E59: 2015-04 | F59: 1389915 | G59: 1
A60: 2015-04-28 오전 12:00:00 | B60: GARDEN_REWARD | C60: -37680 | D60: =ABS(RC[-1]) -> 37680 | E60: 2015-04 | F60: 1427595 | G60: 1
A61: 2015-04-29 오전 12:00:00 | B61: GARDEN_REWARD | C61: -39328 | D61: =ABS(RC[-1]) -> 39328 | E61: 2015-04 | F61: 1466923 | G61: 1
A62: 2015-04-30 오전 12:00:00 | B62: GARDEN_REWARD | C62: -42004 | D62: =ABS(RC[-1]) -> 42004 | E62: 2015-04 | F62: 1508927 | G62: 0
A63: 2015-05-01 오전 12:00:00 | B63: GARDEN_REWARD | C63: -84534 | D63: =ABS(RC[-1]) -> 84534 | E63: 2015-05 | F63: 84534 | G63: 1
A64: 2015-05-02 오전 12:00:00 | B64: GARDEN_REWARD | C64: -58012 | D64: =ABS(RC[-1]) -> 58012 | E64: 2015-05 | F64: 142546 | G64: 1
A65: 2015-05-03 오전 12:00:00 | B65: GARDEN_REWARD | C65: -57143 | D65: =ABS(RC[-1]) -> 57143 | E65: 2015-05 | F65: 199689 | G65: 1
A66: 2015-05-04 오전 12:00:00 | B66: GARDEN_REWARD | C66: -56024 | D66: =ABS(RC[-1]) -> 56024 | E66: 2015-05 | F66: 255713 | G66: 1
A67: 2015-05-05 오전 12:00:00 | B67: GARDEN_REWARD | C67: -54978 | D67: =ABS(RC[-1]) -> 54978 | E67: 2015-05 | F67: 310691 | G67: 1
A68: 2015-05-06 오전 12:00:00 | B68: GARDEN_REWARD | C68: -53982 | D68: =ABS(RC[-1]) -> 53982 | E68: 2015-05 | F68: 364673 | G68: 1
A69: 2015-05-07 오전 12:00:00 | B69: GARDEN_REWARD | C69: -54736 | D69: =ABS(RC[-1]) -> 54736 | E69: 2015-05 | F69: 419409 | G69: 1
A70: 2015-05-08 오전 12:00:00 | B70: GARDEN_REWARD | C70: -48626 | D70: =ABS(RC[-1]) -> 48626 | E70: 2015-05 | F70: 468035 | G70: 1
A71: 2015-05-09 오전 12:00:00 | B71: GARDEN_REWARD | C71: -48548 | D71: =ABS(RC[-1]) -> 48548 | E71: 2015-05 | F71: 516583 | G71: 1
A72: 2015-05-10 오전 12:00:00 | B72: GARDEN_REWARD | C72: -48940 | D72: =ABS(RC[-1]) -> 48940 | E72: 2015-05 | F72: 565523 | G72: 1
A73: 2015-05-11 오전 12:00:00 | B73: GARDEN_REWARD | C73: -47884 | D73: =ABS(RC[-1]) -> 47884 | E73: 2015-05 | F73: 613407 | G73: 1
A74: 2015-05-12 오전 12:00:00 | B74: GARDEN_REWARD | C74: -47508 | D74: =ABS(RC[-1]) -> 47508 | E74: 2015-05 | F74: 660915 | G74: 1
A75: 2015-05-13 오전 12:00:00 | B75: GARDEN_REWARD | C75: -45738 | D75: =ABS(RC[-1]) -> 45738 | E75: 2015-05 | F75: 706653 | G75: 1
A76: 2015-05-14 오전 12:00:00 | B76: GARDEN_REWARD | C76: -50414 | D76: =ABS(RC[-1]) -> 50414 | E76: 2015-05 | F76: 757067 | G76: 1
A77: 2015-05-15 오전 12:00:00 | B77: GARDEN_REWARD | C77: -48840 | D77: =ABS(RC[-1]) -> 48840 | E77: 2015-05 | F77: 805907 | G77: 1
A78: 2015-05-16 오전 12:00:00 | B78: GARDEN_REWARD | C78: -40008 | D78: =ABS(RC[-1]) -> 40008 | E78: 2015-05 | F78: 845915 | G78: 1
A79: 2015-05-17 오전 12:00:00 | B79: GARDEN_REWARD | C79: -42848 | D79: =ABS(RC[-1]) -> 42848 | E79: 2015-05 | F79: 888763 | G79: 1
A80: 2015-05-18 오전 12:00:00 | B80: GARDEN_REWARD | C80: -45018 | D80: =ABS(RC[-1]) -> 45018 | E80: 2015-05 | F80: 933781 | G80: 1
A81: 2015-05-19 오전 12:00:00 | B81: GARDEN_REWARD | C81: -39584 | D81: =ABS(RC[-1]) -> 39584 | E81: 2015-05 | F81: 973365 | G81: 1
A82: 2015-05-20 오전 12:00:00 | B82: GARDEN_REWARD | C82: -39839 | D82: =ABS(RC[-1]) -> 39839 | E82: 2015-05 | F82: 1013204 | G82: 1
A83: 2015-05-21 오전 12:00:00 | B83: GARDEN_REWARD | C83: -40806 | D83: =ABS(RC[-1]) -> 40806 | E83: 2015-05 | F83: 1054010 | G83: 1
A84: 2015-05-22 오전 12:00:00 | B84: GARDEN_REWARD | C84: -43044 | D84: =ABS(RC[-1]) -> 43044 | E84: 2015-05 | F84: 1097054 | G84: 1
A85: 2015-05-23 오전 12:00:00 | B85: GARDEN_REWARD | C85: -39356 | D85: =ABS(RC[-1]) -> 39356 | E85: 2015-05 | F85: 1136410 | G85: 1
A86: 2015-05-24 오전 12:00:00 | B86: GARDEN_REWARD | C86: -34394 | D86: =ABS(RC[-1]) -> 34394 | E86: 2015-05 | F86: 1170804 | G86: 1
A87: 2015-05-25 오전 12:00:00 | B87: GARDEN_REWARD | C87: -39050 | D87: =ABS(RC[-1]) -> 39050 | E87: 2015-05 | F87: 1209854 | G87: 1
A88: 2015-05-26 오전 12:00:00 | B88: GARDEN_REWARD | C88: -39694 | D88: =ABS(RC[-1]) -> 39694 | E88: 2015-05 | F88: 1249548 | G88: 1
A89: 2015-05-27 오전 12:00:00 | B89: GARDEN_REWARD | C89: -40004 | D89: =ABS(RC[-1]) -> 40004 | E89: 2015-05 | F89: 1289552 | G89: 1
A90: 2015-05-28 오전 12:00:00 | B90: GARDEN_REWARD | C90: -41808 | D90: =ABS(RC[-1]) -> 41808 | E90: 2015-05 | F90: 1331360 | G90: 1
A91: 2015-05-29 오전 12:00:00 | B91: GARDEN_REWARD | C91: -37872 | D91: =ABS(RC[-1]) -> 37872 | E91: 2015-05 | F91: 1369232 | G91: 1
A92: 2015-05-30 오전 12:00:00 | B92: GARDEN_REWARD | C92: -35884 | D92: =ABS(RC[-1]) -> 35884 | E92: 2015-05 | F92: 1405116 | G92: 1
A93: 2015-05-31 오전 12:00:00 | B93: GARDEN_REWARD | C93: -36114 | D93: =ABS(RC[-1]) -> 36114 | E93: 2015-05 | F93: 1441230 | G93: 0
A94: 2015-06-01 오전 12:00:00 | B94: GARDEN_REWARD | C94: -74120 | D94: =ABS(RC[-1]) -> 74120 | E94: 2015-06 | F94: 74120 | G94: 1
A95: 2015-06-02 오전 12:00:00 | B95: GARDEN_REWARD | C95: -47236 | D95: =ABS(RC[-1]) -> 47236 | E95: 2015-06 | F95: 121356 | G95: 1
A96: 2015-06-03 오전 12:00:00 | B96: GARDEN_REWARD | C96: -47152 | D96: =ABS(RC[-1]) -> 47152 | E96: 2015-06 | F96: 168508 | G96: 1
A97: 2015-06-04 오전 12:00:00 | B97: GARDEN_REWARD | C97: -47138 | D97: =ABS(RC[-1]) -> 47138 | E97: 2015-06 | F97: 215646 | G97: 1
A98: 2015-06-05 오전 12:00:00 | B98: GARDEN_REWARD | C98: -47084 | D98: =ABS(RC[-1]) -> 47084 | E98: 2015-06 | F98: 262730 | G98: 1
A99: 2015-06-06 오전 12:00:00 | B99: GARDEN_REWARD | C99: -41956 | D99: =ABS(RC[-1]) -> 41956 | E99: 2015-06 | F99: 304686 | G99: 1
A100: 2015-06-07 오전 12:00:00 | B100: GARDEN_REWARD | C100: -43228 | D100: =ABS(RC[-1]) -> 43228 | E100: 2015-06 | F100: 347914 | G100: 1
A101: 2015-06-08 오전 12:00:00 | B101: GARDEN_REWARD | C101: -41726 | D101: =ABS(RC[-1]) -> 41726 | E101: 2015-06 | F101: 389640 | G101: 1
A102: 2015-06-09 오전 12:00:00 | B102: GARDEN_REWARD | C102: -40166 | D102: =ABS(RC[-1]) -> 40166 | E102: 2015-06 | F102: 429806 | G102: 1
A103: 2015-06-10 오전 12:00:00 | B103: GARDEN_REWARD | C103: -43122 | D103: =ABS(RC[-1]) -> 43122 | E103: 2015-06 | F103: 472928 | G103: 1
A104: 2015-06-11 오전 12:00:00 | B104: GARDEN_REWARD | C104: -44936 | D104: =ABS(RC[-1]) -> 44936 | E104: 2015-06 | F104: 517864 | G104: 1
A105: 2015-06-12 오전 12:00:00 | B105: GARDEN_REWARD | C105: -43528 | D105: =ABS(RC[-1]) -> 43528 | E105: 2015-06 | F105: 561392 | G105: 1
A106: 2015-06-13 오전 12:00:00 | B106: GARDEN_REWARD | C106: -41254 | D106: =ABS(RC[-1]) -> 41254 | E106: 2015-06 | F106: 602646 | G106: 1
A107: 2015-06-14 오전 12:00:00 | B107: GARDEN_REWARD | C107: -46328 | D107: =ABS(RC[-1]) -> 46328 | E107: 2015-06 | F107: 648974 | G107: 1
A108: 2015-06-15 오전 12:00:00 | B108: GARDEN_REWARD | C108: -38586 | D108: =ABS(RC[-1]) -> 38586 | E108: 2015-06 | F108: 687560 | G108: 1
A109: 2015-06-16 오전 12:00:00 | B109: GARDEN_REWARD | C109: -38226 | D109: =ABS(RC[-1]) -> 38226 | E109: 2015-06 | F109: 725786 | G109: 1
A110: 2015-06-17 오전 12:00:00 | B110: GARDEN_REWARD | C110: -35818 | D110: =ABS(RC[-1]) -> 35818 | E110: 2015-06 | F110: 761604 | G110: 1
A111: 2015-06-18 오전 12:00:00 | B111: GARDEN_REWARD | C111: -45914 | D111: =ABS(RC[-1]) -> 45914 | E111: 2015-06 | F111: 807518 | G111: 1
A112: 2015-06-19 오전 12:00:00 | B112: GARDEN_REWARD | C112: -41524 | D112: =ABS(RC[-1]) -> 41524 | E112: 2015-06 | F112: 849042 | G112: 1
A113: 2015-06-20 오전 12:00:00 | B113: GARDEN_REWARD | C113: -39812 | D113: =ABS(RC[-1]) -> 39812 | E113: 2015-06 | F113: 888854 | G113: 1
A114: 2015-06-21 오전 12:00:00 | B114: GARDEN_REWARD | C114: -38146 | D114: =ABS(RC[-1]) -> 38146 | E114: 2015-06 | F114: 927000 | G114: 1
A115: 2015-06-22 오전 12:00:00 | B115: GARDEN_REWARD | C115: -39264 | D115: =ABS(RC[-1]) -> 39264 | E115: 2015-06 | F115: 966264 | G115: 1
A116: 2015-06-23 오전 12:00:00 | B116: GARDEN_REWARD | C116: -34394 | D116: =ABS(RC[-1]) -> 34394 | E116: 2015-06 | F116: 1000658 | G116: 1
A117: 2015-06-24 오전 12:00:00 | B117: GARDEN_REWARD | C117: -35854 | D117: =ABS(RC[-1]) -> 35854 | E117: 2015-06 | F117: 1036512 | G117: 1
A118: 2015-06-25 오전 12:00:00 | B118: GARDEN_REWARD | C118: -41540 | D118: =ABS(RC[-1]) -> 41540 | E118: 2015-06 | F118: 1078052 | G118: 1
A119: 2015-06-26 오전 12:00:00 | B119: GARDEN_REWARD | C119: -42382 | D119: =ABS(RC[-1]) -> 42382 | E119: 2015-06 | F119: 1120434 | G119: 1
A120: 2015-06-27 오전 12:00:00 | B120: GARDEN_REWARD | C120: -40388 | D120: =ABS(RC[-1]) -> 40388 | E120: 2015-06 | F120: 1160822 | G120: 1
A121: 2015-06-28 오전 12:00:00 | B121: GARDEN_REWARD | C121: -42222 | D121: =ABS(RC[-1]) -> 42222 | E121: 2015-06 | F121: 1203044 | G121: 1
A122: 2015-06-29 오전 12:00:00 | B122: GARDEN_REWARD | C122: -43110 | D122: =ABS(RC[-1]) -> 43110 | E122: 2015-06 | F122: 1246154 | G122: 1
A123: 2015-06-30 오전 12:00:00 | B123: GARDEN_REWARD | C123: -40288 | D123: =ABS(RC[-1]) -> 40288 | E123: 2015-06 | F123: 1286442 | G123: 0
A124: 2015-07-01 오전 12:00:00 | B124: GARDEN_REWARD | C124: -275681 | D124: =ABS(RC[-1]) -> 275681 | E124: 2015-07 | F124: 275681 | G124: 1
A125: 2015-07-02 오전 12:00:00 | B125: GARDEN_REWARD | C125: -214550 | D125: =ABS(RC[-1]) -> 214550 | E125: 2015-07 | F125: 490231 | G125: 1
A126: 2015-07-03 오전 12:00:00 | B126: GARDEN_REWARD | C126: -183300 | D126: =ABS(RC[-1]) -> 183300 | E126: 2015-07 | F126: 673531 | G126: 1
A127: 2015-07-04 오전 12:00:00 | B127: GARDEN_REWARD | C127: -130602 | D127: =ABS(RC[-1]) -> 130602 | E127: 2015-07 | F127: 804133 | G127: 1
A128: 2015-07-05 오전 12:00:00 | B128: GARDEN_REWARD | C128: -125292 | D128: =ABS(RC[-1]) -> 125292 | E128: 2015-07 | F128: 929425 | G128: 1
A129: 2015-07-06 오전 12:00:00 | B129: GARDEN_REWARD | C129: -114650 | D129: =ABS(RC[-1]) -> 114650 | E129: 2015-07 | F129: 1044075 | G129: 1
A130: 2015-07-07 오전 12:00:00 | B130: GARDEN_REWARD | C130: -100980 | D130: =ABS(RC[-1]) -> 100980 | E130: 2015-07 | F130: 1145055 | G130: 1
A131: 2015-07-08 오전 12:00:00 | B131: GARDEN_REWARD | C131: -110584 | D131: =ABS(RC[-1]) -> 110584 | E131: 2015-07 | F131: 1255639 | G131: 1
A132: 2015-07-09 오전 12:00:00 | B132: GARDEN_REWARD | C132: -123768 | D132: =ABS(RC[-1]) -> 123768 | E132: 2015-07 | F132: 1379407 | G132: 1
A133: 2015-07-10 오전 12:00:00 | B133: GARDEN_REWARD | C133: -106944 | D133: =ABS(RC[-1]) -> 106944 | E133: 2015-07 | F133: 1486351 | G133: 1
A134: 2015-07-11 오전 12:00:00 | B134: GARDEN_REWARD | C134: -99498 | D134: =ABS(RC[-1]) -> 99498 | E134: 2015-07 | F134: 1585849 | G134: 1
A135: 2015-07-12 오전 12:00:00 | B135: GARDEN_REWARD | C135: -106404 | D135: =ABS(RC[-1]) -> 106404 | E135: 2015-07 | F135: 1692253 | G135: 1
A136: 2015-07-13 오전 12:00:00 | B136: GARDEN_REWARD | C136: -93826 | D136: =ABS(RC[-1]) -> 93826 | E136: 2015-07 | F136: 1786079 | G136: 1
A137: 2015-07-14 오전 12:00:00 | B137: GARDEN_REWARD | C137: -91310 | D137: =ABS(RC[-1]) -> 91310 | E137: 2015-07 | F137: 1877389 | G137: 1
A138: 2015-07-15 오전 12:00:00 | B138: GARDEN_REWARD | C138: -92148 | D138: =ABS(RC[-1]) -> 92148 | E138: 2015-07 | F138: 1969537 | G138: 1
A139: 2015-07-16 오전 12:00:00 | B139: GARDEN_REWARD | C139: -100356 | D139: =ABS(RC[-1]) -> 100356 | E139: 2015-07 | F139: 2069893 | G139: 1
A140: 2015-07-17 오전 12:00:00 | B140: GARDEN_REWARD | C140: -105232 | D140: =ABS(RC[-1]) -> 105232 | E140: 2015-07 | F140: 2175125 | G140: 1
A141: 2015-07-18 오전 12:00:00 | B141: GARDEN_REWARD | C141: -108176 | D141: =ABS(RC[-1]) -> 108176 | E141: 2015-07 | F141: 2283301 | G141: 1
A142: 2015-07-19 오전 12:00:00 | B142: GARDEN_REWARD | C142: -103010 | D142: =ABS(RC[-1]) -> 103010 | E142: 2015-07 | F142: 2386311 | G142: 1
A143: 2015-07-20 오전 12:00:00 | B143: GARDEN_REWARD | C143: -103100 | D143: =ABS(RC[-1]) -> 103100 | E143: 2015-07 | F143: 2489411 | G143: 1
A144: 2015-07-21 오전 12:00:00 | B144: GARDEN_REWARD | C144: -84530 | D144: =ABS(RC[-1]) -> 84530 | E144: 2015-07 | F144: 2573941 | G144: 1
A145: 2015-07-22 오전 12:00:00 | B145: GARDEN_REWARD | C145: -95314 | D145: =ABS(RC[-1]) -> 95314 | E145: 2015-07 | F145: 2669255 | G145: 1
A146: 2015-07-23 오전 12:00:00 | B146: GARDEN_REWARD | C146: -85466 | D146: =ABS(RC[-1]) -> 85466 | E146: 2015-07 | F146: 2754721 | G146: 1
A147: 2015-07-24 오전 12:00:00 | B147: GARDEN_REWARD | C147: -68580 | D147: =ABS(RC[-1]) -> 68580 | E147: 2015-07 | F147: 2823301 | G147: 1
A148: 2015-07-25 오전 12:00:00 | B148: GARDEN_REWARD | C148: -55310 | D148: =ABS(RC[-1]) -> 55310 | E148: 2015-07 | F148: 2878611 | G148: 1
A149: 2015-07-26 오전 12:00:00 | B149: GARDEN_REWARD | C149: -59738 | D149: =ABS(RC[-1]) -> 59738 | E149: 2015-07 | F149: 2938349 | G149: 1
A150: 2015-07-27 오전 12:00:00 | B150: GARDEN_REWARD | C150: -64818 | D150: =ABS(RC[-1]) -> 64818 | E150: 2015-07 | F150: 3003167 | G150: 1
A151: 2015-07-28 오전 12:00:00 | B151: GARDEN_REWARD | C151: -62646 | D151: =ABS(RC[-1]) -> 62646 | E151: 2015-07 | F151: 3065813 | G151: 1
A152: 2015-07-29 오전 12:00:00 | B152: GARDEN_REWARD | C152: -57538 | D152: =ABS(RC[-1]) -> 57538 | E152: 2015-07 | F152: 3123351 | G152: 1
A153: 2015-07-30 오전 12:00:00 | B153: GARDEN_REWARD | C153: -63212 | D153: =ABS(RC[-1]) -> 63212 | E153: 2015-07 | F153: 3186563 | G153: 1
A154: 2015-07-31 오전 12:00:00 | B154: GARDEN_REWARD | C154: -56378 | D154: =ABS(RC[-1]) -> 56378 | E154: 2015-07 | F154: 3242941 | G154: 0
A155: 2015-08-01 오전 12:00:00 | B155: GARDEN_REWARD | C155: -269574 | D155: =ABS(RC[-1]) -> 269574 | E155: 2015-08 | F155: 269574 | G155: 1
A156: 2015-08-02 오전 12:00:00 | B156: GARDEN_REWARD | C156: -144286 | D156: =ABS(RC[-1]) -> 144286 | E156: 2015-08 | F156: 413860 | G156: 1
A157: 2015-08-03 오전 12:00:00 | B157: GARDEN_REWARD | C157: -145152 | D157: =ABS(RC[-1]) -> 145152 | E157: 2015-08 | F157: 559012 | G157: 1
A158: 2015-08-04 오전 12:00:00 | B158: GARDEN_REWARD | C158: -136976 | D158: =ABS(RC[-1]) -> 136976 | E158: 2015-08 | F158: 695988 | G158: 1
A159: 2015-08-05 오전 12:00:00 | B159: GARDEN_REWARD | C159: -126316 | D159: =ABS(RC[-1]) -> 126316 | E159: 2015-08 | F159: 822304 | G159: 1
A160: 2015-08-06 오전 12:00:00 | B160: GARDEN_REWARD | C160: -107396 | D160: =ABS(RC[-1]) -> 107396 | E160: 2015-08 | F160: 929700 | G160: 1
A161: 2015-08-07 오전 12:00:00 | B161: GARDEN_REWARD | C161: -105386 | D161: =ABS(RC[-1]) -> 105386 | E161: 2015-08 | F161: 1035086 | G161: 1
A162: 2015-08-08 오전 12:00:00 | B162: GARDEN_REWARD | C162: -91014 | D162: =ABS(RC[-1]) -> 91014 | E162: 2015-08 | F162: 1126100 | G162: 1
A163: 2015-08-09 오전 12:00:00 | B163: GARDEN_REWARD | C163: -95714 | D163: =ABS(RC[-1]) -> 95714 | E163: 2015-08 | F163: 1221814 | G163: 1
A164: 2015-08-10 오전 12:00:00 | B164: GARDEN_REWARD | C164: -98838 | D164: =ABS(RC[-1]) -> 98838 | E164: 2015-08 | F164: 1320652 | G164: 1
A165: 2015-08-11 오전 12:00:00 | B165: GARDEN_REWARD | C165: -92472 | D165: =ABS(RC[-1]) -> 92472 | E165: 2015-08 | F165: 1413124 | G165: 1
A166: 2015-08-12 오전 12:00:00 | B166: GARDEN_REWARD | C166: -89602 | D166: =ABS(RC[-1]) -> 89602 | E166: 2015-08 | F166: 1502726 | G166: 1
A167: 2015-08-13 오전 12:00:00 | B167: GARDEN_REWARD | C167: -94090 | D167: =ABS(RC[-1]) -> 94090 | E167: 2015-08 | F167: 1596816 | G167: 1
A168: 2015-08-14 오전 12:00:00 | B168: GARDEN_REWARD | C168: -91532 | D168: =ABS(RC[-1]) -> 91532 | E168: 2015-08 | F168: 1688348 | G168: 1
A169: 2015-08-15 오전 12:00:00 | B169: GARDEN_REWARD | C169: -78586 | D169: =ABS(RC[-1]) -> 78586 | E169: 2015-08 | F169: 1766934 | G169: 1
A170: 2015-08-16 오전 12:00:00 | B170: GARDEN_REWARD | C170: -75124 | D170: =ABS(RC[-1]) -> 75124 | E170: 2015-08 | F170: 1842058 | G170: 1
A171: 2015-08-17 오전 12:00:00 | B171: GARDEN_REWARD | C171: -83070 | D171: =ABS(RC[-1]) -> 83070 | E171: 2015-08 | F171: 1925128 | G171: 1
A172: 2015-08-18 오전 12:00:00 | B172: GARDEN_REWARD | C172: -75640 | D172: =ABS(RC[-1]) -> 75640 | E172: 2015-08 | F172: 2000768 | G172: 1
A173: 2015-08-19 오전 12:00:00 | B173: GARDEN_REWARD | C173: -79220 | D173: =ABS(RC[-1]) -> 79220 | E173: 2015-08 | F173: 2079988 | G173: 1
A174: 2015-08-20 오전 12:00:00 | B174: GARDEN_REWARD | C174: -78633 | D174: =ABS(RC[-1]) -> 78633 | E174: 2015-08 | F174: 2158621 | G174: 1
A175: 2015-08-21 오전 12:00:00 | B175: GARDEN_REWARD | C175: -64776 | D175: =ABS(RC[-1]) -> 64776 | E175: 2015-08 | F175: 2223397 | G175: 1
A176: 2015-08-22 오전 12:00:00 | B176: GARDEN_REWARD | C176: -53765 | D176: =ABS(RC[-1]) -> 53765 | E176: 2015-08 | F176: 2277162 | G176: 1
A177: 2015-08-23 오전 12:00:00 | B177: GARDEN_REWARD | C177: -57919 | D177: =ABS(RC[-1]) -> 57919 | E177: 2015-08 | F177: 2335081 | G177: 1
A178: 2015-08-24 오전 12:00:00 | B178: GARDEN_REWARD | C178: -63047 | D178: =ABS(RC[-1]) -> 63047 | E178: 2015-08 | F178: 2398128 | G178: 1
A179: 2015-08-25 오전 12:00:00 | B179: GARDEN_REWARD | C179: -59201 | D179: =ABS(RC[-1]) -> 59201 | E179: 2015-08 | F179: 2457329 | G179: 1
A180: 2015-08-26 오전 12:00:00 | B180: GARDEN_REWARD | C180: -66458 | D180: =ABS(RC[-1]) -> 66458 | E180: 2015-08 | F180: 2523787 | G180: 1
A181: 2015-08-27 오전 12:00:00 | B181: GARDEN_REWARD | C181: -63870 | D181: =ABS(RC[-1]) -> 63870 | E181: 2015-08 | F181: 2587657 | G181: 1
A182: 2015-08-28 오전 12:00:00 | B182: GARDEN_REWARD | C182: -60569 | D182: =ABS(RC[-1]) -> 60569 | E182: 2015-08 | F182: 2648226 | G182: 1
A183: 2015-08-29 오전 12:00:00 | B183: GARDEN_REWARD | C183: -61057 | D183: =ABS(RC[-1]) -> 61057 | E183: 2015-08 | F183: 2709283 | G183: 1
A184: 2015-08-30 오전 12:00:00 | B184: GARDEN_REWARD | C184: -60871 | D184: =ABS(RC[-1]) -> 60871 | E184: 2015-08 | F184: 2770154 | G184: 1
A185: 2015-08-31 오전 12:00:00 | B185: GARDEN_REWARD | C185: -64591 | D185: =ABS(RC[-1]) -> 64591 | E185: 2015-08 | F185: 2834745 | G185: 0
A186: 2015-09-01 오전 12:00:00 | B186: GARDEN_REWARD | C186: -322257 | D186: =ABS(RC[-1]) -> 322257 | E186: 2015-09 | F186: 322257 | G186: 1
A187: 2015-09-02 오전 12:00:00 | B187: GARDEN_REWARD | C187: -200363 | D187: =ABS(RC[-1]) -> 200363 | E187: 2015-09 | F187: 522620 | G187: 1
A188: 2015-09-03 오전 12:00:00 | B188: GARDEN_REWARD | C188: -162489 | D188: =ABS(RC[-1]) -> 162489 | E188: 2015-09 | F188: 685109 | G188: 1
A189: 2015-09-04 오전 12:00:00 | B189: GARDEN_REWARD | C189: -144414 | D189: =ABS(RC[-1]) -> 144414 | E189: 2015-09 | F189: 829523 | G189: 1
A190: 2015-09-05 오전 12:00:00 | B190: GARDEN_REWARD | C190: -133970 | D190: =ABS(RC[-1]) -> 133970 | E190: 2015-09 | F190: 963493 | G190: 1
A191: 2015-09-06 오전 12:00:00 | B191: GARDEN_REWARD | C191: -125751 | D191: =ABS(RC[-1]) -> 125751 | E191: 2015-09 | F191: 1089244 | G191: 1
A192: 2015-09-07 오전 12:00:00 | B192: GARDEN_REWARD | C192: -128359 | D192: =ABS(RC[-1]) -> 128359 | E192: 2015-09 | F192: 1217603 | G192: 1
A193: 2015-09-08 오전 12:00:00 | B193: GARDEN_REWARD | C193: -106740 | D193: =ABS(RC[-1]) -> 106740 | E193: 2015-09 | F193: 1324343 | G193: 1
A194: 2015-09-09 오전 12:00:00 | B194: GARDEN_REWARD | C194: -107908 | D194: =ABS(RC[-1]) -> 107908 | E194: 2015-09 | F194: 1432251 | G194: 1
A195: 2015-09-10 오전 12:00:00 | B195: GARDEN_REWARD | C195: -101154 | D195: =ABS(RC[-1]) -> 101154 | E195: 2015-09 | F195: 1533405 | G195: 1
A196: 2015-09-11 오전 12:00:00 | B196: GARDEN_REWARD | C196: -97477 | D196: =ABS(RC[-1]) -> 97477 | E196: 2015-09 | F196: 1630882 | G196: 1
A197: 2015-09-12 오전 12:00:00 | B197: GARDEN_REWARD | C197: -93977 | D197: =ABS(RC[-1]) -> 93977 | E197: 2015-09 | F197: 1724859 | G197: 1
A198: 2015-09-13 오전 12:00:00 | B198: GARDEN_REWARD | C198: -91810 | D198: =ABS(RC[-1]) -> 91810 | E198: 2015-09 | F198: 1816669 | G198: 1
A199: 2015-09-14 오전 12:00:00 | B199: GARDEN_REWARD | C199: -102654 | D199: =ABS(RC[-1]) -> 102654 | E199: 2015-09 | F199: 1919323 | G199: 1
A200: 2015-09-15 오전 12:00:00 | B200: GARDEN_REWARD | C200: -90053 | D200: =ABS(RC[-1]) -> 90053 | E200: 2015-09 | F200: 2009376 | G200: 1
A201: 2015-09-16 오전 12:00:00 | B201: GARDEN_REWARD | C201: -91048 | D201: =ABS(RC[-1]) -> 91048 | E201: 2015-09 | F201: 2100424 | G201: 1
A202: 2015-09-17 오전 12:00:00 | B202: GARDEN_REWARD | C202: -84702 | D202: =ABS(RC[-1]) -> 84702 | E202: 2015-09 | F202: 2185126 | G202: 1
A203: 2015-09-18 오전 12:00:00 | B203: GARDEN_REWARD | C203: -88003 | D203: =ABS(RC[-1]) -> 88003 | E203: 2015-09 | F203: 2273129 | G203: 1
A204: 2015-09-19 오전 12:00:00 | B204: GARDEN_REWARD | C204: -74787 | D204: =ABS(RC[-1]) -> 74787 | E204: 2015-09 | F204: 2347916 | G204: 1
A205: 2015-09-20 오전 12:00:00 | B205: GARDEN_REWARD | C205: -76607 | D205: =ABS(RC[-1]) -> 76607 | E205: 2015-09 | F205: 2424523 | G205: 1
A206: 2015-09-21 오전 12:00:00 | B206: GARDEN_REWARD | C206: -86108 | D206: =ABS(RC[-1]) -> 86108 | E206: 2015-09 | F206: 2510631 | G206: 1
A207: 2015-09-22 오전 12:00:00 | B207: GARDEN_REWARD | C207: -79356 | D207: =ABS(RC[-1]) -> 79356 | E207: 2015-09 | F207: 2589987 | G207: 1
A208: 2015-09-23 오전 12:00:00 | B208: GARDEN_REWARD | C208: -82665 | D208: =ABS(RC[-1]) -> 82665 | E208: 2015-09 | F208: 2672652 | G208: 1
A209: 2015-09-24 오전 12:00:00 | B209: GARDEN_REWARD | C209: -87102 | D209: =ABS(RC[-1]) -> 87102 | E209: 2015-09 | F209: 2759754 | G209: 1
A210: 2015-09-25 오전 12:00:00 | B210: GARDEN_REWARD | C210: -94572 | D210: =ABS(RC[-1]) -> 94572 | E210: 2015-09 | F210: 2854326 | G210: 1
A211: 2015-09-26 오전 12:00:00 | B211: GARDEN_REWARD | C211: -71974 | D211: =ABS(RC[-1]) -> 71974 | E211: 2015-09 | F211: 2926300 | G211: 1
A212: 2015-09-27 오전 12:00:00 | B212: GARDEN_REWARD | C212: -75213 | D212: =ABS(RC[-1]) -> 75213 | E212: 2015-09 | F212: 3001513 | G212: 1
A213: 2015-09-28 오전 12:00:00 | B213: GARDEN_REWARD | C213: -83998 | D213: =ABS(RC[-1]) -> 83998 | E213: 2015-09 | F213: 3085511 | G213: 1
A214: 2015-09-29 오전 12:00:00 | B214: GARDEN_REWARD | C214: -90724 | D214: =ABS(RC[-1]) -> 90724 | E214: 2015-09 | F214: 3176235 | G214: 1
A215: 2015-09-30 오전 12:00:00 | B215: GARDEN_REWARD | C215: -78848 | D215: =ABS(RC[-1]) -> 78848 | E215: 2015-09 | F215: 3255083 | G215: 0
A216: 2015-10-01 오전 12:00:00 | B216: GARDEN_REWARD | C216: -278453 | D216: =ABS(RC[-1]) -> 278453 | E216: 2015-10 | F216: 278453 | G216: 1
A217: 2015-10-02 오전 12:00:00 | B217: GARDEN_REWARD | C217: -157158 | D217: =ABS(RC[-1]) -> 157158 | E217: 2015-10 | F217: 435611 | G217: 1
A218: 2015-10-03 오전 12:00:00 | B218: GARDEN_REWARD | C218: -128572 | D218: =ABS(RC[-1]) -> 128572 | E218: 2015-10 | F218: 564183 | G218: 1
A219: 2015-10-04 오전 12:00:00 | B219: GARDEN_REWARD | C219: -118485 | D219: =ABS(RC[-1]) -> 118485 | E219: 2015-10 | F219: 682668 | G219: 1
A220: 2015-10-05 오전 12:00:00 | B220: GARDEN_REWARD | C220: -117705 | D220: =ABS(RC[-1]) -> 117705 | E220: 2015-10 | F220: 800373 | G220: 1
A221: 2015-10-06 오전 12:00:00 | B221: GARDEN_REWARD | C221: -105866 | D221: =ABS(RC[-1]) -> 105866 | E221: 2015-10 | F221: 906239 | G221: 1
A222: 2015-10-07 오전 12:00:00 | B222: GARDEN_REWARD | C222: -100261 | D222: =ABS(RC[-1]) -> 100261 | E222: 2015-10 | F222: 1006500 | G222: 1
A223: 2015-10-08 오전 12:00:00 | B223: GARDEN_REWARD | C223: -123690 | D223: =ABS(RC[-1]) -> 123690 | E223: 2015-10 | F223: 1130190 | G223: 1
A224: 2015-10-09 오전 12:00:00 | B224: GARDEN_REWARD | C224: -104902 | D224: =ABS(RC[-1]) -> 104902 | E224: 2015-10 | F224: 1235092 | G224: 1
A225: 2015-10-10 오전 12:00:00 | B225: GARDEN_REWARD | C225: -148328 | D225: =ABS(RC[-1]) -> 148328 | E225: 2015-10 | F225: 1383420 | G225: 1
A226: 2015-10-11 오전 12:00:00 | B226: GARDEN_REWARD | C226: -104298 | D226: =ABS(RC[-1]) -> 104298 | E226: 2015-10 | F226: 1487718 | G226: 1
A227: 2015-10-12 오전 12:00:00 | B227: GARDEN_REWARD | C227: -107960 | D227: =ABS(RC[-1]) -> 107960 | E227: 2015-10 | F227: 1595678 | G227: 1
A228: 2015-10-13 오전 12:00:00 | B228: GARDEN_REWARD | C228: -136415 | D228: =ABS(RC[-1]) -> 136415 | E228: 2015-10 | F228: 1732093 | G228: 1
A229: 2015-10-14 오전 12:00:00 | B229: GARDEN_REWARD | C229: -92810 | D229: =ABS(RC[-1]) -> 92810 | E229: 2015-10 | F229: 1824903 | G229: 1
A230: 2015-10-15 오전 12:00:00 | B230: GARDEN_REWARD | C230: -94423 | D230: =ABS(RC[-1]) -> 94423 | E230: 2015-10 | F230: 1919326 | G230: 1
A231: 2015-10-16 오전 12:00:00 | B231: GARDEN_REWARD | C231: -87272 | D231: =ABS(RC[-1]) -> 87272 | E231: 2015-10 | F231: 2006598 | G231: 1
A232: 2015-10-17 오전 12:00:00 | B232: GARDEN_REWARD | C232: -82875 | D232: =ABS(RC[-1]) -> 82875 | E232: 2015-10 | F232: 2089473 | G232: 1
A233: 2015-10-18 오전 12:00:00 | B233: GARDEN_REWARD | C233: -85392 | D233: =ABS(RC[-1]) -> 85392 | E233: 2015-10 | F233: 2174865 | G233: 1
A234: 2015-10-19 오전 12:00:00 | B234: GARDEN_REWARD | C234: -85672 | D234: =ABS(RC[-1]) -> 85672 | E234: 2015-10 | F234: 2260537 | G234: 1
A235: 2015-10-20 오전 12:00:00 | B235: GARDEN_REWARD | C235: -79517 | D235: =ABS(RC[-1]) -> 79517 | E235: 2015-10 | F235: 2340054 | G235: 1
A236: 2015-10-21 오전 12:00:00 | B236: GARDEN_REWARD | C236: -79461 | D236: =ABS(RC[-1]) -> 79461 | E236: 2015-10 | F236: 2419515 | G236: 1
A237: 2015-10-22 오전 12:00:00 | B237: GARDEN_REWARD | C237: -80137 | D237: =ABS(RC[-1]) -> 80137 | E237: 2015-10 | F237: 2499652 | G237: 1
A238: 2015-10-23 오전 12:00:00 | B238: GARDEN_REWARD | C238: -77444 | D238: =ABS(RC[-1]) -> 77444 | E238: 2015-10 | F238: 2577096 | G238: 1
A239: 2015-10-24 오전 12:00:00 | B239: GARDEN_REWARD | C239: -74490 | D239: =ABS(RC[-1]) -> 74490 | E239: 2015-10 | F239: 2651586 | G239: 1
A240: 2015-10-25 오전 12:00:00 | B240: GARDEN_REWARD | C240: -67030 | D240: =ABS(RC[-1]) -> 67030 | E240: 2015-10 | F240: 2718616 | G240: 1
A241: 2015-10-26 오전 12:00:00 | B241: GARDEN_REWARD | C241: -78476 | D241: =ABS(RC[-1]) -> 78476 | E241: 2015-10 | F241: 2797092 | G241: 1
A242: 2015-10-27 오전 12:00:00 | B242: GARDEN_REWARD | C242: -71486 | D242: =ABS(RC[-1]) -> 71486 | E242: 2015-10 | F242: 2868578 | G242: 1
A243: 2015-10-28 오전 12:00:00 | B243: GARDEN_REWARD | C243: -61015 | D243: =ABS(RC[-1]) -> 61015 | E243: 2015-10 | F243: 2929593 | G243: 1
A244: 2015-10-29 오전 12:00:00 | B244: GARDEN_REWARD | C244: -58817 | D244: =ABS(RC[-1]) -> 58817 | E244: 2015-10 | F244: 2988410 | G244: 1
A245: 2015-10-30 오전 12:00:00 | B245: GARDEN_REWARD | C245: -56995 | D245: =ABS(RC[-1]) -> 56995 | E245: 2015-10 | F245: 3045405 | G245: 1
A246: 2015-10-31 오전 12:00:00 | B246: GARDEN_REWARD | C246: -47725 | D246: =ABS(RC[-1]) -> 47725 | E246: 2015-10 | F246: 3093130 | G246: 0
A247: 2015-11-01 오전 12:00:00 | B247: GARDEN_REWARD | C247: -253208 | D247: =ABS(RC[-1]) -> 253208 | E247: 2015-11 | F247: 253208 | G247: 1
A248: 2015-11-02 오전 12:00:00 | B248: GARDEN_REWARD | C248: -132787 | D248: =ABS(RC[-1]) -> 132787 | E248: 2015-11 | F248: 385995 | G248: 1
A249: 2015-11-03 오전 12:00:00 | B249: GARDEN_REWARD | C249: -118932 | D249: =ABS(RC[-1]) -> 118932 | E249: 2015-11 | F249: 504927 | G249: 1
A250: 2015-11-04 오전 12:00:00 | B250: GARDEN_REWARD | C250: -115128 | D250: =ABS(RC[-1]) -> 115128 | E250: 2015-11 | F250: 620055 | G250: 1
A251: 2015-11-05 오전 12:00:00 | B251: GARDEN_REWARD | C251: -101786 | D251: =ABS(RC[-1]) -> 101786 | E251: 2015-11 | F251: 721841 | G251: 1
A252: 2015-11-06 오전 12:00:00 | B252: GARDEN_REWARD | C252: -98546 | D252: =ABS(RC[-1]) -> 98546 | E252: 2015-11 | F252: 820387 | G252: 1
A253: 2015-11-07 오전 12:00:00 | B253: GARDEN_REWARD | C253: -91690 | D253: =ABS(RC[-1]) -> 91690 | E253: 2015-11 | F253: 912077 | G253: 1
A254: 2015-11-08 오전 12:00:00 | B254: GARDEN_REWARD | C254: -98172 | D254: =ABS(RC[-1]) -> 98172 | E254: 2015-11 | F254: 1010249 | G254: 1
A255: 2015-11-09 오전 12:00:00 | B255: GARDEN_REWARD | C255: -103207 | D255: =ABS(RC[-1]) -> 103207 | E255: 2015-11 | F255: 1113456 | G255: 1
A256: 2015-11-10 오전 12:00:00 | B256: GARDEN_REWARD | C256: -97658 | D256: =ABS(RC[-1]) -> 97658 | E256: 2015-11 | F256: 1211114 | G256: 1
A257: 2015-11-11 오전 12:00:00 | B257: GARDEN_REWARD | C257: -92156 | D257: =ABS(RC[-1]) -> 92156 | E257: 2015-11 | F257: 1303270 | G257: 1
A258: 2015-11-12 오전 12:00:00 | B258: GARDEN_REWARD | C258: -86246 | D258: =ABS(RC[-1]) -> 86246 | E258: 2015-11 | F258: 1389516 | G258: 1
A259: 2015-11-13 오전 12:00:00 | B259: GARDEN_REWARD | C259: -87844 | D259: =ABS(RC[-1]) -> 87844 | E259: 2015-11 | F259: 1477360 | G259: 1
A260: 2015-11-14 오전 12:00:00 | B260: GARDEN_REWARD | C260: -90222 | D260: =ABS(RC[-1]) -> 90222 | E260: 2015-11 | F260: 1567582 | G260: 1
A261: 2015-11-15 오전 12:00:00 | B261: GARDEN_REWARD | C261: -77332 | D261: =ABS(RC[-1]) -> 77332 | E261: 2015-11 | F261: 1644914 | G261: 1
A262: 2015-11-16 오전 12:00:00 | B262: GARDEN_REWARD | C262: -78612 | D262: =ABS(RC[-1]) -> 78612 | E262: 2015-11 | F262: 1723526 | G262: 1
A263: 2015-11-17 오전 12:00:00 | B263: GARDEN_REWARD | C263: -76022 | D263: =ABS(RC[-1]) -> 76022 | E263: 2015-11 | F263: 1799548 | G263: 1
A264: 2015-11-18 오전 12:00:00 | B264: GARDEN_REWARD | C264: -80577 | D264: =ABS(RC[-1]) -> 80577 | E264: 2015-11 | F264: 1880125 | G264: 1
A265: 2015-11-19 오전 12:00:00 | B265: GARDEN_REWARD | C265: -82480 | D265: =ABS(RC[-1]) -> 82480 | E265: 2015-11 | F265: 1962605 | G265: 1
A266: 2015-11-20 오전 12:00:00 | B266: GARDEN_REWARD | C266: -68553 | D266: =ABS(RC[-1]) -> 68553 | E266: 2015-11 | F266: 2031158 | G266: 1
A267: 2015-11-21 오전 12:00:00 | B267: GARDEN_REWARD | C267: -61652 | D267: =ABS(RC[-1]) -> 61652 | E267: 2015-11 | F267: 2092810 | G267: 1
A268: 2015-11-22 오전 12:00:00 | B268: GARDEN_REWARD | C268: -69390 | D268: =ABS(RC[-1]) -> 69390 | E268: 2015-11 | F268: 2162200 | G268: 1
A269: 2015-11-23 오전 12:00:00 | B269: GARDEN_REWARD | C269: -68452 | D269: =ABS(RC[-1]) -> 68452 | E269: 2015-11 | F269: 2230652 | G269: 1
A270: 2015-11-24 오전 12:00:00 | B270: GARDEN_REWARD | C270: -62674 | D270: =ABS(RC[-1]) -> 62674 | E270: 2015-11 | F270: 2293326 | G270: 1
A271: 2015-11-25 오전 12:00:00 | B271: GARDEN_REWARD | C271: -62282 | D271: =ABS(RC[-1]) -> 62282 | E271: 2015-11 | F271: 2355608 | G271: 1
A272: 2015-11-26 오전 12:00:00 | B272: GARDEN_REWARD | C272: -61459 | D272: =ABS(RC[-1]) -> 61459 | E272: 2015-11 | F272: 2417067 | G272: 1
A273: 2015-11-27 오전 12:00:00 | B273: GARDEN_REWARD | C273: -60474 | D273: =ABS(RC[-1]) -> 60474 | E273: 2015-11 | F273: 2477541 | G273: 1
A274: 2015-11-28 오전 12:00:00 | B274: GARDEN_REWARD | C274: -50347 | D274: =ABS(RC[-1]) -> 50347 | E274: 2015-11 | F274: 2527888 | G274: 1
A275: 2015-11-29 오전 12:00:00 | B275: GARDEN_REWARD | C275: -57453 | D275: =ABS(RC[-1]) -> 57453 | E275: 2015-11 | F275: 2585341 | G275: 1
A276: 2015-11-30 오전 12:00:00 | B276: GARDEN_REWARD | C276: -62837 | D276: =ABS(RC[-1]) -> 62837 | E276: 2015-11 | F276: 2648178 | G276: 0
A277: 2015-12-01 오전 12:00:00 | B277: GARDEN_REWARD | C277: -255609 | D277: =ABS(RC[-1]) -> 255609 | E277: 2015-12 | F277: 255609 | G277: 1
A278: 2015-12-02 오전 12:00:00 | B278: GARDEN_REWARD | C278: -145602 | D278: =ABS(RC[-1]) -> 145602 | E278: 2015-12 | F278: 401211 | G278: 1
A279: 2015-12-03 오전 12:00:00 | B279: GARDEN_REWARD | C279: -133256 | D279: =ABS(RC[-1]) -> 133256 | E279: 2015-12 | F279: 534467 | G279: 1
A280: 2015-12-04 오전 12:00:00 | B280: GARDEN_REWARD | C280: -112941 | D280: =ABS(RC[-1]) -> 112941 | E280: 2015-12 | F280: 647408 | G280: 1
A281: 2015-12-05 오전 12:00:00 | B281: GARDEN_REWARD | C281: -103403 | D281: =ABS(RC[-1]) -> 103403 | E281: 2015-12 | F281: 750811 | G281: 1
A282: 2015-12-06 오전 12:00:00 | B282: GARDEN_REWARD | C282: -108168 | D282: =ABS(RC[-1]) -> 108168 | E282: 2015-12 | F282: 858979 | G282: 1
A283: 2015-12-07 오전 12:00:00 | B283: GARDEN_REWARD | C283: -103926 | D283: =ABS(RC[-1]) -> 103926 | E283: 2015-12 | F283: 962905 | G283: 1
A284: 2015-12-08 오전 12:00:00 | B284: GARDEN_REWARD | C284: -96963 | D284: =ABS(RC[-1]) -> 96963 | E284: 2015-12 | F284: 1059868 | G284: 1
A285: 2015-12-09 오전 12:00:00 | B285: GARDEN_REWARD | C285: -104068 | D285: =ABS(RC[-1]) -> 104068 | E285: 2015-12 | F285: 1163936 | G285: 1
A286: 2015-12-10 오전 12:00:00 | B286: GARDEN_REWARD | C286: -105628 | D286: =ABS(RC[-1]) -> 105628 | E286: 2015-12 | F286: 1269564 | G286: 1
A287: 2015-12-11 오전 12:00:00 | B287: GARDEN_REWARD | C287: -102008 | D287: =ABS(RC[-1]) -> 102008 | E287: 2015-12 | F287: 1371572 | G287: 1
A288: 2015-12-12 오전 12:00:00 | B288: GARDEN_REWARD | C288: -91209 | D288: =ABS(RC[-1]) -> 91209 | E288: 2015-12 | F288: 1462781 | G288: 1
A289: 2015-12-13 오전 12:00:00 | B289: GARDEN_REWARD | C289: -98156 | D289: =ABS(RC[-1]) -> 98156 | E289: 2015-12 | F289: 1560937 | G289: 1
A290: 2015-12-14 오전 12:00:00 | B290: GARDEN_REWARD | C290: -96764 | D290: =ABS(RC[-1]) -> 96764 | E290: 2015-12 | F290: 1657701 | G290: 1
A291: 2015-12-15 오전 12:00:00 | B291: GARDEN_REWARD | C291: -82612 | D291: =ABS(RC[-1]) -> 82612 | E291: 2015-12 | F291: 1740313 | G291: 1
A292: 2015-12-16 오전 12:00:00 | B292: GARDEN_REWARD | C292: -88522 | D292: =ABS(RC[-1]) -> 88522 | E292: 2015-12 | F292: 1828835 | G292: 1
A293: 2015-12-17 오전 12:00:00 | B293: GARDEN_REWARD | C293: -81151 | D293: =ABS(RC[-1]) -> 81151 | E293: 2015-12 | F293: 1909986 | G293: 1
A294: 2015-12-18 오전 12:00:00 | B294: GARDEN_REWARD | C294: -84436 | D294: =ABS(RC[-1]) -> 84436 | E294: 2015-12 | F294: 1994422 | G294: 1
A295: 2015-12-19 오전 12:00:00 | B295: GARDEN_REWARD | C295: -84241 | D295: =ABS(RC[-1]) -> 84241 | E295: 2015-12 | F295: 2078663 | G295: 1
A296: 2015-12-20 오전 12:00:00 | B296: GARDEN_REWARD | C296: -80555 | D296: =ABS(RC[-1]) -> 80555 | E296: 2015-12 | F296: 2159218 | G296: 1
A297: 2015-12-21 오전 12:00:00 | B297: GARDEN_REWARD | C297: -87176 | D297: =ABS(RC[-1]) -> 87176 | E297: 2015-12 | F297: 2246394 | G297: 1
A298: 2015-12-22 오전 12:00:00 | B298: GARDEN_REWARD | C298: -71410 | D298: =ABS(RC[-1]) -> 71410 | E298: 2015-12 | F298: 2317804 | G298: 1
A299: 2015-12-23 오전 12:00:00 | B299: GARDEN_REWARD | C299: -73664 | D299: =ABS(RC[-1]) -> 73664 | E299: 2015-12 | F299: 2391468 | G299: 1
A300: 2015-12-24 오전 12:00:00 | B300: GARDEN_REWARD | C300: -85252 | D300: =ABS(RC[-1]) -> 85252 | E300: 2015-12 | F300: 2476720 | G300: 1
A301: 2015-12-25 오전 12:00:00 | B301: GARDEN_REWARD | C301: -78633 | D301: =ABS(RC[-1]) -> 78633 | E301: 2015-12 | F301: 2555353 | G301: 1
A302: 2015-12-26 오전 12:00:00 | B302: GARDEN_REWARD | C302: -70419 | D302: =ABS(RC[-1]) -> 70419 | E302: 2015-12 | F302: 2625772 | G302: 1
A303: 2015-12-27 오전 12:00:00 | B303: GARDEN_REWARD | C303: -67810 | D303: =ABS(RC[-1]) -> 67810 | E303: 2015-12 | F303: 2693582 | G303: 1
A304: 2015-12-28 오전 12:00:00 | B304: GARDEN_REWARD | C304: -71258 | D304: =ABS(RC[-1]) -> 71258 | E304: 2015-12 | F304: 2764840 | G304: 1
A305: 2015-12-29 오전 12:00:00 | B305: GARDEN_REWARD | C305: -63462 | D305: =ABS(RC[-1]) -> 63462 | E305: 2015-12 | F305: 2828302 | G305: 1
A306: 2015-12-30 오전 12:00:00 | B306: GARDEN_REWARD | C306: -58705 | D306: =ABS(RC[-1]) -> 58705 | E306: 2015-12 | F306: 2887007 | G306: 1
A307: 2015-12-31 오전 12:00:00 | B307: GARDEN_REWARD | C307: -55700 | D307: =ABS(RC[-1]) -> 55700 | E307: 2015-12 | F307: 2942707 | G307: 0
A308: 2016-01-01 오전 12:00:00 | B308: GARDEN_REWARD | C308: -221401 | D308: =ABS(RC[-1]) -> 221401 | E308: 2016-01 | F308: 221401 | G308: 1
A309: 2016-01-02 오전 12:00:00 | B309: GARDEN_REWARD | C309: -134861 | D309: =ABS(RC[-1]) -> 134861 | E309: 2016-01 | F309: 356262 | G309: 1
A310: 2016-01-03 오전 12:00:00 | B310: GARDEN_REWARD | C310: -115819 | D310: =ABS(RC[-1]) -> 115819 | E310: 2016-01 | F310: 472081 | G310: 1
A311: 2016-01-04 오전 12:00:00 | B311: GARDEN_REWARD | C311: -108597 | D311: =ABS(RC[-1]) -> 108597 | E311: 2016-01 | F311: 580678 | G311: 1
A312: 2016-01-05 오전 12:00:00 | B312: GARDEN_REWARD | C312: -99819 | D312: =ABS(RC[-1]) -> 99819 | E312: 2016-01 | F312: 680497 | G312: 1
A313: 2016-01-06 오전 12:00:00 | B313: GARDEN_REWARD | C313: -92032 | D313: =ABS(RC[-1]) -> 92032 | E313: 2016-01 | F313: 772529 | G313: 1
A314: 2016-01-07 오전 12:00:00 | B314: GARDEN_REWARD | C314: -110764 | D314: =ABS(RC[-1]) -> 110764 | E314: 2016-01 | F314: 883293 | G314: 1
A315: 2016-01-08 오전 12:00:00 | B315: GARDEN_REWARD | C315: -99269 | D315: =ABS(RC[-1]) -> 99269 | E315: 2016-01 | F315: 982562 | G315: 1
A316: 2016-01-09 오전 12:00:00 | B316: GARDEN_REWARD | C316: -96773 | D316: =ABS(RC[-1]) -> 96773 | E316: 2016-01 | F316: 1079335 | G316: 1
A317: 2016-01-10 오전 12:00:00 | B317: GARDEN_REWARD | C317: -94756 | D317: =ABS(RC[-1]) -> 94756 | E317: 2016-01 | F317: 1174091 | G317: 1
A318: 2016-01-11 오전 12:00:00 | B318: GARDEN_REWARD | C318: -95332 | D318: =ABS(RC[-1]) -> 95332 | E318: 2016-01 | F318: 1269423 | G318: 1
A319: 2016-01-12 오전 12:00:00 | B319: GARDEN_REWARD | C319: -89224 | D319: =ABS(RC[-1]) -> 89224 | E319: 2016-01 | F319: 1358647 | G319: 1
A320: 2016-01-13 오전 12:00:00 | B320: GARDEN_REWARD | C320: -87288 | D320: =ABS(RC[-1]) -> 87288 | E320: 2016-01 | F320: 1445935 | G320: 1
A321: 2016-01-14 오전 12:00:00 | B321: GARDEN_REWARD | C321: -91371 | D321: =ABS(RC[-1]) -> 91371 | E321: 2016-01 | F321: 1537306 | G321: 1
A322: 2016-01-15 오전 12:00:00 | B322: GARDEN_REWARD | C322: -86938 | D322: =ABS(RC[-1]) -> 86938 | E322: 2016-01 | F322: 1624244 | G322: 1
A323: 2016-01-16 오전 12:00:00 | B323: GARDEN_REWARD | C323: -77725 | D323: =ABS(RC[-1]) -> 77725 | E323: 2016-01 | F323: 1701969 | G323: 1
A324: 2016-01-17 오전 12:00:00 | B324: GARDEN_REWARD | C324: -86307 | D324: =ABS(RC[-1]) -> 86307 | E324: 2016-01 | F324: 1788276 | G324: 1
A325: 2016-01-18 오전 12:00:00 | B325: GARDEN_REWARD | C325: -82608 | D325: =ABS(RC[-1]) -> 82608 | E325: 2016-01 | F325: 1870884 | G325: 1
A326: 2016-01-19 오전 12:00:00 | B326: GARDEN_REWARD | C326: -69469 | D326: =ABS(RC[-1]) -> 69469 | E326: 2016-01 | F326: 1940353 | G326: 1
A327: 2016-01-20 오전 12:00:00 | B327: GARDEN_REWARD | C327: -75538 | D327: =ABS(RC[-1]) -> 75538 | E327: 2016-01 | F327: 2015891 | G327: 1
A328: 2016-01-21 오전 12:00:00 | B328: GARDEN_REWARD | C328: -70185 | D328: =ABS(RC[-1]) -> 70185 | E328: 2016-01 | F328: 2086076 | G328: 1
A329: 2016-01-22 오전 12:00:00 | B329: GARDEN_REWARD | C329: -69540 | D329: =ABS(RC[-1]) -> 69540 | E329: 2016-01 | F329: 2155616 | G329: 1
A330: 2016-01-23 오전 12:00:00 | B330: GARDEN_REWARD | C330: -61596 | D330: =ABS(RC[-1]) -> 61596 | E330: 2016-01 | F330: 2217212 | G330: 1
A331: 2016-01-24 오전 12:00:00 | B331: GARDEN_REWARD | C331: -70474 | D331: =ABS(RC[-1]) -> 70474 | E331: 2016-01 | F331: 2287686 | G331: 1
A332: 2016-01-25 오전 12:00:00 | B332: GARDEN_REWARD | C332: -70198 | D332: =ABS(RC[-1]) -> 70198 | E332: 2016-01 | F332: 2357884 | G332: 1
A333: 2016-01-26 오전 12:00:00 | B333: GARDEN_REWARD | C333: -66894 | D333: =ABS(RC[-1]) -> 66894 | E333: 2016-01 | F333: 2424778 | G333: 1
A334: 2016-01-27 오전 12:00:00 | B334: GARDEN_REWARD | C334: -56897 | D334: =ABS(RC[-1]) -> 56897 | E334: 2016-01 | F334: 2481675 | G334: 1
A335: 2016-01-28 오전 12:00:00 | B335: GARDEN_REWARD | C335: -65055 | D335: =ABS(RC[-1]) -> 65055 | E335: 2016-01 | F335: 2546730 | G335: 1
A336: 2016-01-29 오전 12:00:00 | B336: GARDEN_REWARD | C336: -60013 | D336: =ABS(RC[-1]) -> 60013 | E336: 2016-01 | F336: 2606743 | G336: 1
A337: 2016-01-30 오전 12:00:00 | B337: GARDEN_REWARD | C337: -60241 | D337: =ABS(RC[-1]) -> 60241 | E337: 2016-01 | F337: 2666984 | G337: 1
A338: 2016-01-31 오전 12:00:00 | B338: GARDEN_REWARD | C338: -49289 | D338: =ABS(RC[-1]) -> 49289 | E338: 2016-01 | F338: 2716273 | G338: 0
A339: 2016-02-01 오전 12:00:00 | B339: GARDEN_REWARD | C339: -226014 | D339: =ABS(RC[-1]) -> 226014 | E339: 2016-02 | F339: 226014 | G339: 1
A340: 2016-02-02 오전 12:00:00 | B340: GARDEN_REWARD | C340: -101377 | D340: =ABS(RC[-1]) -> 101377 | E340: 2016-02 | F340: 327391 | G340: 1
A341: 2016-02-03 오전 12:00:00 | B341: GARDEN_REWARD | C341: -89786 | D341: =ABS(RC[-1]) -> 89786 | E341: 2016-02 | F341: 417177 | G341: 1
A342: 2016-02-04 오전 12:00:00 | B342: GARDEN_REWARD | C342: -90411 | D342: =ABS(RC[-1]) -> 90411 | E342: 2016-02 | F342: 507588 | G342: 1
A343: 2016-02-05 오전 12:00:00 | B343: GARDEN_REWARD | C343: -95683 | D343: =ABS(RC[-1]) -> 95683 | E343: 2016-02 | F343: 603271 | G343: 1
A344: 2016-02-06 오전 12:00:00 | B344: GARDEN_REWARD | C344: -85965 | D344: =ABS(RC[-1]) -> 85965 | E344: 2016-02 | F344: 689236 | G344: 1
A345: 2016-02-07 오전 12:00:00 | B345: GARDEN_REWARD | C345: -74059 | D345: =ABS(RC[-1]) -> 74059 | E345: 2016-02 | F345: 763295 | G345: 1
A346: 2016-02-08 오전 12:00:00 | B346: GARDEN_REWARD | C346: -81723 | D346: =ABS(RC[-1]) -> 81723 | E346: 2016-02 | F346: 845018 | G346: 1
A347: 2016-02-09 오전 12:00:00 | B347: GARDEN_REWARD | C347: -85692 | D347: =ABS(RC[-1]) -> 85692 | E347: 2016-02 | F347: 930710 | G347: 1
A348: 2016-02-10 오전 12:00:00 | B348: GARDEN_REWARD | C348: -90633 | D348: =ABS(RC[-1]) -> 90633 | E348: 2016-02 | F348: 1021343 | G348: 1
A349: 2016-02-11 오전 12:00:00 | B349: GARDEN_REWARD | C349: -85909 | D349: =ABS(RC[-1]) -> 85909 | E349: 2016-02 | F349: 1107252 | G349: 1
A350: 2016-02-12 오전 12:00:00 | B350: GARDEN_REWARD | C350: -85647 | D350: =ABS(RC[-1]) -> 85647 | E350: 2016-02 | F350: 1192899 | G350: 1
A351: 2016-02-13 오전 12:00:00 | B351: GARDEN_REWARD | C351: -77724 | D351: =ABS(RC[-1]) -> 77724 | E351: 2016-02 | F351: 1270623 | G351: 1
A352: 2016-02-14 오전 12:00:00 | B352: GARDEN_REWARD | C352: -80463 | D352: =ABS(RC[-1]) -> 80463 | E352: 2016-02 | F352: 1351086 | G352: 1
A353: 2016-02-15 오전 12:00:00 | B353: GARDEN_REWARD | C353: -83750 | D353: =ABS(RC[-1]) -> 83750 | E353: 2016-02 | F353: 1434836 | G353: 1
A354: 2016-02-16 오전 12:00:00 | B354: GARDEN_REWARD | C354: -76742 | D354: =ABS(RC[-1]) -> 76742 | E354: 2016-02 | F354: 1511578 | G354: 1
A355: 2016-02-17 오전 12:00:00 | B355: GARDEN_REWARD | C355: -69951 | D355: =ABS(RC[-1]) -> 69951 | E355: 2016-02 | F355: 1581529 | G355: 1
A356: 2016-02-18 오전 12:00:00 | B356: GARDEN_REWARD | C356: -77302 | D356: =ABS(RC[-1]) -> 77302 | E356: 2016-02 | F356: 1658831 | G356: 1
A357: 2016-02-19 오전 12:00:00 | B357: GARDEN_REWARD | C357: -74362 | D357: =ABS(RC[-1]) -> 74362 | E357: 2016-02 | F357: 1733193 | G357: 1
A358: 2016-02-20 오전 12:00:00 | B358: GARDEN_REWARD | C358: -70666 | D358: =ABS(RC[-1]) -> 70666 | E358: 2016-02 | F358: 1803859 | G358: 1
A359: 2016-02-21 오전 12:00:00 | B359: GARDEN_REWARD | C359: -75312 | D359: =ABS(RC[-1]) -> 75312 | E359: 2016-02 | F359: 1879171 | G359: 1
A360: 2016-02-22 오전 12:00:00 | B360: GARDEN_REWARD | C360: -66106 | D360: =ABS(RC[-1]) -> 66106 | E360: 2016-02 | F360: 1945277 | G360: 1
A361: 2016-02-23 오전 12:00:00 | B361: GARDEN_REWARD | C361: -67855 | D361: =ABS(RC[-1]) -> 67855 | E361: 2016-02 | F361: 2013132 | G361: 1
A362: 2016-02-24 오전 12:00:00 | B362: GARDEN_REWARD | C362: -57767 | D362: =ABS(RC[-1]) -> 57767 | E362: 2016-02 | F362: 2070899 | G362: 1
A363: 2016-02-25 오전 12:00:00 | B363: GARDEN_REWARD | C363: -57803 | D363: =ABS(RC[-1]) -> 57803 | E363: 2016-02 | F363: 2128702 | G363: 1
A364: 2016-02-26 오전 12:00:00 | B364: GARDEN_REWARD | C364: -61929 | D364: =ABS(RC[-1]) -> 61929 | E364: 2016-02 | F364: 2190631 | G364: 1
A365: 2016-02-27 오전 12:00:00 | B365: GARDEN_REWARD | C365: -56037 | D365: =ABS(RC[-1]) -> 56037 | E365: 2016-02 | F365: 2246668 | G365: 1
A366: 2016-02-28 오전 12:00:00 | B366: GARDEN_REWARD | C366: -54212 | D366: =ABS(RC[-1]) -> 54212 | E366: 2016-02 | F366: 2300880 | G366: 1
A367: 2016-02-29 오전 12:00:00 | B367: GARDEN_REWARD | C367: -48829 | D367: =ABS(RC[-1]) -> 48829 | E367: 2016-02 | F367: 2349709 | G367: 0
A368: 2016-03-01 오전 12:00:00 | B368: GARDEN_REWARD | C368: -216183 | D368: =ABS(RC[-1]) -> 216183 | E368: 2016-03 | F368: 216183 | G368: 1
A369: 2016-03-02 오전 12:00:00 | B369: GARDEN_REWARD | C369: -105806 | D369: =ABS(RC[-1]) -> 105806 | E369: 2016-03 | F369: 321989 | G369: 1
A370: 2016-03-03 오전 12:00:00 | B370: GARDEN_REWARD | C370: -94891 | D370: =ABS(RC[-1]) -> 94891 | E370: 2016-03 | F370: 416880 | G370: 1
A371: 2016-03-04 오전 12:00:00 | B371: GARDEN_REWARD | C371: -90081 | D371: =ABS(RC[-1]) -> 90081 | E371: 2016-03 | F371: 506961 | G371: 1
A372: 2016-03-05 오전 12:00:00 | B372: GARDEN_REWARD | C372: -91541 | D372: =ABS(RC[-1]) -> 91541 | E372: 2016-03 | F372: 598502 | G372: 1
A373: 2016-03-06 오전 12:00:00 | B373: GARDEN_REWARD | C373: -97584 | D373: =ABS(RC[-1]) -> 97584 | E373: 2016-03 | F373: 696086 | G373: 1
A374: 2016-03-07 오전 12:00:00 | B374: GARDEN_REWARD | C374: -88611 | D374: =ABS(RC[-1]) -> 88611 | E374: 2016-03 | F374: 784697 | G374: 1
A375: 2016-03-08 오전 12:00:00 | B375: GARDEN_REWARD | C375: -85085 | D375: =ABS(RC[-1]) -> 85085 | E375: 2016-03 | F375: 869782 | G375: 1
A376: 2016-03-09 오전 12:00:00 | B376: GARDEN_REWARD | C376: -85781 | D376: =ABS(RC[-1]) -> 85781 | E376: 2016-03 | F376: 955563 | G376: 1
A377: 2016-03-10 오전 12:00:00 | B377: GARDEN_REWARD | C377: -79892 | D377: =ABS(RC[-1]) -> 79892 | E377: 2016-03 | F377: 1035455 | G377: 1
A378: 2016-03-11 오전 12:00:00 | B378: GARDEN_REWARD | C378: -77997 | D378: =ABS(RC[-1]) -> 77997 | E378: 2016-03 | F378: 1113452 | G378: 1
A379: 2016-03-12 오전 12:00:00 | B379: GARDEN_REWARD | C379: -76675 | D379: =ABS(RC[-1]) -> 76675 | E379: 2016-03 | F379: 1190127 | G379: 1
A380: 2016-03-13 오전 12:00:00 | B380: GARDEN_REWARD | C380: -81750 | D380: =ABS(RC[-1]) -> 81750 | E380: 2016-03 | F380: 1271877 | G380: 1
A381: 2016-03-14 오전 12:00:00 | B381: GARDEN_REWARD | C381: -78845 | D381: =ABS(RC[-1]) -> 78845 | E381: 2016-03 | F381: 1350722 | G381: 1
A382: 2016-03-15 오전 12:00:00 | B382: GARDEN_REWARD | C382: -68741 | D382: =ABS(RC[-1]) -> 68741 | E382: 2016-03 | F382: 1419463 | G382: 1
A383: 2016-03-16 오전 12:00:00 | B383: GARDEN_REWARD | C383: -74095 | D383: =ABS(RC[-1]) -> 74095 | E383: 2016-03 | F383: 1493558 | G383: 1
A384: 2016-03-17 오전 12:00:00 | B384: GARDEN_REWARD | C384: -69586 | D384: =ABS(RC[-1]) -> 69586 | E384: 2016-03 | F384: 1563144 | G384: 1
A385: 2016-03-18 오전 12:00:00 | B385: GARDEN_REWARD | C385: -67979 | D385: =ABS(RC[-1]) -> 67979 | E385: 2016-03 | F385: 1631123 | G385: 1
A386: 2016-03-19 오전 12:00:00 | B386: GARDEN_REWARD | C386: -64308 | D386: =ABS(RC[-1]) -> 64308 | E386: 2016-03 | F386: 1695431 | G386: 1
A387: 2016-03-20 오전 12:00:00 | B387: GARDEN_REWARD | C387: -73222 | D387: =ABS(RC[-1]) -> 73222 | E387: 2016-03 | F387: 1768653 | G387: 1
A388: 2016-03-21 오전 12:00:00 | B388: GARDEN_REWARD | C388: -63585 | D388: =ABS(RC[-1]) -> 63585 | E388: 2016-03 | F388: 1832238 | G388: 1
A389: 2016-03-22 오전 12:00:00 | B389: GARDEN_REWARD | C389: -59535 | D389: =ABS(RC[-1]) -> 59535 | E389: 2016-03 | F389: 1891773 | G389: 1
A390: 2016-03-23 오전 12:00:00 | B390: GARDEN_REWARD | C390: -59746 | D390: =ABS(RC[-1]) -> 59746 | E390: 2016-03 | F390: 1951519 | G390: 1
A391: 2016-03-24 오전 12:00:00 | B391: GARDEN_REWARD | C391: -62941 | D391: =ABS(RC[-1]) -> 62941 | E391: 2016-03 | F391: 2014460 | G391: 1
A392: 2016-03-25 오전 12:00:00 | B392: GARDEN_REWARD | C392: -55505 | D392: =ABS(RC[-1]) -> 55505 | E392: 2016-03 | F392: 2069965 | G392: 1
A393: 2016-03-26 오전 12:00:00 | B393: GARDEN_REWARD | C393: -55787 | D393: =ABS(RC[-1]) -> 55787 | E393: 2016-03 | F393: 2125752 | G393: 1
A394: 2016-03-27 오전 12:00:00 | B394: GARDEN_REWARD | C394: -57111 | D394: =ABS(RC[-1]) -> 57111 | E394: 2016-03 | F394: 2182863 | G394: 1
A395: 2016-03-28 오전 12:00:00 | B395: GARDEN_REWARD | C395: -52836 | D395: =ABS(RC[-1]) -> 52836 | E395: 2016-03 | F395: 2235699 | G395: 1
A396: 2016-03-29 오전 12:00:00 | B396: GARDEN_REWARD | C396: -50411 | D396: =ABS(RC[-1]) -> 50411 | E396: 2016-03 | F396: 2286110 | G396: 1
A397: 2016-03-30 오전 12:00:00 | B397: GARDEN_REWARD | C397: -44218 | D397: =ABS(RC[-1]) -> 44218 | E397: 2016-03 | F397: 2330328 | G397: 1
A398: 2016-03-31 오전 12:00:00 | B398: GARDEN_REWARD | C398: -38914 | D398: =ABS(RC[-1]) -> 38914 | E398: 2016-03 | F398: 2369242 | G398: 0
A399: 2016-04-01 오전 12:00:00 | B399: GARDEN_REWARD | C399: -214010 | D399: =ABS(RC[-1]) -> 214010 | E399: 2016-04 | F399: 214010 | G399: 1
A400: 2016-04-02 오전 12:00:00 | B400: GARDEN_REWARD | C400: -91173 | D400: =ABS(RC[-1]) -> 91173 | E400: 2016-04 | F400: 305183 | G400: 1
A401: 2016-04-03 오전 12:00:00 | B401: GARDEN_REWARD | C401: -90231 | D401: =ABS(RC[-1]) -> 90231 | E401: 2016-04 | F401: 395414 | G401: 1
A402: 2016-04-04 오전 12:00:00 | B402: GARDEN_REWARD | C402: -93329 | D402: =ABS(RC[-1]) -> 93329 | E402: 2016-04 | F402: 488743 | G402: 1
A403: 2016-04-05 오전 12:00:00 | B403: GARDEN_REWARD | C403: -83360 | D403: =ABS(RC[-1]) -> 83360 | E403: 2016-04 | F403: 572103 | G403: 1
A404: 2016-04-06 오전 12:00:00 | B404: GARDEN_REWARD | C404: -83497 | D404: =ABS(RC[-1]) -> 83497 | E404: 2016-04 | F404: 655600 | G404: 1
A405: 2016-04-07 오전 12:00:00 | B405: GARDEN_REWARD | C405: -81197 | D405: =ABS(RC[-1]) -> 81197 | E405: 2016-04 | F405: 736797 | G405: 1
A406: 2016-04-08 오전 12:00:00 | B406: GARDEN_REWARD | C406: -78706 | D406: =ABS(RC[-1]) -> 78706 | E406: 2016-04 | F406: 815503 | G406: 1
A407: 2016-04-09 오전 12:00:00 | B407: GARDEN_REWARD | C407: -74762 | D407: =ABS(RC[-1]) -> 74762 | E407: 2016-04 | F407: 890265 | G407: 1
A408: 2016-04-10 오전 12:00:00 | B408: GARDEN_REWARD | C408: -74259 | D408: =ABS(RC[-1]) -> 74259 | E408: 2016-04 | F408: 964524 | G408: 1
A409: 2016-04-11 오전 12:00:00 | B409: GARDEN_REWARD | C409: -74875 | D409: =ABS(RC[-1]) -> 74875 | E409: 2016-04 | F409: 1039399 | G409: 1
A410: 2016-04-12 오전 12:00:00 | B410: GARDEN_REWARD | C410: -68582 | D410: =ABS(RC[-1]) -> 68582 | E410: 2016-04 | F410: 1107981 | G410: 1
A411: 2016-04-13 오전 12:00:00 | B411: GARDEN_REWARD | C411: -75179 | D411: =ABS(RC[-1]) -> 75179 | E411: 2016-04 | F411: 1183160 | G411: 1
A412: 2016-04-14 오전 12:00:00 | B412: GARDEN_REWARD | C412: -73129 | D412: =ABS(RC[-1]) -> 73129 | E412: 2016-04 | F412: 1256289 | G412: 1
A413: 2016-04-15 오전 12:00:00 | B413: GARDEN_REWARD | C413: -73232 | D413: =ABS(RC[-1]) -> 73232 | E413: 2016-04 | F413: 1329521 | G413: 1
A414: 2016-04-16 오전 12:00:00 | B414: GARDEN_REWARD | C414: -60091 | D414: =ABS(RC[-1]) -> 60091 | E414: 2016-04 | F414: 1389612 | G414: 1
A415: 2016-04-17 오전 12:00:00 | B415: GARDEN_REWARD | C415: -68557 | D415: =ABS(RC[-1]) -> 68557 | E415: 2016-04 | F415: 1458169 | G415: 1
A416: 2016-04-18 오전 12:00:00 | B416: GARDEN_REWARD | C416: -65035 | D416: =ABS(RC[-1]) -> 65035 | E416: 2016-04 | F416: 1523204 | G416: 1
A417: 2016-04-19 오전 12:00:00 | B417: GARDEN_REWARD | C417: -57835 | D417: =ABS(RC[-1]) -> 57835 | E417: 2016-04 | F417: 1581039 | G417: 1
A418: 2016-04-20 오전 12:00:00 | B418: GARDEN_REWARD | C418: -67062 | D418: =ABS(RC[-1]) -> 67062 | E418: 2016-04 | F418: 1648101 | G418: 1
A419: 2016-04-21 오전 12:00:00 | B419: GARDEN_REWARD | C419: -60842 | D419: =ABS(RC[-1]) -> 60842 | E419: 2016-04 | F419: 1708943 | G419: 1
A420: 2016-04-22 오전 12:00:00 | B420: GARDEN_REWARD | C420: -54946 | D420: =ABS(RC[-1]) -> 54946 | E420: 2016-04 | F420: 1763889 | G420: 1
A421: 2016-04-23 오전 12:00:00 | B421: GARDEN_REWARD | C421: -58530 | D421: =ABS(RC[-1]) -> 58530 | E421: 2016-04 | F421: 1822419 | G421: 1
A422: 2016-04-24 오전 12:00:00 | B422: GARDEN_REWARD | C422: -57918 | D422: =ABS(RC[-1]) -> 57918 | E422: 2016-04 | F422: 1880337 | G422: 1
A423: 2016-04-25 오전 12:00:00 | B423: GARDEN_REWARD | C423: -59877 | D423: =ABS(RC[-1]) -> 59877 | E423: 2016-04 | F423: 1940214 | G423: 1
A424: 2016-04-26 오전 12:00:00 | B424: GARDEN_REWARD | C424: -53048 | D424: =ABS(RC[-1]) -> 53048 | E424: 2016-04 | F424: 1993262 | G424: 1
A425: 2016-04-27 오전 12:00:00 | B425: GARDEN_REWARD | C425: -55858 | D425: =ABS(RC[-1]) -> 55858 | E425: 2016-04 | F425: 2049120 | G425: 1
A426: 2016-04-28 오전 12:00:00 | B426: GARDEN_REWARD | C426: -51668 | D426: =ABS(RC[-1]) -> 51668 | E426: 2016-04 | F426: 2100788 | G426: 1
A427: 2016-04-29 오전 12:00:00 | B427: GARDEN_REWARD | C427: -45190 | D427: =ABS(RC[-1]) -> 45190 | E427: 2016-04 | F427: 2145978 | G427: 1
A428: 2016-04-30 오전 12:00:00 | B428: GARDEN_REWARD | C428: -49809 | D428: =ABS(RC[-1]) -> 49809 | E428: 2016-04 | F428: 2195787 | G428: 0
A429: 2016-05-01 오전 12:00:00 | B429: GARDEN_REWARD | C429: -412148 | D429: =ABS(RC[-1]) -> 412148 | E429: 2016-05 | F429: 412148 | G429: 1
A430: 2016-05-02 오전 12:00:00 | B430: GARDEN_REWARD | C430: -189186 | D430: =ABS(RC[-1]) -> 189186 | E430: 2016-05 | F430: 601334 | G430: 1
A431: 2016-05-03 오전 12:00:00 | B431: GARDEN_REWARD | C431: -178464 | D431: =ABS(RC[-1]) -> 178464 | E431: 2016-05 | F431: 779798 | G431: 1
A432: 2016-05-04 오전 12:00:00 | B432: GARDEN_REWARD | C432: -81167 | D432: =ABS(RC[-1]) -> 81167 | E432: 2016-05 | F432: 860965 | G432: 1
A433: 2016-05-05 오전 12:00:00 | B433: GARDEN_REWARD | C433: -80540 | D433: =ABS(RC[-1]) -> 80540 | E433: 2016-05 | F433: 941505 | G433: 1
A434: 2016-05-06 오전 12:00:00 | B434: GARDEN_REWARD | C434: -79825 | D434: =ABS(RC[-1]) -> 79825 | E434: 2016-05 | F434: 1021330 | G434: 1
A435: 2016-05-07 오전 12:00:00 | B435: GARDEN_REWARD | C435: -68587 | D435: =ABS(RC[-1]) -> 68587 | E435: 2016-05 | F435: 1089917 | G435: 1
A436: 2016-05-08 오전 12:00:00 | B436: GARDEN_REWARD | C436: -78844 | D436: =ABS(RC[-1]) -> 78844 | E436: 2016-05 | F436: 1168761 | G436: 1
A437: 2016-05-09 오전 12:00:00 | B437: GARDEN_REWARD | C437: -80570 | D437: =ABS(RC[-1]) -> 80570 | E437: 2016-05 | F437: 1249331 | G437: 1
A438: 2016-05-10 오전 12:00:00 | B438: GARDEN_REWARD | C438: -76308 | D438: =ABS(RC[-1]) -> 76308 | E438: 2016-05 | F438: 1325639 | G438: 1
A439: 2016-05-11 오전 12:00:00 | B439: GARDEN_REWARD | C439: -76621 | D439: =ABS(RC[-1]) -> 76621 | E439: 2016-05 | F439: 1402260 | G439: 1
A440: 2016-05-12 오전 12:00:00 | B440: GARDEN_REWARD | C440: -74571 | D440: =ABS(RC[-1]) -> 74571 | E440: 2016-05 | F440: 1476831 | G440: 1
A441: 2016-05-13 오전 12:00:00 | B441: GARDEN_REWARD | C441: -66223 | D441: =ABS(RC[-1]) -> 66223 | E441: 2016-05 | F441: 1543054 | G441: 1
A442: 2016-05-14 오전 12:00:00 | B442: GARDEN_REWARD | C442: -67331 | D442: =ABS(RC[-1]) -> 67331 | E442: 2016-05 | F442: 1610385 | G442: 1
A443: 2016-05-15 오전 12:00:00 | B443: GARDEN_REWARD | C443: -73140 | D443: =ABS(RC[-1]) -> 73140 | E443: 2016-05 | F443: 1683525 | G443: 1
A444: 2016-05-16 오전 12:00:00 | B444: GARDEN_REWARD | C444: -71792 | D444: =ABS(RC[-1]) -> 71792 | E444: 2016-05 | F444: 1755317 | G444: 1
A445: 2016-05-17 오전 12:00:00 | B445: GARDEN_REWARD | C445: -61461 | D445: =ABS(RC[-1]) -> 61461 | E445: 2016-05 | F445: 1816778 | G445: 1
A446: 2016-05-18 오전 12:00:00 | B446: GARDEN_REWARD | C446: -65235 | D446: =ABS(RC[-1]) -> 65235 | E446: 2016-05 | F446: 1882013 | G446: 1
A447: 2016-05-19 오전 12:00:00 | B447: GARDEN_REWARD | C447: -65334 | D447: =ABS(RC[-1]) -> 65334 | E447: 2016-05 | F447: 1947347 | G447: 1
A448: 2016-05-20 오전 12:00:00 | B448: GARDEN_REWARD | C448: -61461 | D448: =ABS(RC[-1]) -> 61461 | E448: 2016-05 | F448: 2008808 | G448: 1
A449: 2016-05-21 오전 12:00:00 | B449: GARDEN_REWARD | C449: -56838 | D449: =ABS(RC[-1]) -> 56838 | E449: 2016-05 | F449: 2065646 | G449: 1
A450: 2016-05-22 오전 12:00:00 | B450: GARDEN_REWARD | C450: -58494 | D450: =ABS(RC[-1]) -> 58494 | E450: 2016-05 | F450: 2124140 | G450: 1
A451: 2016-05-23 오전 12:00:00 | B451: GARDEN_REWARD | C451: -56764 | D451: =ABS(RC[-1]) -> 56764 | E451: 2016-05 | F451: 2180904 | G451: 1
A452: 2016-05-24 오전 12:00:00 | B452: GARDEN_REWARD | C452: -56772 | D452: =ABS(RC[-1]) -> 56772 | E452: 2016-05 | F452: 2237676 | G452: 1
A453: 2016-05-25 오전 12:00:00 | B453: GARDEN_REWARD | C453: -58799 | D453: =ABS(RC[-1]) -> 58799 | E453: 2016-05 | F453: 2296475 | G453: 1
A454: 2016-05-26 오전 12:00:00 | B454: GARDEN_REWARD | C454: -54105 | D454: =ABS(RC[-1]) -> 54105 | E454: 2016-05 | F454: 2350580 | G454: 1
A455: 2016-05-27 오전 12:00:00 | B455: GARDEN_REWARD | C455: -54373 | D455: =ABS(RC[-1]) -> 54373 | E455: 2016-05 | F455: 2404953 | G455: 1
A456: 2016-05-28 오전 12:00:00 | B456: GARDEN_REWARD | C456: -49412 | D456: =ABS(RC[-1]) -> 49412 | E456: 2016-05 | F456: 2454365 | G456: 1
A457: 2016-05-29 오전 12:00:00 | B457: GARDEN_REWARD | C457: -49739 | D457: =ABS(RC[-1]) -> 49739 | E457: 2016-05 | F457: 2504104 | G457: 1
A458: 2016-05-30 오전 12:00:00 | B458: GARDEN_REWARD | C458: -48103 | D458: =ABS(RC[-1]) -> 48103 | E458: 2016-05 | F458: 2552207 | G458: 1
A459: 2016-05-31 오전 12:00:00 | B459: GARDEN_REWARD | C459: -44540 | D459: =ABS(RC[-1]) -> 44540 | E459: 2016-05 | F459: 2596747 | G459: 0
A460: 2016-06-01 오전 12:00:00 | B460: GARDEN_REWARD | C460: -229583 | D460: =ABS(RC[-1]) -> 229583 | E460: 2016-06 | F460: 229583 | G460: 1
A461: 2016-06-02 오전 12:00:00 | B461: GARDEN_REWARD | C461: -99781 | D461: =ABS(RC[-1]) -> 99781 | E461: 2016-06 | F461: 329364 | G461: 1
A462: 2016-06-03 오전 12:00:00 | B462: GARDEN_REWARD | C462: -93173 | D462: =ABS(RC[-1]) -> 93173 | E462: 2016-06 | F462: 422537 | G462: 1
A463: 2016-06-04 오전 12:00:00 | B463: GARDEN_REWARD | C463: -81711 | D463: =ABS(RC[-1]) -> 81711 | E463: 2016-06 | F463: 504248 | G463: 1
A464: 2016-06-05 오전 12:00:00 | B464: GARDEN_REWARD | C464: -83265 | D464: =ABS(RC[-1]) -> 83265 | E464: 2016-06 | F464: 587513 | G464: 1
A465: 2016-06-06 오전 12:00:00 | B465: GARDEN_REWARD | C465: -84974 | D465: =ABS(RC[-1]) -> 84974 | E465: 2016-06 | F465: 672487 | G465: 1
A466: 2016-06-07 오전 12:00:00 | B466: GARDEN_REWARD | C466: -79241 | D466: =ABS(RC[-1]) -> 79241 | E466: 2016-06 | F466: 751728 | G466: 1
A467: 2016-06-08 오전 12:00:00 | B467: GARDEN_REWARD | C467: -80797 | D467: =ABS(RC[-1]) -> 80797 | E467: 2016-06 | F467: 832525 | G467: 1
A468: 2016-06-09 오전 12:00:00 | B468: GARDEN_REWARD | C468: -68304 | D468: =ABS(RC[-1]) -> 68304 | E468: 2016-06 | F468: 900829 | G468: 1
A469: 2016-06-10 오전 12:00:00 | B469: GARDEN_REWARD | C469: -71751 | D469: =ABS(RC[-1]) -> 71751 | E469: 2016-06 | F469: 972580 | G469: 1
A470: 2016-06-11 오전 12:00:00 | B470: GARDEN_REWARD | C470: -70541 | D470: =ABS(RC[-1]) -> 70541 | E470: 2016-06 | F470: 1043121 | G470: 1
A471: 2016-06-12 오전 12:00:00 | B471: GARDEN_REWARD | C471: -75165 | D471: =ABS(RC[-1]) -> 75165 | E471: 2016-06 | F471: 1118286 | G471: 1
A472: 2016-06-13 오전 12:00:00 | B472: GARDEN_REWARD | C472: -72050 | D472: =ABS(RC[-1]) -> 72050 | E472: 2016-06 | F472: 1190336 | G472: 1
A473: 2016-06-14 오전 12:00:00 | B473: GARDEN_REWARD | C473: -66297 | D473: =ABS(RC[-1]) -> 66297 | E473: 2016-06 | F473: 1256633 | G473: 1
A474: 2016-06-15 오전 12:00:00 | B474: GARDEN_REWARD | C474: -65182 | D474: =ABS(RC[-1]) -> 65182 | E474: 2016-06 | F474: 1321815 | G474: 1
A475: 2016-06-16 오전 12:00:00 | B475: GARDEN_REWARD | C475: -67791 | D475: =ABS(RC[-1]) -> 67791 | E475: 2016-06 | F475: 1389606 | G475: 1
A476: 2016-06-17 오전 12:00:00 | B476: GARDEN_REWARD | C476: -64842 | D476: =ABS(RC[-1]) -> 64842 | E476: 2016-06 | F476: 1454448 | G476: 1
A477: 2016-06-18 오전 12:00:00 | B477: GARDEN_REWARD | C477: -56929 | D477: =ABS(RC[-1]) -> 56929 | E477: 2016-06 | F477: 1511377 | G477: 1
A478: 2016-06-19 오전 12:00:00 | B478: GARDEN_REWARD | C478: -63375 | D478: =ABS(RC[-1]) -> 63375 | E478: 2016-06 | F478: 1574752 | G478: 1
A479: 2016-06-20 오전 12:00:00 | B479: GARDEN_REWARD | C479: -62599 | D479: =ABS(RC[-1]) -> 62599 | E479: 2016-06 | F479: 1637351 | G479: 1
A480: 2016-06-21 오전 12:00:00 | B480: GARDEN_REWARD | C480: -66290 | D480: =ABS(RC[-1]) -> 66290 | E480: 2016-06 | F480: 1703641 | G480: 1
A481: 2016-06-22 오전 12:00:00 | B481: GARDEN_REWARD | C481: -64404 | D481: =ABS(RC[-1]) -> 64404 | E481: 2016-06 | F481: 1768045 | G481: 1
A482: 2016-06-23 오전 12:00:00 | B482: GARDEN_REWARD | C482: -62360 | D482: =ABS(RC[-1]) -> 62360 | E482: 2016-06 | F482: 1830405 | G482: 1
A483: 2016-06-24 오전 12:00:00 | B483: GARDEN_REWARD | C483: -59828 | D483: =ABS(RC[-1]) -> 59828 | E483: 2016-06 | F483: 1890233 | G483: 1
A484: 2016-06-25 오전 12:00:00 | B484: GARDEN_REWARD | C484: -56140 | D484: =ABS(RC[-1]) -> 56140 | E484: 2016-06 | F484: 1946373 | G484: 1
A485: 2016-06-26 오전 12:00:00 | B485: GARDEN_REWARD | C485: -50946 | D485: =ABS(RC[-1]) -> 50946 | E485: 2016-06 | F485: 1997319 | G485: 1
A486: 2016-06-27 오전 12:00:00 | B486: GARDEN_REWARD | C486: -54075 | D486: =ABS(RC[-1]) -> 54075 | E486: 2016-06 | F486: 2051394 | G486: 1
A487: 2016-06-28 오전 12:00:00 | B487: GARDEN_REWARD | C487: -46586 | D487: =ABS(RC[-1]) -> 46586 | E487: 2016-06 | F487: 2097980 | G487: 1
A488: 2016-06-29 오전 12:00:00 | B488: GARDEN_REWARD | C488: -46699 | D488: =ABS(RC[-1]) -> 46699 | E488: 2016-06 | F488: 2144679 | G488: 1
A489: 2016-06-30 오전 12:00:00 | B489: GARDEN_REWARD | C489: -35203 | D489: =ABS(RC[-1]) -> 35203 | E489: 2016-06 | F489: 2179882 | G489: 0
A490: 2016-07-01 오전 12:00:00 | B490: GARDEN_REWARD | C490: -161493 | D490: =ABS(RC[-1]) -> 161493 | E490: 2016-07 | F490: 161493 | G490: 1
A491: 2016-07-02 오전 12:00:00 | B491: GARDEN_REWARD | C491: -85527 | D491: =ABS(RC[-1]) -> 85527 | E491: 2016-07 | F491: 247020 | G491: 1
A492: 2016-07-03 오전 12:00:00 | B492: GARDEN_REWARD | C492: -85640 | D492: =ABS(RC[-1]) -> 85640 | E492: 2016-07 | F492: 332660 | G492: 1
A493: 2016-07-04 오전 12:00:00 | B493: GARDEN_REWARD | C493: -95884 | D493: =ABS(RC[-1]) -> 95884 | E493: 2016-07 | F493: 428544 | G493: 1
A494: 2016-07-05 오전 12:00:00 | B494: GARDEN_REWARD | C494: -85876 | D494: =ABS(RC[-1]) -> 85876 | E494: 2016-07 | F494: 514420 | G494: 1
A495: 2016-07-06 오전 12:00:00 | B495: GARDEN_REWARD | C495: -86652 | D495: =ABS(RC[-1]) -> 86652 | E495: 2016-07 | F495: 601072 | G495: 1
A496: 2016-07-07 오전 12:00:00 | B496: GARDEN_REWARD | C496: -74270 | D496: =ABS(RC[-1]) -> 74270 | E496: 2016-07 | F496: 675342 | G496: 1
A497: 2016-07-08 오전 12:00:00 | B497: GARDEN_REWARD | C497: -70362 | D497: =ABS(RC[-1]) -> 70362 | E497: 2016-07 | F497: 745704 | G497: 1
A498: 2016-07-09 오전 12:00:00 | B498: GARDEN_REWARD | C498: -72107 | D498: =ABS(RC[-1]) -> 72107 | E498: 2016-07 | F498: 817811 | G498: 1
A499: 2016-07-10 오전 12:00:00 | B499: GARDEN_REWARD | C499: -74315 | D499: =ABS(RC[-1]) -> 74315 | E499: 2016-07 | F499: 892126 | G499: 1
A500: 2016-07-11 오전 12:00:00 | B500: GARDEN_REWARD | C500: -79349 | D500: =ABS(RC[-1]) -> 79349 | E500: 2016-07 | F500: 971475 | G500: 1
A501: 2016-07-12 오전 12:00:00 | B501: GARDEN_REWARD | C501: -71859 | D501: =ABS(RC[-1]) -> 71859 | E501: 2016-07 | F501: 1043334 | G501: 1
A502: 2016-07-13 오전 12:00:00 | B502: GARDEN_REWARD | C502: -69137 | D502: =ABS(RC[-1]) -> 69137 | E502: 2016-07 | F502: 1112471 | G502: 1
A503: 2016-07-14 오전 12:00:00 | B503: GARDEN_REWARD | C503: -61111 | D503: =ABS(RC[-1]) -> 61111 | E503: 2016-07 | F503: 1173582 | G503: 1
A504: 2016-07-15 오전 12:00:00 | B504: GARDEN_REWARD | C504: -67457 | D504: =ABS(RC[-1]) -> 67457 | E504: 2016-07 | F504: 1241039 | G504: 1
A505: 2016-07-16 오전 12:00:00 | B505: GARDEN_REWARD | C505: -69319 | D505: =ABS(RC[-1]) -> 69319 | E505: 2016-07 | F505: 1310358 | G505: 1
A506: 2016-07-17 오전 12:00:00 | B506: GARDEN_REWARD | C506: -74309 | D506: =ABS(RC[-1]) -> 74309 | E506: 2016-07 | F506: 1384667 | G506: 1
A507: 2016-07-18 오전 12:00:00 | B507: GARDEN_REWARD | C507: -65746 | D507: =ABS(RC[-1]) -> 65746 | E507: 2016-07 | F507: 1450413 | G507: 1
A508: 2016-07-19 오전 12:00:00 | B508: GARDEN_REWARD | C508: -65487 | D508: =ABS(RC[-1]) -> 65487 | E508: 2016-07 | F508: 1515900 | G508: 1
A509: 2016-07-20 오전 12:00:00 | B509: GARDEN_REWARD | C509: -70810 | D509: =ABS(RC[-1]) -> 70810 | E509: 2016-07 | F509: 1586710 | G509: 1
A510: 2016-07-21 오전 12:00:00 | B510: GARDEN_REWARD | C510: -66949 | D510: =ABS(RC[-1]) -> 66949 | E510: 2016-07 | F510: 1653659 | G510: 1
A511: 2016-07-22 오전 12:00:00 | B511: GARDEN_REWARD | C511: -60111 | D511: =ABS(RC[-1]) -> 60111 | E511: 2016-07 | F511: 1713770 | G511: 1
A512: 2016-07-23 오전 12:00:00 | B512: GARDEN_REWARD | C512: -56964 | D512: =ABS(RC[-1]) -> 56964 | E512: 2016-07 | F512: 1770734 | G512: 1
A513: 2016-07-24 오전 12:00:00 | B513: GARDEN_REWARD | C513: -66025 | D513: =ABS(RC[-1]) -> 66025 | E513: 2016-07 | F513: 1836759 | G513: 1
A514: 2016-07-25 오전 12:00:00 | B514: GARDEN_REWARD | C514: -60720 | D514: =ABS(RC[-1]) -> 60720 | E514: 2016-07 | F514: 1897479 | G514: 1
A515: 2016-07-26 오전 12:00:00 | B515: GARDEN_REWARD | C515: -55613 | D515: =ABS(RC[-1]) -> 55613 | E515: 2016-07 | F515: 1953092 | G515: 1
A516: 2016-07-27 오전 12:00:00 | B516: GARDEN_REWARD | C516: -51619 | D516: =ABS(RC[-1]) -> 51619 | E516: 2016-07 | F516: 2004711 | G516: 1
A517: 2016-07-28 오전 12:00:00 | B517: GARDEN_REWARD | C517: -65838 | D517: =ABS(RC[-1]) -> 65838 | E517: 2016-07 | F517: 2070549 | G517: 1
A518: 2016-07-29 오전 12:00:00 | B518: GARDEN_REWARD | C518: -57838 | D518: =ABS(RC[-1]) -> 57838 | E518: 2016-07 | F518: 2128387 | G518: 1
A519: 2016-07-30 오전 12:00:00 | B519: GARDEN_REWARD | C519: -52601 | D519: =ABS(RC[-1]) -> 52601 | E519: 2016-07 | F519: 2180988 | G519: 1
A520: 2016-07-31 오전 12:00:00 | B520: GARDEN_REWARD | C520: -46328 | D520: =ABS(RC[-1]) -> 46328 | E520: 2016-07 | F520: 2227316 | G520: 0
A521: 2016-08-01 오전 12:00:00 | B521: GARDEN_REWARD | C521: -190689 | D521: =ABS(RC[-1]) -> 190689 | E521: 2016-08 | F521: 190689 | G521: 1
A522: 2016-08-02 오전 12:00:00 | B522: GARDEN_REWARD | C522: -90831 | D522: =ABS(RC[-1]) -> 90831 | E522: 2016-08 | F522: 281520 | G522: 1
A523: 2016-08-03 오전 12:00:00 | B523: GARDEN_REWARD | C523: -93631 | D523: =ABS(RC[-1]) -> 93631 | E523: 2016-08 | F523: 375151 | G523: 1
A524: 2016-08-04 오전 12:00:00 | B524: GARDEN_REWARD | C524: -95317 | D524: =ABS(RC[-1]) -> 95317 | E524: 2016-08 | F524: 470468 | G524: 1
A525: 2016-08-05 오전 12:00:00 | B525: GARDEN_REWARD | C525: -84589 | D525: =ABS(RC[-1]) -> 84589 | E525: 2016-08 | F525: 555057 | G525: 1
A526: 2016-08-06 오전 12:00:00 | B526: GARDEN_REWARD | C526: -82530 | D526: =ABS(RC[-1]) -> 82530 | E526: 2016-08 | F526: 637587 | G526: 1
A527: 2016-08-07 오전 12:00:00 | B527: GARDEN_REWARD | C527: -86257 | D527: =ABS(RC[-1]) -> 86257 | E527: 2016-08 | F527: 723844 | G527: 1
A528: 2016-08-08 오전 12:00:00 | B528: GARDEN_REWARD | C528: -86089 | D528: =ABS(RC[-1]) -> 86089 | E528: 2016-08 | F528: 809933 | G528: 1
A529: 2016-08-09 오전 12:00:00 | B529: GARDEN_REWARD | C529: -81744 | D529: =ABS(RC[-1]) -> 81744 | E529: 2016-08 | F529: 891677 | G529: 1
A530: 2016-08-10 오전 12:00:00 | B530: GARDEN_REWARD | C530: -80004 | D530: =ABS(RC[-1]) -> 80004 | E530: 2016-08 | F530: 971681 | G530: 1
A531: 2016-08-11 오전 12:00:00 | B531: GARDEN_REWARD | C531: -76256 | D531: =ABS(RC[-1]) -> 76256 | E531: 2016-08 | F531: 1047937 | G531: 1
A532: 2016-08-12 오전 12:00:00 | B532: GARDEN_REWARD | C532: -72862 | D532: =ABS(RC[-1]) -> 72862 | E532: 2016-08 | F532: 1120799 | G532: 1
A533: 2016-08-13 오전 12:00:00 | B533: GARDEN_REWARD | C533: -77643 | D533: =ABS(RC[-1]) -> 77643 | E533: 2016-08 | F533: 1198442 | G533: 1
A534: 2016-08-14 오전 12:00:00 | B534: GARDEN_REWARD | C534: -76338 | D534: =ABS(RC[-1]) -> 76338 | E534: 2016-08 | F534: 1274780 | G534: 1
A535: 2016-08-15 오전 12:00:00 | B535: GARDEN_REWARD | C535: -70949 | D535: =ABS(RC[-1]) -> 70949 | E535: 2016-08 | F535: 1345729 | G535: 1
A536: 2016-08-16 오전 12:00:00 | B536: GARDEN_REWARD | C536: -66529 | D536: =ABS(RC[-1]) -> 66529 | E536: 2016-08 | F536: 1412258 | G536: 1
A537: 2016-08-17 오전 12:00:00 | B537: GARDEN_REWARD | C537: -74989 | D537: =ABS(RC[-1]) -> 74989 | E537: 2016-08 | F537: 1487247 | G537: 1
A538: 2016-08-18 오전 12:00:00 | B538: GARDEN_REWARD | C538: -69413 | D538: =ABS(RC[-1]) -> 69413 | E538: 2016-08 | F538: 1556660 | G538: 1
A539: 2016-08-19 오전 12:00:00 | B539: GARDEN_REWARD | C539: -66842 | D539: =ABS(RC[-1]) -> 66842 | E539: 2016-08 | F539: 1623502 | G539: 1
A540: 2016-08-20 오전 12:00:00 | B540: GARDEN_REWARD | C540: -74336 | D540: =ABS(RC[-1]) -> 74336 | E540: 2016-08 | F540: 1697838 | G540: 1
A541: 2016-08-21 오전 12:00:00 | B541: GARDEN_REWARD | C541: -78361 | D541: =ABS(RC[-1]) -> 78361 | E541: 2016-08 | F541: 1776199 | G541: 1
A542: 2016-08-22 오전 12:00:00 | B542: GARDEN_REWARD | C542: -68015 | D542: =ABS(RC[-1]) -> 68015 | E542: 2016-08 | F542: 1844214 | G542: 1
A543: 2016-08-23 오전 12:00:00 | B543: GARDEN_REWARD | C543: -61696 | D543: =ABS(RC[-1]) -> 61696 | E543: 2016-08 | F543: 1905910 | G543: 1
A544: 2016-08-24 오전 12:00:00 | B544: GARDEN_REWARD | C544: -62088 | D544: =ABS(RC[-1]) -> 62088 | E544: 2016-08 | F544: 1967998 | G544: 1
A545: 2016-08-25 오전 12:00:00 | B545: GARDEN_REWARD | C545: -75591 | D545: =ABS(RC[-1]) -> 75591 | E545: 2016-08 | F545: 2043589 | G545: 1
A546: 2016-08-26 오전 12:00:00 | B546: GARDEN_REWARD | C546: -64275 | D546: =ABS(RC[-1]) -> 64275 | E546: 2016-08 | F546: 2107864 | G546: 1
A547: 2016-08-27 오전 12:00:00 | B547: GARDEN_REWARD | C547: -54851 | D547: =ABS(RC[-1]) -> 54851 | E547: 2016-08 | F547: 2162715 | G547: 1
A548: 2016-08-28 오전 12:00:00 | B548: GARDEN_REWARD | C548: -54363 | D548: =ABS(RC[-1]) -> 54363 | E548: 2016-08 | F548: 2217078 | G548: 1
A549: 2016-08-29 오전 12:00:00 | B549: GARDEN_REWARD | C549: -53607 | D549: =ABS(RC[-1]) -> 53607 | E549: 2016-08 | F549: 2270685 | G549: 1
A550: 2016-08-30 오전 12:00:00 | B550: GARDEN_REWARD | C550: -46901 | D550: =ABS(RC[-1]) -> 46901 | E550: 2016-08 | F550: 2317586 | G550: 1
A551: 2016-08-31 오전 12:00:00 | B551: GARDEN_REWARD | C551: -38251 | D551: =ABS(RC[-1]) -> 38251 | E551: 2016-08 | F551: 2355837 | G551: 0
A552: 2016-09-01 오전 12:00:00 | B552: GARDEN_REWARD | C552: -213267 | D552: =ABS(RC[-1]) -> 213267 | E552: 2016-09 | F552: 213267 | G552: 1
A553: 2016-09-02 오전 12:00:00 | B553: GARDEN_REWARD | C553: -103951 | D553: =ABS(RC[-1]) -> 103951 | E553: 2016-09 | F553: 317218 | G553: 1
A554: 2016-09-03 오전 12:00:00 | B554: GARDEN_REWARD | C554: -94292 | D554: =ABS(RC[-1]) -> 94292 | E554: 2016-09 | F554: 411510 | G554: 1
A555: 2016-09-04 오전 12:00:00 | B555: GARDEN_REWARD | C555: -101820 | D555: =ABS(RC[-1]) -> 101820 | E555: 2016-09 | F555: 513330 | G555: 1
A556: 2016-09-05 오전 12:00:00 | B556: GARDEN_REWARD | C556: -94611 | D556: =ABS(RC[-1]) -> 94611 | E556: 2016-09 | F556: 607941 | G556: 1
A557: 2016-09-06 오전 12:00:00 | B557: GARDEN_REWARD | C557: -92998 | D557: =ABS(RC[-1]) -> 92998 | E557: 2016-09 | F557: 700939 | G557: 1
A558: 2016-09-07 오전 12:00:00 | B558: GARDEN_REWARD | C558: -92232 | D558: =ABS(RC[-1]) -> 92232 | E558: 2016-09 | F558: 793171 | G558: 1
A559: 2016-09-08 오전 12:00:00 | B559: GARDEN_REWARD | C559: -85475 | D559: =ABS(RC[-1]) -> 85475 | E559: 2016-09 | F559: 878646 | G559: 1
A560: 2016-09-09 오전 12:00:00 | B560: GARDEN_REWARD | C560: -93659 | D560: =ABS(RC[-1]) -> 93659 | E560: 2016-09 | F560: 972305 | G560: 1
A561: 2016-09-10 오전 12:00:00 | B561: GARDEN_REWARD | C561: -80065 | D561: =ABS(RC[-1]) -> 80065 | E561: 2016-09 | F561: 1052370 | G561: 1
A562: 2016-09-11 오전 12:00:00 | B562: GARDEN_REWARD | C562: -85920 | D562: =ABS(RC[-1]) -> 85920 | E562: 2016-09 | F562: 1138290 | G562: 1
A563: 2016-09-12 오전 12:00:00 | B563: GARDEN_REWARD | C563: -80062 | D563: =ABS(RC[-1]) -> 80062 | E563: 2016-09 | F563: 1218352 | G563: 1
A564: 2016-09-13 오전 12:00:00 | B564: GARDEN_REWARD | C564: -73702 | D564: =ABS(RC[-1]) -> 73702 | E564: 2016-09 | F564: 1292054 | G564: 1
A565: 2016-09-14 오전 12:00:00 | B565: GARDEN_REWARD | C565: -66511 | D565: =ABS(RC[-1]) -> 66511 | E565: 2016-09 | F565: 1358565 | G565: 1
A566: 2016-09-15 오전 12:00:00 | B566: GARDEN_REWARD | C566: -62698 | D566: =ABS(RC[-1]) -> 62698 | E566: 2016-09 | F566: 1421263 | G566: 1
A567: 2016-09-16 오전 12:00:00 | B567: GARDEN_REWARD | C567: -64399 | D567: =ABS(RC[-1]) -> 64399 | E567: 2016-09 | F567: 1485662 | G567: 1
A568: 2016-09-17 오전 12:00:00 | B568: GARDEN_REWARD | C568: -72685 | D568: =ABS(RC[-1]) -> 72685 | E568: 2016-09 | F568: 1558347 | G568: 1
A569: 2016-09-18 오전 12:00:00 | B569: GARDEN_REWARD | C569: -73289 | D569: =ABS(RC[-1]) -> 73289 | E569: 2016-09 | F569: 1631636 | G569: 1
A570: 2016-09-19 오전 12:00:00 | B570: GARDEN_REWARD | C570: -76582 | D570: =ABS(RC[-1]) -> 76582 | E570: 2016-09 | F570: 1708218 | G570: 1
A571: 2016-09-20 오전 12:00:00 | B571: GARDEN_REWARD | C571: -67120 | D571: =ABS(RC[-1]) -> 67120 | E571: 2016-09 | F571: 1775338 | G571: 1
A572: 2016-09-21 오전 12:00:00 | B572: GARDEN_REWARD | C572: -68884 | D572: =ABS(RC[-1]) -> 68884 | E572: 2016-09 | F572: 1844222 | G572: 1
A573: 2016-09-22 오전 12:00:00 | B573: GARDEN_REWARD | C573: -70390 | D573: =ABS(RC[-1]) -> 70390 | E573: 2016-09 | F573: 1914612 | G573: 1
A574: 2016-09-23 오전 12:00:00 | B574: GARDEN_REWARD | C574: -65268 | D574: =ABS(RC[-1]) -> 65268 | E574: 2016-09 | F574: 1979880 | G574: 1
A575: 2016-09-24 오전 12:00:00 | B575: GARDEN_REWARD | C575: -57696 | D575: =ABS(RC[-1]) -> 57696 | E575: 2016-09 | F575: 2037576 | G575: 1
A576: 2016-09-25 오전 12:00:00 | B576: GARDEN_REWARD | C576: -63847 | D576: =ABS(RC[-1]) -> 63847 | E576: 2016-09 | F576: 2101423 | G576: 1
A577: 2016-09-26 오전 12:00:00 | B577: GARDEN_REWARD | C577: -58232 | D577: =ABS(RC[-1]) -> 58232 | E577: 2016-09 | F577: 2159655 | G577: 1
A578: 2016-09-27 오전 12:00:00 | B578: GARDEN_REWARD | C578: -50568 | D578: =ABS(RC[-1]) -> 50568 | E578: 2016-09 | F578: 2210223 | G578: 1
A579: 2016-09-28 오전 12:00:00 | B579: GARDEN_REWARD | C579: -49287 | D579: =ABS(RC[-1]) -> 49287 | E579: 2016-09 | F579: 2259510 | G579: 1
A580: 2016-09-29 오전 12:00:00 | B580: GARDEN_REWARD | C580: -51272 | D580: =ABS(RC[-1]) -> 51272 | E580: 2016-09 | F580: 2310782 | G580: 1
A581: 2016-09-30 오전 12:00:00 | B581: GARDEN_REWARD | C581: -45466 | D581: =ABS(RC[-1]) -> 45466 | E581: 2016-09 | F581: 2356248 | G581: 0
A582: 2016-10-01 오전 12:00:00 | B582: GARDEN_REWARD | C582: -235700 | D582: =ABS(RC[-1]) -> 235700 | E582: 2016-10 | F582: 235700 | G582: 1
A583: 2016-10-02 오전 12:00:00 | B583: GARDEN_REWARD | C583: -113918 | D583: =ABS(RC[-1]) -> 113918 | E583: 2016-10 | F583: 349618 | G583: 1
A584: 2016-10-03 오전 12:00:00 | B584: GARDEN_REWARD | C584: -106030 | D584: =ABS(RC[-1]) -> 106030 | E584: 2016-10 | F584: 455648 | G584: 1
A585: 2016-10-04 오전 12:00:00 | B585: GARDEN_REWARD | C585: -100391 | D585: =ABS(RC[-1]) -> 100391 | E585: 2016-10 | F585: 556039 | G585: 1
A586: 2016-10-05 오전 12:00:00 | B586: GARDEN_REWARD | C586: -94101 | D586: =ABS(RC[-1]) -> 94101 | E586: 2016-10 | F586: 650140 | G586: 1
A587: 2016-10-06 오전 12:00:00 | B587: GARDEN_REWARD | C587: -97028 | D587: =ABS(RC[-1]) -> 97028 | E587: 2016-10 | F587: 747168 | G587: 1
A588: 2016-10-07 오전 12:00:00 | B588: GARDEN_REWARD | C588: -86153 | D588: =ABS(RC[-1]) -> 86153 | E588: 2016-10 | F588: 833321 | G588: 1
A589: 2016-10-08 오전 12:00:00 | B589: GARDEN_REWARD | C589: -91120 | D589: =ABS(RC[-1]) -> 91120 | E589: 2016-10 | F589: 924441 | G589: 1
A590: 2016-10-09 오전 12:00:00 | B590: GARDEN_REWARD | C590: -83726 | D590: =ABS(RC[-1]) -> 83726 | E590: 2016-10 | F590: 1008167 | G590: 1
A591: 2016-10-10 오전 12:00:00 | B591: GARDEN_REWARD | C591: -89392 | D591: =ABS(RC[-1]) -> 89392 | E591: 2016-10 | F591: 1097559 | G591: 1
A592: 2016-10-11 오전 12:00:00 | B592: GARDEN_REWARD | C592: -85869 | D592: =ABS(RC[-1]) -> 85869 | E592: 2016-10 | F592: 1183428 | G592: 1
A593: 2016-10-12 오전 12:00:00 | B593: GARDEN_REWARD | C593: -81659 | D593: =ABS(RC[-1]) -> 81659 | E593: 2016-10 | F593: 1265087 | G593: 1
A594: 2016-10-13 오전 12:00:00 | B594: GARDEN_REWARD | C594: -74690 | D594: =ABS(RC[-1]) -> 74690 | E594: 2016-10 | F594: 1339777 | G594: 1
A595: 2016-10-14 오전 12:00:00 | B595: GARDEN_REWARD | C595: -87774 | D595: =ABS(RC[-1]) -> 87774 | E595: 2016-10 | F595: 1427551 | G595: 1
A596: 2016-10-15 오전 12:00:00 | B596: GARDEN_REWARD | C596: -77360 | D596: =ABS(RC[-1]) -> 77360 | E596: 2016-10 | F596: 1504911 | G596: 1
A597: 2016-10-16 오전 12:00:00 | B597: GARDEN_REWARD | C597: -79009 | D597: =ABS(RC[-1]) -> 79009 | E597: 2016-10 | F597: 1583920 | G597: 1
A598: 2016-10-17 오전 12:00:00 | B598: GARDEN_REWARD | C598: -76255 | D598: =ABS(RC[-1]) -> 76255 | E598: 2016-10 | F598: 1660175 | G598: 1
A599: 2016-10-18 오전 12:00:00 | B599: GARDEN_REWARD | C599: -76415 | D599: =ABS(RC[-1]) -> 76415 | E599: 2016-10 | F599: 1736590 | G599: 1
A600: 2016-10-19 오전 12:00:00 | B600: GARDEN_REWARD | C600: -88540 | D600: =ABS(RC[-1]) -> 88540 | E600: 2016-10 | F600: 1825130 | G600: 1
A601: 2016-10-20 오전 12:00:00 | B601: GARDEN_REWARD | C601: -75834 | D601: =ABS(RC[-1]) -> 75834 | E601: 2016-10 | F601: 1900964 | G601: 1
A602: 2016-10-21 오전 12:00:00 | B602: GARDEN_REWARD | C602: -69235 | D602: =ABS(RC[-1]) -> 69235 | E602: 2016-10 | F602: 1970199 | G602: 1
A603: 2016-10-22 오전 12:00:00 | B603: GARDEN_REWARD | C603: -68288 | D603: =ABS(RC[-1]) -> 68288 | E603: 2016-10 | F603: 2038487 | G603: 1
A604: 2016-10-23 오전 12:00:00 | B604: GARDEN_REWARD | C604: -69514 | D604: =ABS(RC[-1]) -> 69514 | E604: 2016-10 | F604: 2108001 | G604: 1
A605: 2016-10-24 오전 12:00:00 | B605: GARDEN_REWARD | C605: -68025 | D605: =ABS(RC[-1]) -> 68025 | E605: 2016-10 | F605: 2176026 | G605: 1
A606: 2016-10-25 오전 12:00:00 | B606: GARDEN_REWARD | C606: -66793 | D606: =ABS(RC[-1]) -> 66793 | E606: 2016-10 | F606: 2242819 | G606: 1
A607: 2016-10-26 오전 12:00:00 | B607: GARDEN_REWARD | C607: -62925 | D607: =ABS(RC[-1]) -> 62925 | E607: 2016-10 | F607: 2305744 | G607: 1
A608: 2016-10-27 오전 12:00:00 | B608: GARDEN_REWARD | C608: -66430 | D608: =ABS(RC[-1]) -> 66430 | E608: 2016-10 | F608: 2372174 | G608: 1
A609: 2016-10-28 오전 12:00:00 | B609: GARDEN_REWARD | C609: -50916 | D609: =ABS(RC[-1]) -> 50916 | E609: 2016-10 | F609: 2423090 | G609: 1
A610: 2016-10-29 오전 12:00:00 | B610: GARDEN_REWARD | C610: -52786 | D610: =ABS(RC[-1]) -> 52786 | E610: 2016-10 | F610: 2475876 | G610: 1
A611: 2016-10-30 오전 12:00:00 | B611: GARDEN_REWARD | C611: -51289 | D611: =ABS(RC[-1]) -> 51289 | E611: 2016-10 | F611: 2527165 | G611: 1
A612: 2016-10-31 오전 12:00:00 | B612: GARDEN_REWARD | C612: -41695 | D612: =ABS(RC[-1]) -> 41695 | E612: 2016-10 | F612: 2568860 | G612: 0
A613: 2016-11-02 오전 12:00:00 | B613: GARDEN_REWARD | C613: -36002 | D613: =ABS(RC[-1]) -> 36002 | E613: 2016-11 | F613: 36002 | G613: 1
A614: 2016-11-03 오전 12:00:00 | B614: GARDEN_REWARD | C614: -92137 | D614: =ABS(RC[-1]) -> 92137 | E614: 2016-11 | F614: 128139 | G614: 1
A615: 2016-11-04 오전 12:00:00 | B615: GARDEN_REWARD | C615: -101861 | D615: =ABS(RC[-1]) -> 101861 | E615: 2016-11 | F615: 230000 | G615: 1
A616: 2016-11-05 오전 12:00:00 | B616: GARDEN_REWARD | C616: -124096 | D616: =ABS(RC[-1]) -> 124096 | E616: 2016-11 | F616: 354096 | G616: 1
A617: 2016-11-06 오전 12:00:00 | B617: GARDEN_REWARD | C617: -108707 | D617: =ABS(RC[-1]) -> 108707 | E617: 2016-11 | F617: 462803 | G617: 1
A618: 2016-11-07 오전 12:00:00 | B618: GARDEN_REWARD | C618: -94865 | D618: =ABS(RC[-1]) -> 94865 | E618: 2016-11 | F618: 557668 | G618: 1
A619: 2016-11-08 오전 12:00:00 | B619: GARDEN_REWARD | C619: -89870 | D619: =ABS(RC[-1]) -> 89870 | E619: 2016-11 | F619: 647538 | G619: 1
A620: 2016-11-09 오전 12:00:00 | B620: GARDEN_REWARD | C620: -88658 | D620: =ABS(RC[-1]) -> 88658 | E620: 2016-11 | F620: 736196 | G620: 1
A621: 2016-11-10 오전 12:00:00 | B621: GARDEN_REWARD | C621: -89204 | D621: =ABS(RC[-1]) -> 89204 | E621: 2016-11 | F621: 825400 | G621: 1
A622: 2016-11-11 오전 12:00:00 | B622: GARDEN_REWARD | C622: -86951 | D622: =ABS(RC[-1]) -> 86951 | E622: 2016-11 | F622: 912351 | G622: 1
A623: 2016-11-12 오전 12:00:00 | B623: GARDEN_REWARD | C623: -77809 | D623: =ABS(RC[-1]) -> 77809 | E623: 2016-11 | F623: 990160 | G623: 1
A624: 2016-11-13 오전 12:00:00 | B624: GARDEN_REWARD | C624: -92788 | D624: =ABS(RC[-1]) -> 92788 | E624: 2016-11 | F624: 1082948 | G624: 1
A625: 2016-11-14 오전 12:00:00 | B625: GARDEN_REWARD | C625: -81720 | D625: =ABS(RC[-1]) -> 81720 | E625: 2016-11 | F625: 1164668 | G625: 1
A626: 2016-11-15 오전 12:00:00 | B626: GARDEN_REWARD | C626: -75117 | D626: =ABS(RC[-1]) -> 75117 | E626: 2016-11 | F626: 1239785 | G626: 1
A627: 2016-11-16 오전 12:00:00 | B627: GARDEN_REWARD | C627: -72254 | D627: =ABS(RC[-1]) -> 72254 | E627: 2016-11 | F627: 1312039 | G627: 1
A628: 2016-11-17 오전 12:00:00 | B628: GARDEN_REWARD | C628: -67115 | D628: =ABS(RC[-1]) -> 67115 | E628: 2016-11 | F628: 1379154 | G628: 1
A629: 2016-11-18 오전 12:00:00 | B629: GARDEN_REWARD | C629: -60671 | D629: =ABS(RC[-1]) -> 60671 | E629: 2016-11 | F629: 1439825 | G629: 1
A630: 2016-11-19 오전 12:00:00 | B630: GARDEN_REWARD | C630: -58514 | D630: =ABS(RC[-1]) -> 58514 | E630: 2016-11 | F630: 1498339 | G630: 1
A631: 2016-11-20 오전 12:00:00 | B631: GARDEN_REWARD | C631: -53756 | D631: =ABS(RC[-1]) -> 53756 | E631: 2016-11 | F631: 1552095 | G631: 1
A632: 2016-11-21 오전 12:00:00 | B632: GARDEN_REWARD | C632: -53138 | D632: =ABS(RC[-1]) -> 53138 | E632: 2016-11 | F632: 1605233 | G632: 1
A633: 2016-11-22 오전 12:00:00 | B633: GARDEN_REWARD | C633: -46591 | D633: =ABS(RC[-1]) -> 46591 | E633: 2016-11 | F633: 1651824 | G633: 1
A634: 2016-11-23 오전 12:00:00 | B634: GARDEN_REWARD | C634: -43102 | D634: =ABS(RC[-1]) -> 43102 | E634: 2016-11 | F634: 1694926 | G634: 1
A635: 2016-11-24 오전 12:00:00 | B635: GARDEN_REWARD | C635: -85208 | D635: =ABS(RC[-1]) -> 85208 | E635: 2016-11 | F635: 1780134 | G635: 1
A636: 2016-11-25 오전 12:00:00 | B636: GARDEN_REWARD | C636: -68535 | D636: =ABS(RC[-1]) -> 68535 | E636: 2016-11 | F636: 1848669 | G636: 1
A637: 2016-11-26 오전 12:00:00 | B637: GARDEN_REWARD | C637: -52989 | D637: =ABS(RC[-1]) -> 52989 | E637: 2016-11 | F637: 1901658 | G637: 1
A638: 2016-11-27 오전 12:00:00 | B638: GARDEN_REWARD | C638: -67300 | D638: =ABS(RC[-1]) -> 67300 | E638: 2016-11 | F638: 1968958 | G638: 1
A639: 2016-11-28 오전 12:00:00 | B639: GARDEN_REWARD | C639: -55766 | D639: =ABS(RC[-1]) -> 55766 | E639: 2016-11 | F639: 2024724 | G639: 1
A640: 2016-11-29 오전 12:00:00 | B640: GARDEN_REWARD | C640: -46339 | D640: =ABS(RC[-1]) -> 46339 | E640: 2016-11 | F640: 2071063 | G640: 1
A641: 2016-11-30 오전 12:00:00 | B641: GARDEN_REWARD | C641: -40002 | D641: =ABS(RC[-1]) -> 40002 | E641: 2016-11 | F641: 2111065 | G641: 0
A642: 2016-12-01 오전 12:00:00 | B642: GARDEN_REWARD | C642: -227926 | D642: =ABS(RC[-1]) -> 227926 | E642: 2016-12 | F642: 227926 | G642: 1
A643: 2016-12-02 오전 12:00:00 | B643: GARDEN_REWARD | C643: -89296 | D643: =ABS(RC[-1]) -> 89296 | E643: 2016-12 | F643: 317222 | G643: 1
A644: 2016-12-03 오전 12:00:00 | B644: GARDEN_REWARD | C644: -93460 | D644: =ABS(RC[-1]) -> 93460 | E644: 2016-12 | F644: 410682 | G644: 1
A645: 2016-12-04 오전 12:00:00 | B645: GARDEN_REWARD | C645: -97125 | D645: =ABS(RC[-1]) -> 97125 | E645: 2016-12 | F645: 507807 | G645: 1
A646: 2016-12-05 오전 12:00:00 | B646: GARDEN_REWARD | C646: -95382 | D646: =ABS(RC[-1]) -> 95382 | E646: 2016-12 | F646: 603189 | G646: 1
A647: 2016-12-06 오전 12:00:00 | B647: GARDEN_REWARD | C647: -88239 | D647: =ABS(RC[-1]) -> 88239 | E647: 2016-12 | F647: 691428 | G647: 1
A648: 2016-12-07 오전 12:00:00 | B648: GARDEN_REWARD | C648: -84605 | D648: =ABS(RC[-1]) -> 84605 | E648: 2016-12 | F648: 776033 | G648: 1
A649: 2016-12-08 오전 12:00:00 | B649: GARDEN_REWARD | C649: -76380 | D649: =ABS(RC[-1]) -> 76380 | E649: 2016-12 | F649: 852413 | G649: 1
A650: 2016-12-09 오전 12:00:00 | B650: GARDEN_REWARD | C650: -81956 | D650: =ABS(RC[-1]) -> 81956 | E650: 2016-12 | F650: 934369 | G650: 1
A651: 2016-12-10 오전 12:00:00 | B651: GARDEN_REWARD | C651: -70227 | D651: =ABS(RC[-1]) -> 70227 | E651: 2016-12 | F651: 1004596 | G651: 1
A652: 2016-12-11 오전 12:00:00 | B652: GARDEN_REWARD | C652: -77808 | D652: =ABS(RC[-1]) -> 77808 | E652: 2016-12 | F652: 1082404 | G652: 1
A653: 2016-12-12 오전 12:00:00 | B653: GARDEN_REWARD | C653: -79563 | D653: =ABS(RC[-1]) -> 79563 | E653: 2016-12 | F653: 1161967 | G653: 1
A654: 2016-12-13 오전 12:00:00 | B654: GARDEN_REWARD | C654: -77475 | D654: =ABS(RC[-1]) -> 77475 | E654: 2016-12 | F654: 1239442 | G654: 1
A655: 2016-12-14 오전 12:00:00 | B655: GARDEN_REWARD | C655: -71771 | D655: =ABS(RC[-1]) -> 71771 | E655: 2016-12 | F655: 1311213 | G655: 1
A656: 2016-12-15 오전 12:00:00 | B656: GARDEN_REWARD | C656: -62755 | D656: =ABS(RC[-1]) -> 62755 | E656: 2016-12 | F656: 1373968 | G656: 1
A657: 2016-12-16 오전 12:00:00 | B657: GARDEN_REWARD | C657: -71629 | D657: =ABS(RC[-1]) -> 71629 | E657: 2016-12 | F657: 1445597 | G657: 1
A658: 2016-12-17 오전 12:00:00 | B658: GARDEN_REWARD | C658: -59746 | D658: =ABS(RC[-1]) -> 59746 | E658: 2016-12 | F658: 1505343 | G658: 1
A659: 2016-12-18 오전 12:00:00 | B659: GARDEN_REWARD | C659: -64243 | D659: =ABS(RC[-1]) -> 64243 | E659: 2016-12 | F659: 1569586 | G659: 1
A660: 2016-12-19 오전 12:00:00 | B660: GARDEN_REWARD | C660: -63332 | D660: =ABS(RC[-1]) -> 63332 | E660: 2016-12 | F660: 1632918 | G660: 1
A661: 2016-12-20 오전 12:00:00 | B661: GARDEN_REWARD | C661: -59914 | D661: =ABS(RC[-1]) -> 59914 | E661: 2016-12 | F661: 1692832 | G661: 1
A662: 2016-12-21 오전 12:00:00 | B662: GARDEN_REWARD | C662: -62156 | D662: =ABS(RC[-1]) -> 62156 | E662: 2016-12 | F662: 1754988 | G662: 1
A663: 2016-12-22 오전 12:00:00 | B663: GARDEN_REWARD | C663: -57184 | D663: =ABS(RC[-1]) -> 57184 | E663: 2016-12 | F663: 1812172 | G663: 1
A664: 2016-12-23 오전 12:00:00 | B664: GARDEN_REWARD | C664: -46098 | D664: =ABS(RC[-1]) -> 46098 | E664: 2016-12 | F664: 1858270 | G664: 1
A665: 2016-12-24 오전 12:00:00 | B665: GARDEN_REWARD | C665: -40937 | D665: =ABS(RC[-1]) -> 40937 | E665: 2016-12 | F665: 1899207 | G665: 1
A666: 2016-12-25 오전 12:00:00 | B666: GARDEN_REWARD | C666: -46907 | D666: =ABS(RC[-1]) -> 46907 | E666: 2016-12 | F666: 1946114 | G666: 1
A667: 2016-12-26 오전 12:00:00 | B667: GARDEN_REWARD | C667: -44206 | D667: =ABS(RC[-1]) -> 44206 | E667: 2016-12 | F667: 1990320 | G667: 1
A668: 2016-12-27 오전 12:00:00 | B668: GARDEN_REWARD | C668: -37837 | D668: =ABS(RC[-1]) -> 37837 | E668: 2016-12 | F668: 2028157 | G668: 1
A669: 2016-12-28 오전 12:00:00 | B669: GARDEN_REWARD | C669: -37181 | D669: =ABS(RC[-1]) -> 37181 | E669: 2016-12 | F669: 2065338 | G669: 1
A670: 2016-12-29 오전 12:00:00 | B670: GARDEN_REWARD | C670: -53296 | D670: =ABS(RC[-1]) -> 53296 | E670: 2016-12 | F670: 2118634 | G670: 1
A671: 2016-12-30 오전 12:00:00 | B671: GARDEN_REWARD | C671: -42844 | D671: =ABS(RC[-1]) -> 42844 | E671: 2016-12 | F671: 2161478 | G671: 1
A672: 2016-12-31 오전 12:00:00 | B672: GARDEN_REWARD | C672: -32149 | D672: =ABS(RC[-1]) -> 32149 | E672: 2016-12 | F672: 2193627 | G672: 0
A673: 2017-01-01 오전 12:00:00 | B673: GARDEN_REWARD | C673: -212945 | D673: =ABS(RC[-1]) -> 212945 | E673: 2017-01 | F673: 212945 | G673: 1
A674: 2017-01-02 오전 12:00:00 | B674: GARDEN_REWARD | C674: -99859 | D674: =ABS(RC[-1]) -> 99859 | E674: 2017-01 | F674: 312804 | G674: 1
A675: 2017-01-03 오전 12:00:00 | B675: GARDEN_REWARD | C675: -85705 | D675: =ABS(RC[-1]) -> 85705 | E675: 2017-01 | F675: 398509 | G675: 1
A676: 2017-01-04 오전 12:00:00 | B676: GARDEN_REWARD | C676: -85176 | D676: =ABS(RC[-1]) -> 85176 | E676: 2017-01 | F676: 483685 | G676: 1
A677: 2017-01-05 오전 12:00:00 | B677: GARDEN_REWARD | C677: -80751 | D677: =ABS(RC[-1]) -> 80751 | E677: 2017-01 | F677: 564436 | G677: 1
A678: 2017-01-06 오전 12:00:00 | B678: GARDEN_REWARD | C678: -75479 | D678: =ABS(RC[-1]) -> 75479 | E678: 2017-01 | F678: 639915 | G678: 1
A679: 2017-01-07 오전 12:00:00 | B679: GARDEN_REWARD | C679: -77772 | D679: =ABS(RC[-1]) -> 77772 | E679: 2017-01 | F679: 717687 | G679: 1
A680: 2017-01-08 오전 12:00:00 | B680: GARDEN_REWARD | C680: -80598 | D680: =ABS(RC[-1]) -> 80598 | E680: 2017-01 | F680: 798285 | G680: 1
A681: 2017-01-09 오전 12:00:00 | B681: GARDEN_REWARD | C681: -78823 | D681: =ABS(RC[-1]) -> 78823 | E681: 2017-01 | F681: 877108 | G681: 1
A682: 2017-01-10 오전 12:00:00 | B682: GARDEN_REWARD | C682: -69395 | D682: =ABS(RC[-1]) -> 69395 | E682: 2017-01 | F682: 946503 | G682: 1
A683: 2017-01-11 오전 12:00:00 | B683: GARDEN_REWARD | C683: -69827 | D683: =ABS(RC[-1]) -> 69827 | E683: 2017-01 | F683: 1016330 | G683: 1
A684: 2017-01-12 오전 12:00:00 | B684: GARDEN_REWARD | C684: -69302 | D684: =ABS(RC[-1]) -> 69302 | E684: 2017-01 | F684: 1085632 | G684: 1
A685: 2017-01-13 오전 12:00:00 | B685: GARDEN_REWARD | C685: -72496 | D685: =ABS(RC[-1]) -> 72496 | E685: 2017-01 | F685: 1158128 | G685: 1
A686: 2017-01-14 오전 12:00:00 | B686: GARDEN_REWARD | C686: -72329 | D686: =ABS(RC[-1]) -> 72329 | E686: 2017-01 | F686: 1230457 | G686: 1
A687: 2017-01-15 오전 12:00:00 | B687: GARDEN_REWARD | C687: -77940 | D687: =ABS(RC[-1]) -> 77940 | E687: 2017-01 | F687: 1308397 | G687: 1
A688: 2017-01-16 오전 12:00:00 | B688: GARDEN_REWARD | C688: -67101 | D688: =ABS(RC[-1]) -> 67101 | E688: 2017-01 | F688: 1375498 | G688: 1
A689: 2017-01-17 오전 12:00:00 | B689: GARDEN_REWARD | C689: -63691 | D689: =ABS(RC[-1]) -> 63691 | E689: 2017-01 | F689: 1439189 | G689: 1
A690: 2017-01-18 오전 12:00:00 | B690: GARDEN_REWARD | C690: -62305 | D690: =ABS(RC[-1]) -> 62305 | E690: 2017-01 | F690: 1501494 | G690: 1
A691: 2017-01-19 오전 12:00:00 | B691: GARDEN_REWARD | C691: -52262 | D691: =ABS(RC[-1]) -> 52262 | E691: 2017-01 | F691: 1553756 | G691: 1
A692: 2017-01-20 오전 12:00:00 | B692: GARDEN_REWARD | C692: -43976 | D692: =ABS(RC[-1]) -> 43976 | E692: 2017-01 | F692: 1597732 | G692: 1
A693: 2017-01-21 오전 12:00:00 | B693: GARDEN_REWARD | C693: -42145 | D693: =ABS(RC[-1]) -> 42145 | E693: 2017-01 | F693: 1639877 | G693: 1
A694: 2017-01-22 오전 12:00:00 | B694: GARDEN_REWARD | C694: -49899 | D694: =ABS(RC[-1]) -> 49899 | E694: 2017-01 | F694: 1689776 | G694: 1
A695: 2017-01-23 오전 12:00:00 | B695: GARDEN_REWARD | C695: -41048 | D695: =ABS(RC[-1]) -> 41048 | E695: 2017-01 | F695: 1730824 | G695: 1
A696: 2017-01-24 오전 12:00:00 | B696: GARDEN_REWARD | C696: -39835 | D696: =ABS(RC[-1]) -> 39835 | E696: 2017-01 | F696: 1770659 | G696: 1
A697: 2017-01-25 오전 12:00:00 | B697: GARDEN_REWARD | C697: -38465 | D697: =ABS(RC[-1]) -> 38465 | E697: 2017-01 | F697: 1809124 | G697: 1
A698: 2017-01-26 오전 12:00:00 | B698: GARDEN_REWARD | C698: -65069 | D698: =ABS(RC[-1]) -> 65069 | E698: 2017-01 | F698: 1874193 | G698: 1
A699: 2017-01-27 오전 12:00:00 | B699: GARDEN_REWARD | C699: -47781 | D699: =ABS(RC[-1]) -> 47781 | E699: 2017-01 | F699: 1921974 | G699: 1
A700: 2017-01-28 오전 12:00:00 | B700: GARDEN_REWARD | C700: -36514 | D700: =ABS(RC[-1]) -> 36514 | E700: 2017-01 | F700: 1958488 | G700: 1
A701: 2017-01-29 오전 12:00:00 | B701: GARDEN_REWARD | C701: -41819 | D701: =ABS(RC[-1]) -> 41819 | E701: 2017-01 | F701: 2000307 | G701: 1
A702: 2017-01-30 오전 12:00:00 | B702: GARDEN_REWARD | C702: -40956 | D702: =ABS(RC[-1]) -> 40956 | E702: 2017-01 | F702: 2041263 | G702: 1
A703: 2017-01-31 오전 12:00:00 | B703: GARDEN_REWARD | C703: -35391 | D703: =ABS(RC[-1]) -> 35391 | E703: 2017-01 | F703: 2076654 | G703: 0
A704: 2017-02-01 오전 12:00:00 | B704: GARDEN_REWARD | C704: -225195 | D704: =ABS(RC[-1]) -> 225195 | E704: 2017-02 | F704: 225195 | G704: 1
A705: 2017-02-02 오전 12:00:00 | B705: GARDEN_REWARD | C705: -89182 | D705: =ABS(RC[-1]) -> 89182 | E705: 2017-02 | F705: 314377 | G705: 1
A706: 2017-02-03 오전 12:00:00 | B706: GARDEN_REWARD | C706: -92134 | D706: =ABS(RC[-1]) -> 92134 | E706: 2017-02 | F706: 406511 | G706: 1
A707: 2017-02-04 오전 12:00:00 | B707: GARDEN_REWARD | C707: -88653 | D707: =ABS(RC[-1]) -> 88653 | E707: 2017-02 | F707: 495164 | G707: 1
A708: 2017-02-05 오전 12:00:00 | B708: GARDEN_REWARD | C708: -86189 | D708: =ABS(RC[-1]) -> 86189 | E708: 2017-02 | F708: 581353 | G708: 1
A709: 2017-02-06 오전 12:00:00 | B709: GARDEN_REWARD | C709: -79209 | D709: =ABS(RC[-1]) -> 79209 | E709: 2017-02 | F709: 660562 | G709: 1
A710: 2017-02-07 오전 12:00:00 | B710: GARDEN_REWARD | C710: -73582 | D710: =ABS(RC[-1]) -> 73582 | E710: 2017-02 | F710: 734144 | G710: 1
A711: 2017-02-08 오전 12:00:00 | B711: GARDEN_REWARD | C711: -72685 | D711: =ABS(RC[-1]) -> 72685 | E711: 2017-02 | F711: 806829 | G711: 1
A712: 2017-02-09 오전 12:00:00 | B712: GARDEN_REWARD | C712: -68241 | D712: =ABS(RC[-1]) -> 68241 | E712: 2017-02 | F712: 875070 | G712: 1
A713: 2017-02-10 오전 12:00:00 | B713: GARDEN_REWARD | C713: -70837 | D713: =ABS(RC[-1]) -> 70837 | E713: 2017-02 | F713: 945907 | G713: 1
A714: 2017-02-11 오전 12:00:00 | B714: GARDEN_REWARD | C714: -71709 | D714: =ABS(RC[-1]) -> 71709 | E714: 2017-02 | F714: 1017616 | G714: 1
A715: 2017-02-12 오전 12:00:00 | B715: GARDEN_REWARD | C715: -70509 | D715: =ABS(RC[-1]) -> 70509 | E715: 2017-02 | F715: 1088125 | G715: 1
A716: 2017-02-13 오전 12:00:00 | B716: GARDEN_REWARD | C716: -67979 | D716: =ABS(RC[-1]) -> 67979 | E716: 2017-02 | F716: 1156104 | G716: 1
A717: 2017-02-14 오전 12:00:00 | B717: GARDEN_REWARD | C717: -65301 | D717: =ABS(RC[-1]) -> 65301 | E717: 2017-02 | F717: 1221405 | G717: 1
A718: 2017-02-15 오전 12:00:00 | B718: GARDEN_REWARD | C718: -63448 | D718: =ABS(RC[-1]) -> 63448 | E718: 2017-02 | F718: 1284853 | G718: 1
A719: 2017-02-16 오전 12:00:00 | B719: GARDEN_REWARD | C719: -48695 | D719: =ABS(RC[-1]) -> 48695 | E719: 2017-02 | F719: 1333548 | G719: 1
A720: 2017-02-17 오전 12:00:00 | B720: GARDEN_REWARD | C720: -41117 | D720: =ABS(RC[-1]) -> 41117 | E720: 2017-02 | F720: 1374665 | G720: 1
A721: 2017-02-18 오전 12:00:00 | B721: GARDEN_REWARD | C721: -37842 | D721: =ABS(RC[-1]) -> 37842 | E721: 2017-02 | F721: 1412507 | G721: 1
A722: 2017-02-19 오전 12:00:00 | B722: GARDEN_REWARD | C722: -47221 | D722: =ABS(RC[-1]) -> 47221 | E722: 2017-02 | F722: 1459728 | G722: 1
A723: 2017-02-20 오전 12:00:00 | B723: GARDEN_REWARD | C723: -44337 | D723: =ABS(RC[-1]) -> 44337 | E723: 2017-02 | F723: 1504065 | G723: 1
A724: 2017-02-21 오전 12:00:00 | B724: GARDEN_REWARD | C724: -41894 | D724: =ABS(RC[-1]) -> 41894 | E724: 2017-02 | F724: 1545959 | G724: 1
A725: 2017-02-22 오전 12:00:00 | B725: GARDEN_REWARD | C725: -34869 | D725: =ABS(RC[-1]) -> 34869 | E725: 2017-02 | F725: 1580828 | G725: 1
A726: 2017-02-23 오전 12:00:00 | B726: GARDEN_REWARD | C726: -72493 | D726: =ABS(RC[-1]) -> 72493 | E726: 2017-02 | F726: 1653321 | G726: 1
A727: 2017-02-24 오전 12:00:00 | B727: GARDEN_REWARD | C727: -54488 | D727: =ABS(RC[-1]) -> 54488 | E727: 2017-02 | F727: 1707809 | G727: 1
A728: 2017-02-25 오전 12:00:00 | B728: GARDEN_REWARD | C728: -43856 | D728: =ABS(RC[-1]) -> 43856 | E728: 2017-02 | F728: 1751665 | G728: 1
A729: 2017-02-26 오전 12:00:00 | B729: GARDEN_REWARD | C729: -50127 | D729: =ABS(RC[-1]) -> 50127 | E729: 2017-02 | F729: 1801792 | G729: 1
A730: 2017-02-27 오전 12:00:00 | B730: GARDEN_REWARD | C730: -41135 | D730: =ABS(RC[-1]) -> 41135 | E730: 2017-02 | F730: 1842927 | G730: 1
A731: 2017-02-28 오전 12:00:00 | B731: GARDEN_REWARD | C731: -33157 | D731: =ABS(RC[-1]) -> 33157 | E731: 2017-02 | F731: 1876084 | G731: 0
A732: 2017-03-01 오전 12:00:00 | B732: GARDEN_REWARD | C732: -199431 | D732: =ABS(RC[-1]) -> 199431 | E732: 2017-03 | F732: 199431 | G732: 1
A733: 2017-03-02 오전 12:00:00 | B733: GARDEN_REWARD | C733: -80877 | D733: =ABS(RC[-1]) -> 80877 | E733: 2017-03 | F733: 280308 | G733: 1
A734: 2017-03-03 오전 12:00:00 | B734: GARDEN_REWARD | C734: -80983 | D734: =ABS(RC[-1]) -> 80983 | E734: 2017-03 | F734: 361291 | G734: 1
A735: 2017-03-04 오전 12:00:00 | B735: GARDEN_REWARD | C735: -78266 | D735: =ABS(RC[-1]) -> 78266 | E735: 2017-03 | F735: 439557 | G735: 1
A736: 2017-03-05 오전 12:00:00 | B736: GARDEN_REWARD | C736: -75865 | D736: =ABS(RC[-1]) -> 75865 | E736: 2017-03 | F736: 515422 | G736: 1
A737: 2017-03-06 오전 12:00:00 | B737: GARDEN_REWARD | C737: -72522 | D737: =ABS(RC[-1]) -> 72522 | E737: 2017-03 | F737: 587944 | G737: 1
A738: 2017-03-07 오전 12:00:00 | B738: GARDEN_REWARD | C738: -68696 | D738: =ABS(RC[-1]) -> 68696 | E738: 2017-03 | F738: 656640 | G738: 1
A739: 2017-03-08 오전 12:00:00 | B739: GARDEN_REWARD | C739: -65119 | D739: =ABS(RC[-1]) -> 65119 | E739: 2017-03 | F739: 721759 | G739: 1
A740: 2017-03-09 오전 12:00:00 | B740: GARDEN_REWARD | C740: -69554 | D740: =ABS(RC[-1]) -> 69554 | E740: 2017-03 | F740: 791313 | G740: 1
A741: 2017-03-10 오전 12:00:00 | B741: GARDEN_REWARD | C741: -62674 | D741: =ABS(RC[-1]) -> 62674 | E741: 2017-03 | F741: 853987 | G741: 1
A742: 2017-03-11 오전 12:00:00 | B742: GARDEN_REWARD | C742: -61901 | D742: =ABS(RC[-1]) -> 61901 | E742: 2017-03 | F742: 915888 | G742: 1
A743: 2017-03-12 오전 12:00:00 | B743: GARDEN_REWARD | C743: -65326 | D743: =ABS(RC[-1]) -> 65326 | E743: 2017-03 | F743: 981214 | G743: 1
A744: 2017-03-13 오전 12:00:00 | B744: GARDEN_REWARD | C744: -62111 | D744: =ABS(RC[-1]) -> 62111 | E744: 2017-03 | F744: 1043325 | G744: 1
A745: 2017-03-14 오전 12:00:00 | B745: GARDEN_REWARD | C745: -57357 | D745: =ABS(RC[-1]) -> 57357 | E745: 2017-03 | F745: 1100682 | G745: 1
A746: 2017-03-15 오전 12:00:00 | B746: GARDEN_REWARD | C746: -61332 | D746: =ABS(RC[-1]) -> 61332 | E746: 2017-03 | F746: 1162014 | G746: 1
A747: 2017-03-16 오전 12:00:00 | B747: GARDEN_REWARD | C747: -46855 | D747: =ABS(RC[-1]) -> 46855 | E747: 2017-03 | F747: 1208869 | G747: 1
A748: 2017-03-17 오전 12:00:00 | B748: GARDEN_REWARD | C748: -43375 | D748: =ABS(RC[-1]) -> 43375 | E748: 2017-03 | F748: 1252244 | G748: 1
A749: 2017-03-18 오전 12:00:00 | B749: GARDEN_REWARD | C749: -37452 | D749: =ABS(RC[-1]) -> 37452 | E749: 2017-03 | F749: 1289696 | G749: 1
A750: 2017-03-19 오전 12:00:00 | B750: GARDEN_REWARD | C750: -41063 | D750: =ABS(RC[-1]) -> 41063 | E750: 2017-03 | F750: 1330759 | G750: 1
A751: 2017-03-20 오전 12:00:00 | B751: GARDEN_REWARD | C751: -44130 | D751: =ABS(RC[-1]) -> 44130 | E751: 2017-03 | F751: 1374889 | G751: 1
A752: 2017-03-21 오전 12:00:00 | B752: GARDEN_REWARD | C752: -37280 | D752: =ABS(RC[-1]) -> 37280 | E752: 2017-03 | F752: 1412169 | G752: 1
A753: 2017-03-22 오전 12:00:00 | B753: GARDEN_REWARD | C753: -34517 | D753: =ABS(RC[-1]) -> 34517 | E753: 2017-03 | F753: 1446686 | G753: 1
A754: 2017-03-23 오전 12:00:00 | B754: GARDEN_REWARD | C754: -68482 | D754: =ABS(RC[-1]) -> 68482 | E754: 2017-03 | F754: 1515168 | G754: 1
A755: 2017-03-24 오전 12:00:00 | B755: GARDEN_REWARD | C755: -45355 | D755: =ABS(RC[-1]) -> 45355 | E755: 2017-03 | F755: 1560523 | G755: 1
A756: 2017-03-25 오전 12:00:00 | B756: GARDEN_REWARD | C756: -50711 | D756: =ABS(RC[-1]) -> 50711 | E756: 2017-03 | F756: 1611234 | G756: 1
A757: 2017-03-26 오전 12:00:00 | B757: GARDEN_REWARD | C757: -49836 | D757: =ABS(RC[-1]) -> 49836 | E757: 2017-03 | F757: 1661070 | G757: 1
A758: 2017-03-27 오전 12:00:00 | B758: GARDEN_REWARD | C758: -46134 | D758: =ABS(RC[-1]) -> 46134 | E758: 2017-03 | F758: 1707204 | G758: 1
A759: 2017-03-28 오전 12:00:00 | B759: GARDEN_REWARD | C759: -42228 | D759: =ABS(RC[-1]) -> 42228 | E759: 2017-03 | F759: 1749432 | G759: 1
A760: 2017-03-29 오전 12:00:00 | B760: GARDEN_REWARD | C760: -36011 | D760: =ABS(RC[-1]) -> 36011 | E760: 2017-03 | F760: 1785443 | G760: 1
A761: 2017-03-30 오전 12:00:00 | B761: GARDEN_REWARD | C761: -33335 | D761: =ABS(RC[-1]) -> 33335 | E761: 2017-03 | F761: 1818778 | G761: 1
A762: 2017-03-31 오전 12:00:00 | B762: GARDEN_REWARD | C762: -27674 | D762: =ABS(RC[-1]) -> 27674 | E762: 2017-03 | F762: 1846452 | G762: 0
A763: 2017-04-01 오전 12:00:00 | B763: GARDEN_REWARD | C763: -205951 | D763: =ABS(RC[-1]) -> 205951 | E763: 2017-04 | F763: 205951 | G763: 1
A764: 2017-04-02 오전 12:00:00 | B764: GARDEN_REWARD | C764: -91884 | D764: =ABS(RC[-1]) -> 91884 | E764: 2017-04 | F764: 297835 | G764: 1
A765: 2017-04-03 오전 12:00:00 | B765: GARDEN_REWARD | C765: -82850 | D765: =ABS(RC[-1]) -> 82850 | E765: 2017-04 | F765: 380685 | G765: 1
A766: 2017-04-04 오전 12:00:00 | B766: GARDEN_REWARD | C766: -79479 | D766: =ABS(RC[-1]) -> 79479 | E766: 2017-04 | F766: 460164 | G766: 1
A767: 2017-04-05 오전 12:00:00 | B767: GARDEN_REWARD | C767: -82183 | D767: =ABS(RC[-1]) -> 82183 | E767: 2017-04 | F767: 542347 | G767: 1
A768: 2017-04-06 오전 12:00:00 | B768: GARDEN_REWARD | C768: -69796 | D768: =ABS(RC[-1]) -> 69796 | E768: 2017-04 | F768: 612143 | G768: 1
A769: 2017-04-07 오전 12:00:00 | B769: GARDEN_REWARD | C769: -73150 | D769: =ABS(RC[-1]) -> 73150 | E769: 2017-04 | F769: 685293 | G769: 1
A770: 2017-04-08 오전 12:00:00 | B770: GARDEN_REWARD | C770: -61326 | D770: =ABS(RC[-1]) -> 61326 | E770: 2017-04 | F770: 746619 | G770: 1
A771: 2017-04-09 오전 12:00:00 | B771: GARDEN_REWARD | C771: -66409 | D771: =ABS(RC[-1]) -> 66409 | E771: 2017-04 | F771: 813028 | G771: 1
A772: 2017-04-10 오전 12:00:00 | B772: GARDEN_REWARD | C772: -67118 | D772: =ABS(RC[-1]) -> 67118 | E772: 2017-04 | F772: 880146 | G772: 1
A773: 2017-04-11 오전 12:00:00 | B773: GARDEN_REWARD | C773: -58345 | D773: =ABS(RC[-1]) -> 58345 | E773: 2017-04 | F773: 938491 | G773: 1
A774: 2017-04-12 오전 12:00:00 | B774: GARDEN_REWARD | C774: -61537 | D774: =ABS(RC[-1]) -> 61537 | E774: 2017-04 | F774: 1000028 | G774: 1
A775: 2017-04-13 오전 12:00:00 | B775: GARDEN_REWARD | C775: -56861 | D775: =ABS(RC[-1]) -> 56861 | E775: 2017-04 | F775: 1056889 | G775: 1
A776: 2017-04-14 오전 12:00:00 | B776: GARDEN_REWARD | C776: -57849 | D776: =ABS(RC[-1]) -> 57849 | E776: 2017-04 | F776: 1114738 | G776: 1
A777: 2017-04-15 오전 12:00:00 | B777: GARDEN_REWARD | C777: -51210 | D777: =ABS(RC[-1]) -> 51210 | E777: 2017-04 | F777: 1165948 | G777: 1
A778: 2017-04-16 오전 12:00:00 | B778: GARDEN_REWARD | C778: -50371 | D778: =ABS(RC[-1]) -> 50371 | E778: 2017-04 | F778: 1216319 | G778: 1
A779: 2017-04-17 오전 12:00:00 | B779: GARDEN_REWARD | C779: -53369 | D779: =ABS(RC[-1]) -> 53369 | E779: 2017-04 | F779: 1269688 | G779: 1
A780: 2017-04-18 오전 12:00:00 | B780: GARDEN_REWARD | C780: -50763 | D780: =ABS(RC[-1]) -> 50763 | E780: 2017-04 | F780: 1320451 | G780: 1
A781: 2017-04-19 오전 12:00:00 | B781: GARDEN_REWARD | C781: -52130 | D781: =ABS(RC[-1]) -> 52130 | E781: 2017-04 | F781: 1372581 | G781: 1
A782: 2017-04-20 오전 12:00:00 | B782: GARDEN_REWARD | C782: -45020 | D782: =ABS(RC[-1]) -> 45020 | E782: 2017-04 | F782: 1417601 | G782: 0

Sheet: 마법걸기 추이
A1: month | B1: sum
A2: 2015-03 | B2: 1488279
A3: 2015-04 | B3: 1508927
A4: 2015-05 | B4: 1441230
A5: 2015-06 | B5: 1286442
A6: 2015-07 | B6: 3242941
A7: 2015-08 | B7: 2834745
A8: 2015-09 | B8: 3255083
A9: 2015-10 | B9: 3093130
A10: 2015-11 | B10: 2648178
A11: 2015-12 | B11: 2942707
A12: 2016-01 | B12: 2716273
A13: 2016-02 | B13: 2349709
A14: 2016-03 | B14: 2369242
A15: 2016-04 | B15: 2195787
A16: 2016-05 | B16: 2596747
A17: 2016-06 | B17: 2179882
A18: 2016-07 | B18: 2227316
A19: 2016-08 | B19: 2355837
A20: 2016-09 | B20: 2356248
A21: 2016-10 | B21: 2568860
A22: 2016-11 | B22: 2111065
A23: 2016-12 | B23: 2193627
A24: 2017-01 | B24: 2076654
A25: 2017-02 | B25: 1876084
A26: 2017-03 | B26: 1846452
A27: 2017-04 | B27: 1417601

Sheet: 유저 비교
D1: 2015-06-01T00:00:00.000 | E1: 2015-07-01T00:00:00.000 | F1: 2017-04-01T00:00:00.000 | I1: 2017-05-22T00:00:00.000 | N1: 2017-06-01T00:00:00.000
A2: 누적RU | B2: 가입자 전체 수 | D2: 473473 | E2: 476669 | F2: 552384 | I2: 555389 | N2: 558619
A3: 신규RU | B3: 오늘 새로 가입한 유저 수 | D3: 101 | E3: 87 | F3: 111 | I3: 117 | N3: 95
A4: UV | B4: 오늘 접속한 고유 유저 수 : 1명이 2번 접속한 것은 1회로 계산 | C4: =RC[1]/RC[2] -> 0.97439074762494837 | D4: 4718 | E4: 4842 | F4: 4367 | G4: =RC[-1]/RC[-3] -> 0.92560406952098351 | H4: =RC[-2]/RC[-3] -> 0.90190004130524581 | I4: 4055 | J4: =RC[-1]/RC[-6] -> 0.85947435353963542 | K4: =RC[-2]/RC[-6] -> 0.83746385790995459 | N4: 4111 | O4: =RC[-1]/RC[-11] -> 0.87134378974141591
A5: MCU | B5: 오늘의 최대 동접 | C5: =RC[1]/RC[2] -> 0.89274924471299089 | D5: 1182 | E5: 1324 | F5: 952 | G5: =RC[-1]/RC[-3] -> 0.80541455160744502 | H5: =RC[-2]/RC[-3] -> 0.7190332326283988 | I5: 1005 | J5: =RC[-1]/RC[-6] -> 0.85025380710659904 | K5: =RC[-2]/RC[-6] -> 0.75906344410876136 | N5: 980 | O5: =RC[-1]/RC[-11] -> 0.82910321489001693
A6: Play Time | B6: 오늘 접속한 유저의 전체 플레이타임 / UV | C6: =RC[1]/RC[2] -> 0.97435897435897434 | D6: 190 | E6: 195 | F6: 176 | G6: =RC[-1]/RC[-3] -> 0.9263157894736842 | H6: =RC[-2]/RC[-3] -> 0.90256410256410258 | I6: 176 | J6: =RC[-1]/RC[-6] -> 0.9263157894736842 | K6: =RC[-2]/RC[-6] -> 0.90256410256410258 | N6: 166 | O6: =RC[-1]/RC[-11] -> 0.87368421052631584
A7: 전날 신규 재방문 | B7: 어제 새로 가입한 유저 중 오늘 접속한 유저 수 | D7: 29 | E7: 30 | F7: 31 | I7: 30 | N7: 12
A8: 전날 신규 재방문% | B8: 비율 | D8: 24.4 | E8: 27.5 | F8: 26.7 | I8: 26.8 | M8: 목표 | N8: 14
A9: 최근7일 UV | B9: 6일전 ~ 오늘까지 7일간 접속한 고유 유저 수 | C9: =RC[1]/RC[2] -> 0.9772872001698153 | D9: 9208 | E9: 9422 | F9: 8422 | G9: =RC[-1]/RC[-3] -> 0.91463944396177232 | H9: =RC[-2]/RC[-3] -> 0.89386542135427727 | I9: 8001 | J9: =RC[-1]/RC[-6] -> 0.86891833188531709 | K9: =RC[-2]/RC[-6] -> 0.84918276374442792 | M9: =27000*RC[-3] -> 23460.79496090356 | N9: 8059 | O9: =RC[-1]/RC[-11] -> 0.87521720243266721
A10: 7일전 신규의 구간 재방문 | B10: 7일전에 가입한 신규 유저 중 그 이후 오늘까지 7일간 한번이라도 접속한 유저 수 | D10: 53 | E10: 40 | F10: 38 | I10: 26 | N10: 19
A11: 7일전 신규의 구간 재방문% | B11: 비율 | D11: 30.3 | E11: 38.799999999999997 | F11: 25.7 | I11: 28.3 | N11: 18.8
A12: 남 비율 | B12: 오늘 UV의 남 비율 | D12: 46.3 | E12: 46.2 | F12: 46.2 | I12: 47.1 | N12: 46.1
A13: 여 비율 | B13: 오늘 UV의 여 비율 | D13: 53.7 | E13: 53.8 | F13: 53.8 | I13: 52.9 | N13: 53.9
A14: 누적BU | B14: 구매자 전체 수 | D14: 69066 | E14: 69507 | F14: 84868 | I14: 85899 | N14: 86815
A15: 누적매출 | B15: 누적 매출 | D15: 20745751810 | E15: 21161967260 | F15: 29395585080 | I15: 29692923890 | N15: 29996988340
A16: 당월BU | B16: 이번 달 구매자 전체 수 | C16: =RC[1]/RC[2] -> 0.79469026548672561 | D16: 898 | E16: 1130 | F16: 1021 | G16: =RC[-1]/RC[-3] -> 1.1369710467706013 | H16: =RC[-2]/RC[-3] -> 0.90353982300884961 | I16: 939 | J16: =RC[-1]/RC[-6] -> 1.0456570155902005 | K16: =RC[-2]/RC[-6] -> 0.83097345132743361 | N16: 1118 | O16: =RC[-1]/RC[-11] -> 1.2449888641425391
A17: 당월매출 | B17: 이번 달 누적 매출 | D17: 25940300 | E17: 41613910 | F17: 40982670 | I17: 39057270 | N17: 44273990
A18: ARPU/Month | B18: 당월매출 / 당월BU | D18: 28886 | E18: 36826 | F18: 40139 | I18: 41594 | N18: 39601
A19: BU/RU 비율 | B19: 누적BU / 누적RU | D19: 14.6 | E19: 14.6 | F19: 15.4 | I19: 15.5 | N19: 15.5
A20: 최근7일 Unique BU | B20: 6일전 ~ 오늘까지 7일간 구매한 고유 유저 수 | C20: =RC[1]/RC[2] -> 0.92486522911051217 | D20: 2745 | E20: 2968 | F20: 2160 | G20: =RC[-1]/RC[-3] -> 0.78688524590163933 | H20: =RC[-2]/RC[-3] -> 0.72776280323450138 | I20: 2282 | J20: =RC[-1]/RC[-6] -> 0.83132969034608384 | K20: =RC[-2]/RC[-6] -> 0.76886792452830188 | M20: =27000*RC[-3] -> 22445.901639344265 | N20: 2240 | O20: =RC[-1]/RC[-11] -> 0.81602914389799641
A21: 최근7일 BU/최근7일 UV 비율 | B21: 최근 7일 Unique BU / 최근 7일 UV | D21: 29.8 | E21: 31.5 | F21: 25.6 | I21: 28.5 | N21: 27.8
A22: 최근7일 Unique BU / 전체BU | B22: 최근 7일 Unique BU / 누적BU | D22: 4 | E22: 4.3 | F22: 2.5 | I22: 2.7 | N22: 2.6
A23: 당일BU | B23: 오늘 구매한 고유 유저 수 | C23: =RC[1]/RC[2] -> 0.79469026548672561 | D23: 898 | E23: 1130 | F23: 1021 | G23: =RC[-1]/RC[-3] -> 1.1369710467706013 | H23: =RC[-2]/RC[-3] -> 0.90353982300884961 | I23: 939 | J23: =RC[-1]/RC[-6] -> 1.0456570155902005 | K23: =RC[-2]/RC[-6] -> 0.83097345132743361 | N23: 1118 | O23: =RC[-1]/RC[-11] -> 1.2449888641425391
A24: Revenue | B24: 오늘 매출 | D24: 25940300 | E24: 41613910 | F24: 40982670 | I24: 39057270 | N24: 44273990
A25: ARPU/Day | B25: 오늘 매출 / 당일BU | D25: 28886 | E25: 36826 | F25: 40139 | I25: 41594 | N25: 39601
A26: BU/DUV 비율 | B26: 당일BU / 당일UV | D26: 19 | E26: 23.3 | F26: 23.4 | I26: 23.2 | N26: 27.2
A27: 신규BU | B27: 오늘 처음으로 구매한 유저 수 | D27: 16 | E27: 17 | F27: 37 | I27: 57 | N27: 44
A28: Revenue of 신규BU | B28: 신규 BU로부터의 매출 | D28: 529710 | E28: 865760 | F28: 161300 | I28: 230300 | N28: 669000
A29: ARPU of 신규BU | B29: 신규 BU로부터의 매출 / 신규BU | D29: 33106 | E29: 50927 | F29: 4359 | I29: 4040 | N29: 15204
A30: 당일 신규RU의 BU전환율 | B30: 신규 BU / 신규 RU | D30: 2 | E30: 0 | F30: 24.3 | I30: 39.299999999999997 | N30: 23.2
A31: 최근7일 신규RU의 BU전환율 | B31: 최근 7일 신규 BU / 최근 7일 신규 RU | D31: 5.0999999999999996 | E31: 4.5 | F31: 21.2 | I31: 26.7 | N31: 20
A32: 7일전 신규 RU | B32: 7일전 신규 RU | D32: 106 | E32: 111 | F32: 183 | I32: 91 | N32: 98
A33: 7일전 신규 RU의 BU 전환 | B33: 7일전 신규 RU 중 오늘까지 BU가 된 유저 수 | D33: 7 | E33: 8 | F33: 35 | I33: 24 | N33: 21
A34: 7일전 신규RU의 BU전환율 | B34: 비율 | D34: 6.6 | E34: 7.2 | F34: 19.100000000000001 | I34: 26.4 | N34: 21.4
A35: 기존BU | B35: 당일BU - 신규BU | D35: 882 | E35: 1113 | F35: 984 | I35: 882 | N35: 1074
A36: Revenue of 기존BU | B36: 기존BU로부터의 매출 | D36: 25410590 | E36: 40748150 | F36: 40821370 | I36: 38826970 | N36: 43604990
A37: ARPU of 기존BU | B37: 기존BU로부터의 매출 / 기존BU | D37: 28810 | E37: 36611 | F37: 41485 | I37: 44021 | N37: 40600
A38: D-1일 | B38: 어제 신규 중 오늘 접속한 유저 수 | D38: 29 | E38: 30 | F38: 31 | I38: 30 | N38: 12
A39: D-3일 | B39: 3일전 신규 중 오늘 접속한 유저 수 | D39: 11 | E39: 11 | F39: 12 | I39: 9 | N39: 18
A40: D-5일 | B40: 동일 | D40: 13 | E40: 11 | F40: 13 | I40: 11 | N40: 5
A41: D-7일 | B41: 동일 | D41: 15 | E41: 10 | F41: 5 | I41: 7 | N41: 5
A42: D-14일 | B42: 동일 | D42: 4 | E42: 11 | F42: 7 | I42: 9 | N42: 4
A43: D-21일 | B43: 동일 | D43: 6 | E43: 5 | F43: 7 | I43: 7 | N43: 7
A44: D-28일 | B44: 동일 | D44: 1 | E44: 6 | F44: 4 | I44: 0 | N44: 2
A45: D-1일% | B45: 비율 | D45: 24.4 | E45: 27.5 | F45: 26.7 | I45: 26.8 | N45: 14
A46: D-3일% | B46: 비율 | D46: 12.9 | E46: 7.7 | F46: 12.9 | I46: 13.8 | N46: 19.100000000000001
A47: D-5일% | B47: 비율 | D47: 14 | E47: 11.5 | F47: 14.4 | I47: 10.4 | N47: 3.1
A48: D-7일% | B48: 비율 | D48: 8.6 | E48: 9.6999999999999993 | F48: 3.4 | I48: 7.6 | N48: 5
A49: D-14일% | B49: 비율 | D49: 4.3 | E49: 11.6 | F49: 5.3 | I49: 9.4 | N49: 4
A50: D-21일% | B50: 비율 | D50: 6.7 | E50: 7.6 | F50: 5.3 | I50: 5.9 | N50: 8
A51: D-28일% | B51: 비율 | D51: 0.9 | E51: 6.5 | F51: 6.8 | I51: 0 | N51: 1.8

Sheet: 캔디 사용처
A1: DATE | B1: kind | C1: num | D1: abs | G1: buy Item | H1: home | I1: deal
A2: 2017-04-01 오전 12:00:00 | B2: BUYITEM | C2: -101141 | D2: =ABS(RC[-1]) -> 101141 | F2: 1 | G2: 101141 | H2: 205951 | I2: 88946
A3: 2017-04-01 오전 12:00:00 | B3: DEAL | C3: -88946 | D3: =ABS(RC[-1]) -> 88946 | F3: 2 | G3: 61304 | H3: 91884 | I3: 39446
A4: 2017-04-01 오전 12:00:00 | B4: DAILYQUEST | C4: -618 | D4: =ABS(RC[-1]) -> 618 | F4: 3 | G4: 44533 | H4: 82850 | I4: 31889
A5: 2017-04-01 오전 12:00:00 | B5: TWINKLECOUPLE | C5: -49 | D5: =ABS(RC[-1]) -> 49 | F5: 4 | G5: 42367 | H5: 79479 | I5: 38996
A6: 2017-04-01 오전 12:00:00 | B6: GARDEN_PLANTSEED | C6: -191 | D6: =ABS(RC[-1]) -> 191 | F6: 5 | G6: 50316 | H6: 82183 | I6: 41086
A7: 2017-04-01 오전 12:00:00 | B7: GARDEN_USE_BOOSTER | C7: -30261 | D7: =ABS(RC[-1]) -> 30261 | F7: 6 | G7: 28613 | H7: 69796 | I7: 16067
A8: 2017-04-01 오전 12:00:00 | B8: GARDEN_REWARD | C8: -205951 | D8: =ABS(RC[-1]) -> 205951 | F8: 7 | G8: 22151 | H8: 73150 | I8: 22840
A9: 2017-04-01 오전 12:00:00 | B9: CONSELLATION_OPEN | C9: -65 | D9: =ABS(RC[-1]) -> 65 | F9: 8 | G9: 19122 | H9: 61326 | I9: 16320
A10: 2017-04-01 오전 12:00:00 | B10: ELF_SKILL_CHARGE | C10: -1618 | D10: =ABS(RC[-1]) -> 1618 | F10: 9 | G10: 18197 | H10: 66409 | I10: 21507
A11: 2017-04-01 오전 12:00:00 | B11: SOUND_SOURCE_INIT_CHARGE | C11: -40 | D11: =ABS(RC[-1]) -> 40 | F11: 10 | G11: 18034 | H11: 67118 | I11: 22918
A12: 2017-04-01 오전 12:00:00 | B12: WEDDING_PLAN | C12: -635 | D12: =ABS(RC[-1]) -> 635 | F12: 11 | G12: 16196 | H12: 58345 | I12: 23049
A13: 2017-04-01 오전 12:00:00 | B13: DIVORCE_COST | C13: -100 | D13: =ABS(RC[-1]) -> 100 | F13: 12 | G13: 16182 | H13: 61537 | I13: 16327
A14: 2017-04-01 오전 12:00:00 | B14: PETMATE | C14: -657 | D14: =ABS(RC[-1]) -> 657 | F14: 13 | G14: 13602 | H14: 56861 | I14: 21512
A15: 2017-04-01 오전 12:00:00 | B15: PET_BUFF_MODIFY | C15: -100 | D15: =ABS(RC[-1]) -> 100 | F15: 14 | G15: 19458 | H15: 57849 | I15: 17842
A16: 2017-04-02 오전 12:00:00 | B16: BUYITEM | C16: -61304 | D16: =ABS(RC[-1]) -> 61304 | F16: 15 | G16: 14451 | H16: 51210 | I16: 12376
A17: 2017-04-02 오전 12:00:00 | B17: DEAL | C17: -39446 | D17: =ABS(RC[-1]) -> 39446 | F17: 16 | G17: 17032 | H17: 50371 | I17: 22281
A18: 2017-04-02 오전 12:00:00 | B18: DAILYQUEST | C18: -672 | D18: =ABS(RC[-1]) -> 672 | F18: 17 | G18: 12959 | H18: 53369 | I18: 23675
A19: 2017-04-02 오전 12:00:00 | B19: TWINKLECOUPLE | C19: -59 | D19: =ABS(RC[-1]) -> 59 | F19: 18 | G19: 16021 | H19: 50763 | I19: 18065
A20: 2017-04-02 오전 12:00:00 | B20: GARDEN_PLANTSEED | C20: -616 | D20: =ABS(RC[-1]) -> 616 | F20: 19 | G20: 13261 | H20: 52130 | I20: 16097
A21: 2017-04-02 오전 12:00:00 | B21: GARDEN_USE_BOOSTER | C21: -6321 | D21: =ABS(RC[-1]) -> 6321 | F21: 20 | G21: 17701 | H21: 45020 | I21: 13157
A22: 2017-04-02 오전 12:00:00 | B22: GARDEN_REWARD | C22: -91884 | D22: =ABS(RC[-1]) -> 91884
A23: 2017-04-02 오전 12:00:00 | B23: CONSELLATION_OPEN | C23: -150 | D23: =ABS(RC[-1]) -> 150
A24: 2017-04-02 오전 12:00:00 | B24: ELF_SKILL_CHARGE | C24: -969 | D24: =ABS(RC[-1]) -> 969
A25: 2017-04-02 오전 12:00:00 | B25: SOUND_SOURCE_INIT_CHARGE | C25: -20 | D25: =ABS(RC[-1]) -> 20
A26: 2017-04-02 오전 12:00:00 | B26: WEDDING_PLAN | C26: -1270 | D26: =ABS(RC[-1]) -> 1270
A27: 2017-04-02 오전 12:00:00 | B27: WEDDING_GIVEMONEY | C27: -3 | D27: =ABS(RC[-1]) -> 3
A28: 2017-04-02 오전 12:00:00 | B28: DIVORCE_COST | C28: -100 | D28: =ABS(RC[-1]) -> 100
A29: 2017-04-02 오전 12:00:00 | B29: PETMATE | C29: -262 | D29: =ABS(RC[-1]) -> 262
A30: 2017-04-02 오전 12:00:00 | B30: PET_BUFF_MODIFY | C30: -200 | D30: =ABS(RC[-1]) -> 200
A31: 2017-04-03 오전 12:00:00 | B31: BUYITEM | C31: -44533 | D31: =ABS(RC[-1]) -> 44533
A32: 2017-04-03 오전 12:00:00 | B32: DEAL | C32: -31889 | D32: =ABS(RC[-1]) -> 31889
A33: 2017-04-03 오전 12:00:00 | B33: DAILYQUEST | C33: -633 | D33: =ABS(RC[-1]) -> 633
A34: 2017-04-03 오전 12:00:00 | B34: TWINKLECOUPLE | C34: -108 | D34: =ABS(RC[-1]) -> 108
A35: 2017-04-03 오전 12:00:00 | B35: GARDEN_PLANTSEED | C35: -241 | D35: =ABS(RC[-1]) -> 241
A36: 2017-04-03 오전 12:00:00 | B36: GARDEN_USE_BOOSTER | C36: -30145 | D36: =ABS(RC[-1]) -> 30145
A37: 2017-04-03 오전 12:00:00 | B37: GARDEN_REWARD | C37: -82850 | D37: =ABS(RC[-1]) -> 82850
A38: 2017-04-03 오전 12:00:00 | B38: CONSELLATION_OPEN | C38: -65 | D38: =ABS(RC[-1]) -> 65
A39: 2017-04-03 오전 12:00:00 | B39: ELF_SKILL_CHARGE | C39: -836 | D39: =ABS(RC[-1]) -> 836
A40: 2017-04-03 오전 12:00:00 | B40: SOUND_SOURCE_INIT_CHARGE | C40: -30 | D40: =ABS(RC[-1]) -> 30
A41: 2017-04-03 오전 12:00:00 | B41: WEDDING_PLAN | C41: -381 | D41: =ABS(RC[-1]) -> 381
A42: 2017-04-03 오전 12:00:00 | B42: WEDDING_GIVEMONEY | C42: -70 | D42: =ABS(RC[-1]) -> 70
A43: 2017-04-03 오전 12:00:00 | B43: DIVORCE_COST | C43: -400 | D43: =ABS(RC[-1]) -> 400
A44: 2017-04-03 오전 12:00:00 | B44: PETMATE | C44: -258 | D44: =ABS(RC[-1]) -> 258
A45: 2017-04-04 오전 12:00:00 | B45: BUYITEM | C45: -42367 | D45: =ABS(RC[-1]) -> 42367
A46: 2017-04-04 오전 12:00:00 | B46: DEAL | C46: -38996 | D46: =ABS(RC[-1]) -> 38996
A47: 2017-04-04 오전 12:00:00 | B47: DAILYQUEST | C47: -654 | D47: =ABS(RC[-1]) -> 654
A48: 2017-04-04 오전 12:00:00 | B48: TWINKLECOUPLE | C48: -69 | D48: =ABS(RC[-1]) -> 69
A49: 2017-04-04 오전 12:00:00 | B49: GARDEN_PLANTSEED | C49: -499 | D49: =ABS(RC[-1]) -> 499
A50: 2017-04-04 오전 12:00:00 | B50: GARDEN_USE_BOOSTER | C50: -9059 | D50: =ABS(RC[-1]) -> 9059
A51: 2017-04-04 오전 12:00:00 | B51: GARDEN_REWARD | C51: -79479 | D51: =ABS(RC[-1]) -> 79479
A52: 2017-04-04 오전 12:00:00 | B52: CONSELLATION_OPEN | C52: -75 | D52: =ABS(RC[-1]) -> 75
A53: 2017-04-04 오전 12:00:00 | B53: ELF_SKILL_CHARGE | C53: -817 | D53: =ABS(RC[-1]) -> 817
A54: 2017-04-04 오전 12:00:00 | B54: SOUND_SOURCE_INIT_CHARGE | C54: -20 | D54: =ABS(RC[-1]) -> 20
A55: 2017-04-04 오전 12:00:00 | B55: WEDDING_PLAN | C55: -254 | D55: =ABS(RC[-1]) -> 254
A56: 2017-04-04 오전 12:00:00 | B56: DIVORCE_COST | C56: -100 | D56: =ABS(RC[-1]) -> 100
A57: 2017-04-04 오전 12:00:00 | B57: PETMATE | C57: -311 | D57: =ABS(RC[-1]) -> 311
A58: 2017-04-05 오전 12:00:00 | B58: BUYITEM | C58: -50316 | D58: =ABS(RC[-1]) -> 50316
A59: 2017-04-05 오전 12:00:00 | B59: DEAL | C59: -41086 | D59: =ABS(RC[-1]) -> 41086
A60: 2017-04-05 오전 12:00:00 | B60: DAILYQUEST | C60: -647 | D60: =ABS(RC[-1]) -> 647
A61: 2017-04-05 오전 12:00:00 | B61: TWINKLECOUPLE | C61: -54 | D61: =ABS(RC[-1]) -> 54
A62: 2017-04-05 오전 12:00:00 | B62: GARDEN_PLANTSEED | C62: -343 | D62: =ABS(RC[-1]) -> 343
A63: 2017-04-05 오전 12:00:00 | B63: GARDEN_USE_BOOSTER | C63: -3997 | D63: =ABS(RC[-1]) -> 3997
A64: 2017-04-05 오전 12:00:00 | B64: GARDEN_REWARD | C64: -82183 | D64: =ABS(RC[-1]) -> 82183
A65: 2017-04-05 오전 12:00:00 | B65: CONSELLATION_OPEN | C65: -55 | D65: =ABS(RC[-1]) -> 55
A66: 2017-04-05 오전 12:00:00 | B66: ELF_SKILL_CHARGE | C66: -880 | D66: =ABS(RC[-1]) -> 880
A67: 2017-04-05 오전 12:00:00 | B67: SOUND_SOURCE_INIT_CHARGE | C67: -10 | D67: =ABS(RC[-1]) -> 10
A68: 2017-04-05 오전 12:00:00 | B68: WEDDING_PLAN | C68: -508 | D68: =ABS(RC[-1]) -> 508
A69: 2017-04-05 오전 12:00:00 | B69: WEDDING_GIVEMONEY | C69: -420 | D69: =ABS(RC[-1]) -> 420
A70: 2017-04-05 오전 12:00:00 | B70: DIVORCE_COST | C70: -300 | D70: =ABS(RC[-1]) -> 300
A71: 2017-04-05 오전 12:00:00 | B71: PETMATE | C71: -167 | D71: =ABS(RC[-1]) -> 167
A72: 2017-04-05 오전 12:00:00 | B72: PET_BUFF_MODIFY | C72: -200 | D72: =ABS(RC[-1]) -> 200
A73: 2017-04-06 오전 12:00:00 | B73: BUYITEM | C73: -28613 | D73: =ABS(RC[-1]) -> 28613
A74: 2017-04-06 오전 12:00:00 | B74: DEAL | C74: -16067 | D74: =ABS(RC[-1]) -> 16067
A75: 2017-04-06 오전 12:00:00 | B75: DAILYQUEST | C75: -651 | D75: =ABS(RC[-1]) -> 651
A76: 2017-04-06 오전 12:00:00 | B76: TWINKLECOUPLE | C76: -58 | D76: =ABS(RC[-1]) -> 58
A77: 2017-04-06 오전 12:00:00 | B77: GARDEN_PLANTSEED | C77: -250 | D77: =ABS(RC[-1]) -> 250
A78: 2017-04-06 오전 12:00:00 | B78: GARDEN_USE_BOOSTER | C78: -7604 | D78: =ABS(RC[-1]) -> 7604
A79: 2017-04-06 오전 12:00:00 | B79: GARDEN_REWARD | C79: -69796 | D79: =ABS(RC[-1]) -> 69796
A80: 2017-04-06 오전 12:00:00 | B80: CONSELLATION_OPEN | C80: -170 | D80: =ABS(RC[-1]) -> 170
A81: 2017-04-06 오전 12:00:00 | B81: ELF_SKILL_CHARGE | C81: -871 | D81: =ABS(RC[-1]) -> 871
A82: 2017-04-06 오전 12:00:00 | B82: SOUND_SOURCE_INIT_CHARGE | C82: -50 | D82: =ABS(RC[-1]) -> 50
A83: 2017-04-06 오전 12:00:00 | B83: WEDDING_PLAN | C83: -127 | D83: =ABS(RC[-1]) -> 127
A84: 2017-04-06 오전 12:00:00 | B84: DIVORCE_COST | C84: -100 | D84: =ABS(RC[-1]) -> 100
A85: 2017-04-06 오전 12:00:00 | B85: PETMATE | C85: -406 | D85: =ABS(RC[-1]) -> 406
A86: 2017-04-06 오전 12:00:00 | B86: PET_BUFF_MODIFY | C86: -1300 | D86: =ABS(RC[-1]) -> 1300
A87: 2017-04-07 오전 12:00:00 | B87: BUYITEM | C87: -22151 | D87: =ABS(RC[-1]) -> 22151
A88: 2017-04-07 오전 12:00:00 | B88: DEAL | C88: -22840 | D88: =ABS(RC[-1]) -> 22840
A89: 2017-04-07 오전 12:00:00 | B89: DAILYQUEST | C89: -635 | D89: =ABS(RC[-1]) -> 635
A90: 2017-04-07 오전 12:00:00 | B90: TWINKLECOUPLE | C90: -34 | D90: =ABS(RC[-1]) -> 34
A91: 2017-04-07 오전 12:00:00 | B91: GARDEN_PLANTSEED | C91: -252 | D91: =ABS(RC[-1]) -> 252
A92: 2017-04-07 오전 12:00:00 | B92: GARDEN_USE_BOOSTER | C92: -3826 | D92: =ABS(RC[-1]) -> 3826
A93: 2017-04-07 오전 12:00:00 | B93: GARDEN_REWARD | C93: -73150 | D93: =ABS(RC[-1]) -> 73150
A94: 2017-04-07 오전 12:00:00 | B94: CONSELLATION_OPEN | C94: -60 | D94: =ABS(RC[-1]) -> 60
A95: 2017-04-07 오전 12:00:00 | B95: ELF_SKILL_CHARGE | C95: -846 | D95: =ABS(RC[-1]) -> 846
A96: 2017-04-07 오전 12:00:00 | B96: SOUND_SOURCE_INIT_CHARGE | C96: -100 | D96: =ABS(RC[-1]) -> 100
A97: 2017-04-07 오전 12:00:00 | B97: WEDDING_PLAN | C97: -381 | D97: =ABS(RC[-1]) -> 381
A98: 2017-04-07 오전 12:00:00 | B98: DIVORCE_COST | C98: -100 | D98: =ABS(RC[-1]) -> 100
A99: 2017-04-07 오전 12:00:00 | B99: PETMATE | C99: -224 | D99: =ABS(RC[-1]) -> 224
A100: 2017-04-07 오전 12:00:00 | B100: PET_BUFF_MODIFY | C100: -100 | D100: =ABS(RC[-1]) -> 100
A101: 2017-04-08 오전 12:00:00 | B101: BUYITEM | C101: -19122 | D101: =ABS(RC[-1]) -> 19122
A102: 2017-04-08 오전 12:00:00 | B102: DEAL | C102: -16320 | D102: =ABS(RC[-1]) -> 16320
A103: 2017-04-08 오전 12:00:00 | B103: DAILYQUEST | C103: -601 | D103: =ABS(RC[-1]) -> 601
A104: 2017-04-08 오전 12:00:00 | B104: TWINKLECOUPLE | C104: -101 | D104: =ABS(RC[-1]) -> 101
A105: 2017-04-08 오전 12:00:00 | B105: GARDEN_PLANTSEED | C105: -498 | D105: =ABS(RC[-1]) -> 498
A106: 2017-04-08 오전 12:00:00 | B106: GARDEN_USE_BOOSTER | C106: -3860 | D106: =ABS(RC[-1]) -> 3860
A107: 2017-04-08 오전 12:00:00 | B107: GARDEN_REWARD | C107: -61326 | D107: =ABS(RC[-1]) -> 61326
A108: 2017-04-08 오전 12:00:00 | B108: CONSELLATION_OPEN | C108: -100 | D108: =ABS(RC[-1]) -> 100
A109: 2017-04-08 오전 12:00:00 | B109: ELF_SKILL_CHARGE | C109: -850 | D109: =ABS(RC[-1]) -> 850
A110: 2017-04-08 오전 12:00:00 | B110: SOUND_SOURCE_INIT_CHARGE | C110: -10 | D110: =ABS(RC[-1]) -> 10
A111: 2017-04-08 오전 12:00:00 | B111: WEDDING_PLAN | C111: -381 | D111: =ABS(RC[-1]) -> 381
A112: 2017-04-08 오전 12:00:00 | B112: WEDDING_GIVEMONEY | C112: -80 | D112: =ABS(RC[-1]) -> 80
A113: 2017-04-08 오전 12:00:00 | B113: PETMATE | C113: -232 | D113: =ABS(RC[-1]) -> 232
A114: 2017-04-09 오전 12:00:00 | B114: BUYITEM | C114: -18197 | D114: =ABS(RC[-1]) -> 18197
A115: 2017-04-09 오전 12:00:00 | B115: DEAL | C115: -21507 | D115: =ABS(RC[-1]) -> 21507
A116: 2017-04-09 오전 12:00:00 | B116: DAILYQUEST | C116: -561 | D116: =ABS(RC[-1]) -> 561
A117: 2017-04-09 오전 12:00:00 | B117: TWINKLECOUPLE | C117: -73 | D117: =ABS(RC[-1]) -> 73
A118: 2017-04-09 오전 12:00:00 | B118: GARDEN_PLANTSEED | C118: -188 | D118: =ABS(RC[-1]) -> 188
A119: 2017-04-09 오전 12:00:00 | B119: GARDEN_USE_BOOSTER | C119: -3091 | D119: =ABS(RC[-1]) -> 3091
A120: 2017-04-09 오전 12:00:00 | B120: GARDEN_REWARD | C120: -66409 | D120: =ABS(RC[-1]) -> 66409
A121: 2017-04-09 오전 12:00:00 | B121: CONSELLATION_OPEN | C121: -155 | D121: =ABS(RC[-1]) -> 155
A122: 2017-04-09 오전 12:00:00 | B122: ELF_SKILL_CHARGE | C122: -1037 | D122: =ABS(RC[-1]) -> 1037
A123: 2017-04-09 오전 12:00:00 | B123: SOUND_SOURCE_INIT_CHARGE | C123: -30 | D123: =ABS(RC[-1]) -> 30
A124: 2017-04-09 오전 12:00:00 | B124: WEDDING_PLAN | C124: -127 | D124: =ABS(RC[-1]) -> 127
A125: 2017-04-09 오전 12:00:00 | B125: WEDDING_GIVEMONEY | C125: -100 | D125: =ABS(RC[-1]) -> 100
A126: 2017-04-09 오전 12:00:00 | B126: DIVORCE_COST | C126: -100 | D126: =ABS(RC[-1]) -> 100
A127: 2017-04-09 오전 12:00:00 | B127: PETMATE | C127: -229 | D127: =ABS(RC[-1]) -> 229
A128: 2017-04-10 오전 12:00:00 | B128: BUYITEM | C128: -18034 | D128: =ABS(RC[-1]) -> 18034
A129: 2017-04-10 오전 12:00:00 | B129: DEAL | C129: -22918 | D129: =ABS(RC[-1]) -> 22918
A130: 2017-04-10 오전 12:00:00 | B130: DAILYQUEST | C130: -551 | D130: =ABS(RC[-1]) -> 551
A131: 2017-04-10 오전 12:00:00 | B131: TWINKLECOUPLE | C131: -48 | D131: =ABS(RC[-1]) -> 48
A132: 2017-04-10 오전 12:00:00 | B132: GARDEN_PLANTSEED | C132: -487 | D132: =ABS(RC[-1]) -> 487
A133: 2017-04-10 오전 12:00:00 | B133: GARDEN_USE_BOOSTER | C133: -3826 | D133: =ABS(RC[-1]) -> 3826
A134: 2017-04-10 오전 12:00:00 | B134: GARDEN_REWARD | C134: -67118 | D134: =ABS(RC[-1]) -> 67118
A135: 2017-04-10 오전 12:00:00 | B135: CONSELLATION_OPEN | C135: -90 | D135: =ABS(RC[-1]) -> 90
A136: 2017-04-10 오전 12:00:00 | B136: ELF_SKILL_CHARGE | C136: -906 | D136: =ABS(RC[-1]) -> 906
A137: 2017-04-10 오전 12:00:00 | B137: SOUND_SOURCE_INIT_CHARGE | C137: -10 | D137: =ABS(RC[-1]) -> 10
A138: 2017-04-10 오전 12:00:00 | B138: WEDDING_PLAN | C138: -381 | D138: =ABS(RC[-1]) -> 381
A139: 2017-04-10 오전 12:00:00 | B139: DIVORCE_COST | C139: -200 | D139: =ABS(RC[-1]) -> 200
A140: 2017-04-10 오전 12:00:00 | B140: PETMATE | C140: -127 | D140: =ABS(RC[-1]) -> 127
A141: 2017-04-11 오전 12:00:00 | B141: BUYITEM | C141: -16196 | D141: =ABS(RC[-1]) -> 16196
A142: 2017-04-11 오전 12:00:00 | B142: DEAL | C142: -23049 | D142: =ABS(RC[-1]) -> 23049
A143: 2017-04-11 오전 12:00:00 | B143: DAILYQUEST | C143: -659 | D143: =ABS(RC[-1]) -> 659
A144: 2017-04-11 오전 12:00:00 | B144: TWINKLECOUPLE | C144: -55 | D144: =ABS(RC[-1]) -> 55
A145: 2017-04-11 오전 12:00:00 | B145: GARDEN_PLANTSEED | C145: -377 | D145: =ABS(RC[-1]) -> 377
A146: 2017-04-11 오전 12:00:00 | B146: GARDEN_USE_BOOSTER | C146: -3388 | D146: =ABS(RC[-1]) -> 3388
A147: 2017-04-11 오전 12:00:00 | B147: GARDEN_REWARD | C147: -58345 | D147: =ABS(RC[-1]) -> 58345
A148: 2017-04-11 오전 12:00:00 | B148: CONSELLATION_OPEN | C148: -135 | D148: =ABS(RC[-1]) -> 135
A149: 2017-04-11 오전 12:00:00 | B149: ELF_SKILL_CHARGE | C149: -600 | D149: =ABS(RC[-1]) -> 600
A150: 2017-04-11 오전 12:00:00 | B150: SOUND_SOURCE_INIT_CHARGE | C150: -40 | D150: =ABS(RC[-1]) -> 40
A151: 2017-04-11 오전 12:00:00 | B151: WEDDING_PLAN | C151: -381 | D151: =ABS(RC[-1]) -> 381
A152: 2017-04-11 오전 12:00:00 | B152: DIVORCE_COST | C152: -300 | D152: =ABS(RC[-1]) -> 300
A153: 2017-04-11 오전 12:00:00 | B153: PETMATE | C153: -268 | D153: =ABS(RC[-1]) -> 268
A154: 2017-04-12 오전 12:00:00 | B154: BUYITEM | C154: -16182 | D154: =ABS(RC[-1]) -> 16182
A155: 2017-04-12 오전 12:00:00 | B155: DEAL | C155: -16327 | D155: =ABS(RC[-1]) -> 16327
A156: 2017-04-12 오전 12:00:00 | B156: DAILYQUEST | C156: -580 | D156: =ABS(RC[-1]) -> 580
A157: 2017-04-12 오전 12:00:00 | B157: TWINKLECOUPLE | C157: -32 | D157: =ABS(RC[-1]) -> 32
A158: 2017-04-12 오전 12:00:00 | B158: GARDEN_PLANTSEED | C158: -1680 | D158: =ABS(RC[-1]) -> 1680
A159: 2017-04-12 오전 12:00:00 | B159: GARDEN_USE_BOOSTER | C159: -4940 | D159: =ABS(RC[-1]) -> 4940
A160: 2017-04-12 오전 12:00:00 | B160: GARDEN_REWARD | C160: -61537 | D160: =ABS(RC[-1]) -> 61537
A161: 2017-04-12 오전 12:00:00 | B161: CONSELLATION_OPEN | C161: -125 | D161: =ABS(RC[-1]) -> 125
A162: 2017-04-12 오전 12:00:00 | B162: ELF_SKILL_CHARGE | C162: -817 | D162: =ABS(RC[-1]) -> 817
A163: 2017-04-12 오전 12:00:00 | B163: SOUND_SOURCE_INIT_CHARGE | C163: -40 | D163: =ABS(RC[-1]) -> 40
A164: 2017-04-12 오전 12:00:00 | B164: WEDDING_PLAN | C164: -508 | D164: =ABS(RC[-1]) -> 508
A165: 2017-04-12 오전 12:00:00 | B165: PETMATE | C165: -322 | D165: =ABS(RC[-1]) -> 322
A166: 2017-04-12 오전 12:00:00 | B166: PET_BUFF_MODIFY | C166: -100 | D166: =ABS(RC[-1]) -> 100
A167: 2017-04-13 오전 12:00:00 | B167: BUYITEM | C167: -13602 | D167: =ABS(RC[-1]) -> 13602
A168: 2017-04-13 오전 12:00:00 | B168: DEAL | C168: -21512 | D168: =ABS(RC[-1]) -> 21512
A169: 2017-04-13 오전 12:00:00 | B169: DAILYQUEST | C169: -519 | D169: =ABS(RC[-1]) -> 519
A170: 2017-04-13 오전 12:00:00 | B170: TWINKLECOUPLE | C170: -39 | D170: =ABS(RC[-1]) -> 39
A171: 2017-04-13 오전 12:00:00 | B171: GARDEN_PLANTSEED | C171: -305 | D171: =ABS(RC[-1]) -> 305
A172: 2017-04-13 오전 12:00:00 | B172: GARDEN_USE_BOOSTER | C172: -3751 | D172: =ABS(RC[-1]) -> 3751
A173: 2017-04-13 오전 12:00:00 | B173: GARDEN_REWARD | C173: -56861 | D173: =ABS(RC[-1]) -> 56861
A174: 2017-04-13 오전 12:00:00 | B174: CONSELLATION_OPEN | C174: -25 | D174: =ABS(RC[-1]) -> 25
A175: 2017-04-13 오전 12:00:00 | B175: ELF_SKILL_CHARGE | C175: -756 | D175: =ABS(RC[-1]) -> 756
A176: 2017-04-13 오전 12:00:00 | B176: SOUND_SOURCE_INIT_CHARGE | C176: -50 | D176: =ABS(RC[-1]) -> 50
A177: 2017-04-13 오전 12:00:00 | B177: WEDDING_PLAN | C177: -381 | D177: =ABS(RC[-1]) -> 381
A178: 2017-04-13 오전 12:00:00 | B178: WEDDING_GIVEMONEY | C178: -105 | D178: =ABS(RC[-1]) -> 105
A179: 2017-04-13 오전 12:00:00 | B179: PETMATE | C179: -145 | D179: =ABS(RC[-1]) -> 145
A180: 2017-04-14 오전 12:00:00 | B180: BUYITEM | C180: -19458 | D180: =ABS(RC[-1]) -> 19458
A181: 2017-04-14 오전 12:00:00 | B181: DEAL | C181: -17842 | D181: =ABS(RC[-1]) -> 17842
A182: 2017-04-14 오전 12:00:00 | B182: DAILYQUEST | C182: -667 | D182: =ABS(RC[-1]) -> 667
A183: 2017-04-14 오전 12:00:00 | B183: TWINKLECOUPLE | C183: -47 | D183: =ABS(RC[-1]) -> 47
A184: 2017-04-14 오전 12:00:00 | B184: GARDEN_PLANTSEED | C184: -256 | D184: =ABS(RC[-1]) -> 256
A185: 2017-04-14 오전 12:00:00 | B185: GARDEN_USE_BOOSTER | C185: -3508 | D185: =ABS(RC[-1]) -> 3508
A186: 2017-04-14 오전 12:00:00 | B186: GARDEN_REWARD | C186: -57849 | D186: =ABS(RC[-1]) -> 57849
A187: 2017-04-14 오전 12:00:00 | B187: CONSELLATION_OPEN | C187: -70 | D187: =ABS(RC[-1]) -> 70
A188: 2017-04-14 오전 12:00:00 | B188: ELF_SKILL_CHARGE | C188: -791 | D188: =ABS(RC[-1]) -> 791
A189: 2017-04-14 오전 12:00:00 | B189: SOUND_SOURCE_INIT_CHARGE | C189: -70 | D189: =ABS(RC[-1]) -> 70
A190: 2017-04-14 오전 12:00:00 | B190: WEDDING_PLAN | C190: -254 | D190: =ABS(RC[-1]) -> 254
A191: 2017-04-14 오전 12:00:00 | B191: WEDDING_GIVEMONEY | C191: -120 | D191: =ABS(RC[-1]) -> 120
A192: 2017-04-14 오전 12:00:00 | B192: PETMATE | C192: -169 | D192: =ABS(RC[-1]) -> 169
A193: 2017-04-15 오전 12:00:00 | B193: BUYITEM | C193: -14451 | D193: =ABS(RC[-1]) -> 14451
A194: 2017-04-15 오전 12:00:00 | B194: DEAL | C194: -12376 | D194: =ABS(RC[-1]) -> 12376
A195: 2017-04-15 오전 12:00:00 | B195: DAILYQUEST | C195: -587 | D195: =ABS(RC[-1]) -> 587
A196: 2017-04-15 오전 12:00:00 | B196: TWINKLECOUPLE | C196: -40 | D196: =ABS(RC[-1]) -> 40
A197: 2017-04-15 오전 12:00:00 | B197: GARDEN_PLANTSEED | C197: -186 | D197: =ABS(RC[-1]) -> 186
A198: 2017-04-15 오전 12:00:00 | B198: GARDEN_USE_BOOSTER | C198: -2983 | D198: =ABS(RC[-1]) -> 2983
A199: 2017-04-15 오전 12:00:00 | B199: GARDEN_REWARD | C199: -51210 | D199: =ABS(RC[-1]) -> 51210
A200: 2017-04-15 오전 12:00:00 | B200: CONSELLATION_OPEN | C200: -165 | D200: =ABS(RC[-1]) -> 165
A201: 2017-04-15 오전 12:00:00 | B201: ELF_SKILL_CHARGE | C201: -712 | D201: =ABS(RC[-1]) -> 712
A202: 2017-04-15 오전 12:00:00 | B202: SOUND_SOURCE_INIT_CHARGE | C202: -40 | D202: =ABS(RC[-1]) -> 40
A203: 2017-04-15 오전 12:00:00 | B203: WEDDING_PLAN | C203: -635 | D203: =ABS(RC[-1]) -> 635
A204: 2017-04-15 오전 12:00:00 | B204: PETMATE | C204: -102 | D204: =ABS(RC[-1]) -> 102
A205: 2017-04-16 오전 12:00:00 | B205: BUYITEM | C205: -17032 | D205: =ABS(RC[-1]) -> 17032
A206: 2017-04-16 오전 12:00:00 | B206: DEAL | C206: -22281 | D206: =ABS(RC[-1]) -> 22281
A207: 2017-04-16 오전 12:00:00 | B207: DAILYQUEST | C207: -628 | D207: =ABS(RC[-1]) -> 628
A208: 2017-04-16 오전 12:00:00 | B208: TWINKLECOUPLE | C208: -60 | D208: =ABS(RC[-1]) -> 60
A209: 2017-04-16 오전 12:00:00 | B209: GARDEN_PLANTSEED | C209: -203 | D209: =ABS(RC[-1]) -> 203
A210: 2017-04-16 오전 12:00:00 | B210: GARDEN_USE_BOOSTER | C210: -2829 | D210: =ABS(RC[-1]) -> 2829
A211: 2017-04-16 오전 12:00:00 | B211: GARDEN_REWARD | C211: -50371 | D211: =ABS(RC[-1]) -> 50371
A212: 2017-04-16 오전 12:00:00 | B212: CONSELLATION_OPEN | C212: -125 | D212: =ABS(RC[-1]) -> 125
A213: 2017-04-16 오전 12:00:00 | B213: ELF_SKILL_CHARGE | C213: -838 | D213: =ABS(RC[-1]) -> 838
A214: 2017-04-16 오전 12:00:00 | B214: SOUND_SOURCE_INIT_CHARGE | C214: -40 | D214: =ABS(RC[-1]) -> 40
A215: 2017-04-16 오전 12:00:00 | B215: WEDDING_PLAN | C215: -508 | D215: =ABS(RC[-1]) -> 508
A216: 2017-04-16 오전 12:00:00 | B216: WEDDING_GIVEMONEY | C216: -5 | D216: =ABS(RC[-1]) -> 5
A217: 2017-04-16 오전 12:00:00 | B217: DIVORCE_COST | C217: -500 | D217: =ABS(RC[-1]) -> 500
A218: 2017-04-16 오전 12:00:00 | B218: PETMATE | C218: -1521 | D218: =ABS(RC[-1]) -> 1521
A219: 2017-04-17 오전 12:00:00 | B219: BUYITEM | C219: -12959 | D219: =ABS(RC[-1]) -> 12959
A220: 2017-04-17 오전 12:00:00 | B220: DEAL | C220: -23675 | D220: =ABS(RC[-1]) -> 23675
A221: 2017-04-17 오전 12:00:00 | B221: DAILYQUEST | C221: -652 | D221: =ABS(RC[-1]) -> 652
A222: 2017-04-17 오전 12:00:00 | B222: TWINKLECOUPLE | C222: -53 | D222: =ABS(RC[-1]) -> 53
A223: 2017-04-17 오전 12:00:00 | B223: GARDEN_PLANTSEED | C223: -811 | D223: =ABS(RC[-1]) -> 811
A224: 2017-04-17 오전 12:00:00 | B224: GARDEN_USE_BOOSTER | C224: -3988 | D224: =ABS(RC[-1]) -> 3988
A225: 2017-04-17 오전 12:00:00 | B225: GARDEN_REWARD | C225: -53369 | D225: =ABS(RC[-1]) -> 53369
A226: 2017-04-17 오전 12:00:00 | B226: CONSELLATION_OPEN | C226: -50 | D226: =ABS(RC[-1]) -> 50
A227: 2017-04-17 오전 12:00:00 | B227: ELF_SKILL_CHARGE | C227: -1058 | D227: =ABS(RC[-1]) -> 1058
A228: 2017-04-17 오전 12:00:00 | B228: SOUND_SOURCE_INIT_CHARGE | C228: -60 | D228: =ABS(RC[-1]) -> 60
A229: 2017-04-17 오전 12:00:00 | B229: WEDDING_PLAN | C229: -762 | D229: =ABS(RC[-1]) -> 762
A230: 2017-04-17 오전 12:00:00 | B230: WEDDING_GIVEMONEY | C230: -242 | D230: =ABS(RC[-1]) -> 242
A231: 2017-04-17 오전 12:00:00 | B231: DIVORCE_COST | C231: -400 | D231: =ABS(RC[-1]) -> 400
A232: 2017-04-17 오전 12:00:00 | B232: PETMATE | C232: -219 | D232: =ABS(RC[-1]) -> 219
A233: 2017-04-18 오전 12:00:00 | B233: BUYITEM | C233: -16021 | D233: =ABS(RC[-1]) -> 16021
A234: 2017-04-18 오전 12:00:00 | B234: DEAL | C234: -18065 | D234: =ABS(RC[-1]) -> 18065
A235: 2017-04-18 오전 12:00:00 | B235: DAILYQUEST | C235: -596 | D235: =ABS(RC[-1]) -> 596
A236: 2017-04-18 오전 12:00:00 | B236: TWINKLECOUPLE | C236: -49 | D236: =ABS(RC[-1]) -> 49
A237: 2017-04-18 오전 12:00:00 | B237: GARDEN_PLANTSEED | C237: -717 | D237: =ABS(RC[-1]) -> 717
A238: 2017-04-18 오전 12:00:00 | B238: GARDEN_USE_BOOSTER | C238: -3278 | D238: =ABS(RC[-1]) -> 3278
A239: 2017-04-18 오전 12:00:00 | B239: GARDEN_REWARD | C239: -50763 | D239: =ABS(RC[-1]) -> 50763
A240: 2017-04-18 오전 12:00:00 | B240: CONSELLATION_OPEN | C240: -150 | D240: =ABS(RC[-1]) -> 150
A241: 2017-04-18 오전 12:00:00 | B241: ELF_SKILL_CHARGE | C241: -772 | D241: =ABS(RC[-1]) -> 772
A242: 2017-04-18 오전 12:00:00 | B242: SOUND_SOURCE_INIT_CHARGE | C242: -30 | D242: =ABS(RC[-1]) -> 30
A243: 2017-04-18 오전 12:00:00 | B243: WEDDING_PLAN | C243: -381 | D243: =ABS(RC[-1]) -> 381
A244: 2017-04-18 오전 12:00:00 | B244: WEDDING_GIVEMONEY | C244: -20 | D244: =ABS(RC[-1]) -> 20
A245: 2017-04-18 오전 12:00:00 | B245: DIVORCE_COST | C245: -300 | D245: =ABS(RC[-1]) -> 300
A246: 2017-04-18 오전 12:00:00 | B246: PETMATE | C246: -107 | D246: =ABS(RC[-1]) -> 107
A247: 2017-04-19 오전 12:00:00 | B247: BUYITEM | C247: -13261 | D247: =ABS(RC[-1]) -> 13261
A248: 2017-04-19 오전 12:00:00 | B248: PRESENT | C248: -2 | D248: =ABS(RC[-1]) -> 2
A249: 2017-04-19 오전 12:00:00 | B249: DEAL | C249: -16097 | D249: =ABS(RC[-1]) -> 16097
A250: 2017-04-19 오전 12:00:00 | B250: DAILYQUEST | C250: -574 | D250: =ABS(RC[-1]) -> 574
A251: 2017-04-19 오전 12:00:00 | B251: TWINKLECOUPLE | C251: -58 | D251: =ABS(RC[-1]) -> 58
A252: 2017-04-19 오전 12:00:00 | B252: GARDEN_PLANTSEED | C252: -654 | D252: =ABS(RC[-1]) -> 654
A253: 2017-04-19 오전 12:00:00 | B253: GARDEN_USE_BOOSTER | C253: -3032 | D253: =ABS(RC[-1]) -> 3032
A254: 2017-04-19 오전 12:00:00 | B254: GARDEN_REWARD | C254: -52130 | D254: =ABS(RC[-1]) -> 52130
A255: 2017-04-19 오전 12:00:00 | B255: CONSELLATION_OPEN | C255: -150 | D255: =ABS(RC[-1]) -> 150
A256: 2017-04-19 오전 12:00:00 | B256: ELF_SKILL_CHARGE | C256: -768 | D256: =ABS(RC[-1]) -> 768
A257: 2017-04-19 오전 12:00:00 | B257: SOUND_SOURCE_INIT_CHARGE | C257: -20 | D257: =ABS(RC[-1]) -> 20
A258: 2017-04-19 오전 12:00:00 | B258: WEDDING_PLAN | C258: -381 | D258: =ABS(RC[-1]) -> 381
A259: 2017-04-19 오전 12:00:00 | B259: WEDDING_GIVEMONEY | C259: -1 | D259: =ABS(RC[-1]) -> 1
A260: 2017-04-19 오전 12:00:00 | B260: PETMATE | C260: -123 | D260: =ABS(RC[-1]) -> 123
A261: 2017-04-20 오전 12:00:00 | B261: BUYITEM | C261: -17701 | D261: =ABS(RC[-1]) -> 17701
A262: 2017-04-20 오전 12:00:00 | B262: DEAL | C262: -13157 | D262: =ABS(RC[-1]) -> 13157
A263: 2017-04-20 오전 12:00:00 | B263: DAILYQUEST | C263: -600 | D263: =ABS(RC[-1]) -> 600
A264: 2017-04-20 오전 12:00:00 | B264: TWINKLECOUPLE | C264: -54 | D264: =ABS(RC[-1]) -> 54
A265: 2017-04-20 오전 12:00:00 | B265: GARDEN_PLANTSEED | C265: -358 | D265: =ABS(RC[-1]) -> 358
A266: 2017-04-20 오전 12:00:00 | B266: GARDEN_USE_BOOSTER | C266: -18958 | D266: =ABS(RC[-1]) -> 18958
A267: 2017-04-20 오전 12:00:00 | B267: GARDEN_REWARD | C267: -45020 | D267: =ABS(RC[-1]) -> 45020
A268: 2017-04-20 오전 12:00:00 | B268: CONSELLATION_OPEN | C268: -60 | D268: =ABS(RC[-1]) -> 60
A269: 2017-04-20 오전 12:00:00 | B269: ELF_SKILL_CHARGE | C269: -602 | D269: =ABS(RC[-1]) -> 602
A270: 2017-04-20 오전 12:00:00 | B270: SOUND_SOURCE_INIT_CHARGE | C270: -120 | D270: =ABS(RC[-1]) -> 120
A271: 2017-04-20 오전 12:00:00 | B271: WEDDING_PLAN | C271: -254 | D271: =ABS(RC[-1]) -> 254
A272: 2017-04-20 오전 12:00:00 | B272: WEDDING_GIVEMONEY | C272: -32 | D272: =ABS(RC[-1]) -> 32
A273: 2017-04-20 오전 12:00:00 | B273: DIVORCE_COST | C273: -100 | D273: =ABS(RC[-1]) -> 100
A274: 2017-04-20 오전 12:00:00 | B274: PETMATE | C274: -234 | D274: =ABS(RC[-1]) -> 234